video_id,title,channel,time,url
shqLU7zMD7U,What Actually is under Sonic’s Gloves?🤔,VamiPuff,2026-06-12T13:51:37.753Z,https://www.youtube.com/watch?v=shqLU7zMD7U
TvI-Vj_ZnvA,Before vs After: Shin Sonic Chases People,Horror Skunx 2,2026-06-12T13:50:22.109Z,https://www.youtube.com/watch?v=TvI-Vj_ZnvA
3WthfpHKE0M,"If Sonic and Flash raced each other, the winner surprise you…😳",Loop Brain,2026-06-11T14:04:47.609Z,https://www.youtube.com/watch?v=3WthfpHKE0M
XkU1qdFekgE,NEVER GIFT THIS METAL SONIC TOY TO YOUR BROTHER ON HIS BIRTHDAY 🤖⚡😱,Vidbravo!,2026-06-11T14:03:10.882Z,https://www.youtube.com/watch?v=XkU1qdFekgE
f154TLq-bSk,Who is Controlling Metal Sonic in Sonic the Hedgehog 3?,VamiPuff,2026-06-11T14:01:47.416Z,https://www.youtube.com/watch?v=f154TLq-bSk
q8HG-rOqp0k,Sonic The Hedgehog 3 (2024) 3 Hedgehogs Teaser Poster Concept,Forky and Anya Fan 2009 (Jaziah Jones),2026-06-11T14:01:45.524Z,https://www.youtube.com/watch?v=q8HG-rOqp0k
EhhqT8z1HGM,DON’T GIFT METAL SONIC TOY TO YOUR BROTHER ‼️😱 #sonic  #viral,HoolahooksFacts,2026-06-11T13:58:48.182Z,https://www.youtube.com/watch?v=EhhqT8z1HGM
weNiEUIPXBk,Mario is MAD At Sonic!?,Aiishen,2026-06-11T13:57:40.020Z,https://www.youtube.com/watch?v=weNiEUIPXBk
viBnjliK37g,Shin Sonic Band - Good Karma (song) 💥🤩 #shinsonic #sonic #song,VisionBlox,2026-06-10T13:42:19.497Z,https://www.youtube.com/watch?v=viBnjliK37g
gRPYbsBTTdk,Did Tails actually Die in Sonic the Hedgehog 2?,VamiPuff,2026-06-10T03:43:13.843Z,https://www.youtube.com/watch?v=gRPYbsBTTdk
ThQxZTPyEgU,Challenge not laugh 😂😂 | Shin Sonic Sad Story #sonic #shinsonic,VisionBlox,2026-06-09T14:55:58.351Z,https://www.youtube.com/watch?v=ThQxZTPyEgU
jbBGNttippw,He Dug A Prison Tunnel Only With A Spoon For 20 Years #cartoon #foryou #fyp #usa #anime,Mitalks,2026-06-09T14:53:29.870Z,https://www.youtube.com/watch?v=jbBGNttippw
dHo1Wkihff8,The dark truth about sonic gloves...😱,Toon Secrets,2026-06-09T14:46:13.233Z,https://www.youtube.com/watch?v=dHo1Wkihff8
11Qqe0g_mHA,Is Dr. Eggman really Dead in Sonic the Hedgehog 3?,VamiPuff,2026-06-09T14:42:49.512Z,https://www.youtube.com/watch?v=11Qqe0g_mHA
JBSclh6iUaY,Little Sonic tries his best to protect family,Sonic & Amy Speed Rush,2026-06-09T14:42:47.605Z,https://www.youtube.com/watch?v=JBSclh6iUaY
WqPDWygwVbQ,"2025 Kids' Choice Awards FULL SHOW in 20 Minutes!! ft. Tyla, Salish Matter & MORE! | Nickelodeon",Nickelodeon,2026-06-03T14:20:48.262Z,https://www.youtube.com/watch?v=WqPDWygwVbQ
V_oGKN_1kpA,Salish Got Slimed Finally 💀💀 @jordanmatter,salishhhshorts,2026-06-03T14:20:03.894Z,https://www.youtube.com/watch?v=V_oGKN_1kpA
b-iTz5mMjBE,SONIC FIGHTS KNUCKLES IN REAL LIFE! *Who Will Win?*,ThatOneRandom Ginger,2026-05-31T15:11:58.894Z,https://www.youtube.com/watch?v=b-iTz5mMjBE
_6ozF0JiVXE,Merging Knuckles to MAX LEVEL SHIN SONIC,Fady,2026-05-31T15:09:47.715Z,https://www.youtube.com/watch?v=_6ozF0JiVXE
jC7D88P3WyY,SHIN SONIC TAPES Vs. SHIN KNUCLES! The Sonic Tapes Animation,Cartoon Games,2026-05-31T15:08:37.328Z,https://www.youtube.com/watch?v=jC7D88P3WyY
j74ZXKSTQYU,Shin Sonic - Liar (official song),Horror Skunx,2026-05-31T15:07:20.747Z,https://www.youtube.com/watch?v=j74ZXKSTQYU
cwJgOIBizMg,[999X SPEED] Shin Sonic - Liar (official song),Horror Skunx 2,2026-05-31T15:07:11.309Z,https://www.youtube.com/watch?v=cwJgOIBizMg
s7mR8lWMJAQ,[VOCALS vs FINAL] Shin Sonic - Liar (official song),Horror Skunx 2,2026-05-31T15:06:19.673Z,https://www.youtube.com/watch?v=s7mR8lWMJAQ
I6WN0nIpCGQ,Shin Sonic Band - Good Karma (official song),Horror Skunx,2026-05-31T15:05:33.472Z,https://www.youtube.com/watch?v=I6WN0nIpCGQ
gSPv52FtgbQ,Liar (Shin Sonic),Horror Skunx - Topic,2026-05-31T15:05:12.783Z,https://www.youtube.com/watch?v=gSPv52FtgbQ
shkqhB_UPpM,Shin Sonic Origin (Official Song),Horror Skunx 2,2026-05-31T07:14:44.402Z,https://www.youtube.com/watch?v=shkqhB_UPpM
i2w_nRNW0O4,Brawl Stars Sonic Rank UP #brawlstars,Rooxie,2026-05-31T06:29:15.203Z,https://www.youtube.com/watch?v=i2w_nRNW0O4
CKIpbT08RYg,Unboxing A SUPER RARE Dumpling?! 🥟⭐️,NichLmao,2026-05-31T06:22:36.988Z,https://www.youtube.com/watch?v=CKIpbT08RYg
huUpYzvCT9s,"pink Hulk vs Sonic, Shadow, Miles, Amy Rose, knuckles, Super Sonic, Silver Sonic",Versus Core Ai,2026-05-31T06:21:37.016Z,https://www.youtube.com/watch?v=huUpYzvCT9s
npGesmIJXBI,never play Roblox before doing your homework kids 😛 #fypシ゚viral #funny #roblox #gaming #challenge,NwankwofridayMishackTv,2026-05-31T06:21:06.872Z,https://www.youtube.com/watch?v=npGesmIJXBI
R6S9nHJQ6-A,3 Sonic Action Figures You Should NEVER Buy⚡🔥,TechSwarm,2026-05-31T06:20:04.752Z,https://www.youtube.com/watch?v=R6S9nHJQ6-A
hWEcOK5hzao,Becoming the Fastest in School… #minecraft,Mongo,2026-05-26T13:27:16.760Z,https://www.youtube.com/watch?v=hWEcOK5hzao
pxAQJSx5C4s,What if you brought LEGO to Ancient Egypt?,Mr. GlintBone,2026-05-26T12:41:11.349Z,https://www.youtube.com/watch?v=pxAQJSx5C4s
sty6H3YfxR4,POV Good Guy or Bad Guy - You Choose Sonic or Eggman????#sonic #sonicthehedgehog,Mr Buddy,2026-05-23T07:38:46.378Z,https://www.youtube.com/watch?v=sty6H3YfxR4
UUgK2aZmqFQ,Why Does Sonic Always Win?,ChaosDrive,2026-05-22T14:21:36.058Z,https://www.youtube.com/watch?v=UUgK2aZmqFQ
1_l4L-CcZVw,Sonic Was Never Supposed To Have Friends,ChaosDrive,2026-05-19T16:19:42.233Z,https://www.youtube.com/watch?v=1_l4L-CcZVw
IFQjrjHLRZ8,Sonic gets eepy,Sonic David,2026-05-19T16:18:29.821Z,https://www.youtube.com/watch?v=IFQjrjHLRZ8
3IWawgjUAb8,Who Is Actually SUPERSONIC?,ChaosDrive,2026-05-19T16:14:28.185Z,https://www.youtube.com/watch?v=3IWawgjUAb8
-h--lAANVrg,How Old Are the Sonic Characters?,ChaosDrive,2026-05-19T15:48:25.931Z,https://www.youtube.com/watch?v=-h--lAANVrg
zpam0aLzD-Q,Brawl Stars Sonic Rank UP #brawlstars,Rooxie,2026-05-19T15:48:03.247Z,https://www.youtube.com/watch?v=zpam0aLzD-Q
rM9qki2Z5a4,What Do Sonic’s Hands Actually Look Like?😧,Croco toon,2026-05-19T14:49:23.295Z,https://www.youtube.com/watch?v=rM9qki2Z5a4
e_DCuKQK9LE,“SILVER TRY TO SAVES HER BUT AMMY REALIZES SOMETHING CHANGE(NOOB TO HACKER) #sonic#noob#thehedgehog.,Hyper X Sonic,2026-05-19T14:49:14.490Z,https://www.youtube.com/watch?v=e_DCuKQK9LE
xUeK0piu034,Brawl Stars Sonic Rank UP #brawlstars,Rooxie,2026-05-19T14:46:32.384Z,https://www.youtube.com/watch?v=xUeK0piu034
PfDSTtywPag,Why is sonic designed as a hedgehog?,TechLine,2026-05-17T13:57:06.942Z,https://www.youtube.com/watch?v=PfDSTtywPag
tauEtGiV7Ow,Judo's Heartbreaking Story In Bluey 💔,CreativeBites,2026-05-17T13:55:55.368Z,https://www.youtube.com/watch?v=tauEtGiV7Ow
j81UtoA-LL8,Funny story 🤣🤣🤣 #sonic #game,Crazy Lab Team,2026-05-17T12:55:36.165Z,https://www.youtube.com/watch?v=j81UtoA-LL8
G3AGJAlPLok,Who's the fastest Sonic  Character? #youtubecommunity #ytshorts #ytviral #yt #ootd #trending,AWAMUO ,2026-05-17T12:54:11.430Z,https://www.youtube.com/watch?v=G3AGJAlPLok
ekz-PMJDct8,Robin's Mask Hides a DARK Memory He Can't Escape! 😱 #teentitansgo #robin #darksecrets,Cartoon Theories ,2026-05-17T08:07:08.816Z,https://www.youtube.com/watch?v=ekz-PMJDct8
orGdfECQSo4,Why is shadow slower than sonic?,TechLine,2026-05-17T08:02:10.953Z,https://www.youtube.com/watch?v=orGdfECQSo4
pE73VQJ0BlM,MY MOM STOPS ME FROM GOING TO CHURCH! 😭 #roblox,JimmyBlox,2026-05-17T08:02:06.920Z,https://www.youtube.com/watch?v=pE73VQJ0BlM
m5xOtVZ4Ejw,Titans Vs Teen Titans Power Up🥶🔥 Brawl Stars X Teen Titans Part-2 #brawlstars #titans #power,Wirix,2026-05-17T08:01:24.508Z,https://www.youtube.com/watch?v=m5xOtVZ4Ejw
j3EZM28iZUg,Three toys that got pulled from stores...,TheMiniBl4sters,2026-05-17T07:53:26.509Z,https://www.youtube.com/watch?v=j3EZM28iZUg
tibdfxcVT4g,Tails Visits Ohio,Sonic David,2026-05-17T07:52:55.440Z,https://www.youtube.com/watch?v=tibdfxcVT4g
-1dsIUBNRJI,Poor Sonic 1 ソニック・ザ・ヘッジホッグ- Marble Music #sonic #sonicthehedgehog #satisfying,Magic Marble Beats【3DCG】,2026-05-17T07:05:53.687Z,https://www.youtube.com/watch?v=-1dsIUBNRJI
e2Uq-RElwsA,SONIC VISITS OHIO,SGA,2026-05-17T06:50:58.404Z,https://www.youtube.com/watch?v=e2Uq-RElwsA
xS6aSdtfpjw,THIS BOY SAVED A LIFE! 😭 #roblox,The Roses,2026-05-17T06:47:22.069Z,https://www.youtube.com/watch?v=xS6aSdtfpjw
zfx_bKFWddc,Top three toys that parents hate,TheMiniBl4sters,2026-05-17T06:45:19.859Z,https://www.youtube.com/watch?v=zfx_bKFWddc
DIMULN7f5K0,Why does shadow remove his rings in sonic 3?,TechLine,2026-05-17T03:43:53.274Z,https://www.youtube.com/watch?v=DIMULN7f5K0
CUmjAQo7p0A,Say the word on beat @SonicDavid,SGA,2026-05-16T17:16:17.150Z,https://www.youtube.com/watch?v=CUmjAQo7p0A
Tnicslx135s,Toy #3 Looks Like Future Technology 😳 #viral #dadlifematters #facts,3CoreFacts,2026-05-16T17:12:19.817Z,https://www.youtube.com/watch?v=Tnicslx135s
M0LB6wMMvpo,Say the word on beat (level 2) @SonicDavid,SGA,2026-05-16T17:10:36.990Z,https://www.youtube.com/watch?v=M0LB6wMMvpo
JYqo6-8VSUA,SKIBIDI SONIC,SGA,2026-05-16T15:57:28.883Z,https://www.youtube.com/watch?v=JYqo6-8VSUA
153UOvuyWjI,Super Sonic VS Silver #epicbattle #sonic #supersonic,Ball Battle Arena,2026-05-16T15:56:07.854Z,https://www.youtube.com/watch?v=153UOvuyWjI
6enmTRneKqE,Who Is Sonic's Mum?,EGGPHILES,2026-05-16T15:54:50.822Z,https://www.youtube.com/watch?v=6enmTRneKqE
AEirV-Y50fg,Are Sonic’s Gloves Actually Part of His Body?,MEMODRIYA,2026-05-16T15:53:37.320Z,https://www.youtube.com/watch?v=AEirV-Y50fg
mq8x6mjj5Po,Roblox Magic Mirror Turns Into KPOP Demon Hunters 😮,nothayus,2026-05-15T15:01:51.865Z,https://www.youtube.com/watch?v=mq8x6mjj5Po
nYzvzisnajg,Why was Iron Man the only superhero to reveal his identity?,Quivergames,2026-05-15T15:01:19.752Z,https://www.youtube.com/watch?v=nYzvzisnajg
qDOQ8APaeWI,Robin Rescues Beast Boy From His Grave! | Tee Titans Go,Moving Animations,2026-05-14T14:25:55.176Z,https://www.youtube.com/watch?v=qDOQ8APaeWI
nxVEIQdbCXM,Metal Sonic VS Sonic ⚡🤖#MetalSonicVsSonic #MetalSonic #Sonic #SonicBattle #SEGA #GamingEdit,Drain duels,2026-05-14T14:24:00.475Z,https://www.youtube.com/watch?v=nxVEIQdbCXM
NFcUZ6YY85I,Who's Actually The Fastest Sonic Character?,ChaosDrive,2026-05-14T14:21:36.146Z,https://www.youtube.com/watch?v=NFcUZ6YY85I
fUmgzqcr6XI,Who own Teen Titans tower?.,Crumbling Toon,2026-05-12T14:35:32.672Z,https://www.youtube.com/watch?v=fUmgzqcr6XI
cjqwJ3QhET0,Color Matching Challenge - Help Sonic pick the right color MUSIC Sonic 2  ?,Yume,2026-05-12T14:35:01.443Z,https://www.youtube.com/watch?v=cjqwJ3QhET0
YE2Gi0WL0F0,Yangyang Draws on Kiki's Book! 😱 Peppa Pig House Decoration – Did She Take the Toys? Comment 👀,GamerYett ,2026-05-12T14:32:26.156Z,https://www.youtube.com/watch?v=YE2Gi0WL0F0
Fzjvl8h3tZs,Color Mixing Sonic? #color,CoLoR MiX,2026-05-12T14:29:31.282Z,https://www.youtube.com/watch?v=Fzjvl8h3tZs
nykonPiY63M,Super Sonic VS Shadow ⚡🖤#SuperSonicVsShadow #SonicVsShadow #SuperSonic #Shadow #SonicBattle,Drain duels,2026-05-12T14:28:34.684Z,https://www.youtube.com/watch?v=nykonPiY63M
M35rymLcPRE,Who REALLY Owns Titans Tower?! 😱 (Teen Titans Mystery),Brainrot Theory,2026-05-11T14:26:00.814Z,https://www.youtube.com/watch?v=M35rymLcPRE
5Xb9pmkjESo,Children who tricked the system 😨,English Universe Labz,2026-05-10T12:23:00.616Z,https://www.youtube.com/watch?v=5Xb9pmkjESo
w8CpCm4VCI8,Cyborg Didn’t Choose This !😔💔shorts #teentitansgo #cartoontheory #teentitans #cyborg,Whispered Unkn👁️wn,2026-05-10T12:22:58.067Z,https://www.youtube.com/watch?v=w8CpCm4VCI8
vKr1YeNVo-o,"Ball Throwing Challenge: Help Sonic defeat Shadow, Knuckles & Tails in the javelin throwing contest",TUGKAH,2026-05-10T12:17:28.993Z,https://www.youtube.com/watch?v=vKr1YeNVo-o
ojCSSiwDpAc,(PART 3) Toys that saved lives 😨,English Universe Labz,2026-05-10T12:13:54.344Z,https://www.youtube.com/watch?v=ojCSSiwDpAc
YzBuylNpbpg,Roblox Slippery VS Sticky!,Smarty Pants,2026-05-10T12:09:59.852Z,https://www.youtube.com/watch?v=YzBuylNpbpg
_rpl_xmvvqQ,How is sonic actually so fast?,TechLine,2026-05-10T12:04:09.164Z,https://www.youtube.com/watch?v=_rpl_xmvvqQ
RYbMmYt4Wdo,Kids Find Their  Toys With Magic🪄,BabyBillion,2026-05-10T09:05:55.215Z,https://www.youtube.com/watch?v=RYbMmYt4Wdo
Y4JJatKHQWc,#spiderman,devvprime ,2026-05-10T09:00:17.310Z,https://www.youtube.com/watch?v=Y4JJatKHQWc
su5MNxnrkvs,Princess are hungry #luigi #mario #peach #rosalina,MrToons,2026-05-10T08:54:33.239Z,https://www.youtube.com/watch?v=su5MNxnrkvs
I1zzb_lOqS4,#kids #toddlers #sisters #brothers #siblings,Fivynnn,2026-05-10T08:54:01.357Z,https://www.youtube.com/watch?v=I1zzb_lOqS4
UwTugTES-Vk,The Hedgehog Who's Faster Than Sonic,Johnny Vector,2026-05-10T08:45:07.706Z,https://www.youtube.com/watch?v=UwTugTES-Vk
Y0eNgGPVr7Q,Tails faces his fears!,Sonic David,2026-05-10T07:04:13.581Z,https://www.youtube.com/watch?v=Y0eNgGPVr7Q
bAaJY5bgqrQ,"Super Shadow & Sonic Vs Hulk, Ironman, Spiderman, Deadpool, Batman, Superman",Versus Core Ai,2026-05-10T05:13:48.271Z,https://www.youtube.com/watch?v=bAaJY5bgqrQ
lMNr8M23Dho,Big & Small Challenge Song for Kids 👶,SuPaBoo Shorts,2026-05-10T04:05:58.833Z,https://www.youtube.com/watch?v=lMNr8M23Dho
OpapHLHAs_c,Winter Clothes for Kids ❄️🧥 #english  #kids  #preschool  #learning  #cartoon,Kidshire,2026-05-10T04:04:45.832Z,https://www.youtube.com/watch?v=OpapHLHAs_c
gaDcpcnNBCw,Sonic 2 Shadow Puzzle Challenge! 🧩 - Can Sonic and his friends fit inside their shadows?,Yume,2026-05-10T03:56:33.057Z,https://www.youtube.com/watch?v=gaDcpcnNBCw
YbgrgNT2Qs0,Sonic continuously sings to help Shadow escape from Demon Knuckles,Mr Buddy,2026-05-10T03:53:46.991Z,https://www.youtube.com/watch?v=YbgrgNT2Qs0
K6Q573RMfEg,Homeschool Kindergarten Vocabulary | Compound Words for Kids (US/UK),Anokha,2026-05-10T03:25:17.181Z,https://www.youtube.com/watch?v=K6Q573RMfEg
nPTDoGhSkMo,Are You Happy or Sad? 😊😢 Fun Emotions Quiz for Kids | Learn English Feelings,ENGLISH MONSTER,2026-05-10T03:22:35.476Z,https://www.youtube.com/watch?v=nPTDoGhSkMo
4B9LHLEAUp8,🍬 Always Share! | Gumball Machine Fun Adventure,Chaka Kids | Kids Songs,2026-05-10T03:21:57.413Z,https://www.youtube.com/watch?v=4B9LHLEAUp8
6zVvliNnvTE,The Safety Challenge! 🚦🛑 Road Rules for Kids! 😲✨,Billy Blip Boss,2026-05-10T03:20:22.878Z,https://www.youtube.com/watch?v=6zVvliNnvTE
HRxU9O6cgOY,🪰 Don’t Hurt the Fly! Quick Story Time for Kids! #kids #story,KIDZOKI,2026-05-10T03:19:44.658Z,https://www.youtube.com/watch?v=HRxU9O6cgOY
g07Y33pOGCA,JOGO DA MEMÓRIA - DIVERTIDAMENTE / STITCH / MINIONS / LABUBU / BOBBIE GOODS / BARBIE,Tio Lucas,2026-05-10T03:18:54.653Z,https://www.youtube.com/watch?v=g07Y33pOGCA
27VP09LNG6Q,Learn 10 Homonyms for Kids 🎈💅🏻 | English Learning with Cartoon Animation,Anokha,2026-05-10T02:30:03.070Z,https://www.youtube.com/watch?v=27VP09LNG6Q
iE7-qVLbs2M,🚫 What Are Bad Habits? 🤔 #kids #learn,KIDZOKI,2026-05-10T02:27:49.156Z,https://www.youtube.com/watch?v=iE7-qVLbs2M
84BltZmToh8,Cardboard Shaving with Mom? 🪒😄 #kids #diy,MEOWJI,2026-05-10T02:25:35.202Z,https://www.youtube.com/watch?v=84BltZmToh8
jKGg4ReCKZc,🌈 Not 67! | Draw Rainbow 22 Instead | Fun Color Learning,Chaka Kids | Kids Songs,2026-05-10T02:25:09.721Z,https://www.youtube.com/watch?v=jKGg4ReCKZc
ozAtCk0tBwo,🦖 Dinosaur Quiz for Kids! | Can You Guess What Dino Eats? 🦕✨,MEOWJI,2026-05-10T02:24:41Z,https://www.youtube.com/watch?v=ozAtCk0tBwo
mmOP45oG5Ys,🚨 JOIN FAST! Playing Roblox With Subscribers LIVE 🔴,_Ujjal Doloi_,2026-05-10T02:20:47.021Z,https://www.youtube.com/watch?v=mmOP45oG5Ys
JNCbfD4d0FM,POV ⛩️ Kung Fu Panda Po and Tai Lung in the Dragon Run! 176% #animation,Duhan Show,2026-05-10T02:20:20.190Z,https://www.youtube.com/watch?v=JNCbfD4d0FM
JTuyWDzr9f4,What th is red Sonic doing 🤫,StevePlayLab,2026-05-10T02:17:13.910Z,https://www.youtube.com/watch?v=JTuyWDzr9f4
JFHdZ-8flLU,CALENDARIO SORPRESA POKEMON,Asbel Nazar,2026-05-10T02:15:42.395Z,https://www.youtube.com/watch?v=JFHdZ-8flLU
-KUfPGnFIKc,Would you save your parents or choose a phone? #peppapig #minecraft #peppa,Peppa Up,2026-05-10T02:12:42.325Z,https://www.youtube.com/watch?v=-KUfPGnFIKc
8ROvsjJSe4s,BARBIE MODELING | KAYCEE & RACHEL in WONDERLAND FAMILY #Barbie #BarbieChallenge #BarbieMakeover,KAYCEE & RACHEL in WONDERLAND FAMILY,2026-05-09T17:40:51.186Z,https://www.youtube.com/watch?v=8ROvsjJSe4s
6faNfnsXEW8,"Wiggly Ruler! 📏✨ Made from Slime, So Fun! 💚",Billy Blip Boss,2026-05-09T17:07:23.364Z,https://www.youtube.com/watch?v=6faNfnsXEW8
ZtTBwHsP0dQ,Aayu and Pihu - Favourite Kid Influencer | KCA 2022,Nickelodeon India,2026-05-09T17:06:59.709Z,https://www.youtube.com/watch?v=ZtTBwHsP0dQ
hjE5qyPA9wQ,knowledge or Money - which would you choose? #minecraft #peppa #peppapig,ryanisnotanoob,2026-05-09T02:25:44.279Z,https://www.youtube.com/watch?v=hjE5qyPA9wQ
S-0qZs17Nn0,Satisfying Cutting🥑🔪🍄🥝🍎🍉🍏🥬🍒🍗🍔 Foods Fruits Vegetables Toys ASMR live,Chindolls,2026-05-09T02:24:41.940Z,https://www.youtube.com/watch?v=S-0qZs17Nn0
f2Ap-AvoJJc,🌈 Rainbow Color Magic! Let's Mix Colors | Easy & Fun Learning for Kids,Chaka Kids | Kids Songs,2026-05-09T02:00:56.553Z,https://www.youtube.com/watch?v=f2Ap-AvoJJc
ouVarIOORvQ,🐭 How to Draw a Mouse from Numbers! ✏️🎨 #kids #art,MEOWJI,2026-05-07T15:12:35.039Z,https://www.youtube.com/watch?v=ouVarIOORvQ
NPB8wtvpRuA,Spoon Showdown: Which One Will Conquer the Water? 💦🥄,Funny Cubs | Cartoon for Kids,2026-05-07T15:12:08.361Z,https://www.youtube.com/watch?v=NPB8wtvpRuA
nJMEPKBI5Ns,Can You Guess the Emotions? 😊 #kids #learn,KIDZOKI,2026-05-07T15:10:43.738Z,https://www.youtube.com/watch?v=nJMEPKBI5Ns
3dcHNxZo4P0,How to turn a boring balloon into a water toy!🎈✨ #creative #voice #english,ThinkaDoos,2026-05-07T15:05:13.467Z,https://www.youtube.com/watch?v=3dcHNxZo4P0
w-PAWtb9sQo,Number Doodles! 🔢🎨 Fun Lesson for Kids! 🌟✨,Billy Blip Boss,2026-05-07T14:58:14.229Z,https://www.youtube.com/watch?v=w-PAWtb9sQo
O13_hnbxq-4,DRAMATIC PEPPA.,KAYCEE WONDERLAND,2026-05-06T17:11:37.882Z,https://www.youtube.com/watch?v=O13_hnbxq-4
odXONmvlwPs,Mr. Principal WILL BE THERE.... 😱 #simbochka #simba #animation #cat,Teeny Tiny Simba,2026-05-06T01:09:17.314Z,https://www.youtube.com/watch?v=odXONmvlwPs
OBviTIv5Hk4,Can You Name That Feeling? 🎭 Fun Emotions Craft for Kids #nurseryrhymes,ThinkaDoos,2026-05-06T01:03:37.628Z,https://www.youtube.com/watch?v=OBviTIv5Hk4
ME9DjUbi7MA,Rahul is making a Patrick Star doll for his sister. 🌟🤩#funny,3T CARRY ON ,2026-05-06T01:02:05.037Z,https://www.youtube.com/watch?v=ME9DjUbi7MA
ZC071oN5lwI,🎨 Color Mixing for Kids | 6 vs 7 Challenge,Chaka Kids | Kids Songs,2026-05-06T00:54:46.554Z,https://www.youtube.com/watch?v=ZC071oN5lwI
h2O47TKnrq8,🎨 DRAW on the BACK Challenge! So FUN 😍 #kids #fun,MEOWJI,2026-05-06T00:49:20.714Z,https://www.youtube.com/watch?v=h2O47TKnrq8
xhtcmg6IRNk,Robin Took Off His Mask And No One Expected This. #roblox #relatable #cartoon,Cartoonrants,2026-05-05T14:52:27.242Z,https://www.youtube.com/watch?v=xhtcmg6IRNk
L01qUKpsQO4,Sonic 3 The Unforgettable Moment 💀 Let's us talk without fists 😎 #sonicandknuckles #sonicmovie #fyp,TRY TO GET FAMOUS ,2026-05-05T14:43:47.112Z,https://www.youtube.com/watch?v=L01qUKpsQO4
syu50yL56bw,Teen Titans Literally Prove The Earth Is Flat,JustChillinX,2026-05-05T14:42:41.804Z,https://www.youtube.com/watch?v=syu50yL56bw
Elzc4YnZfDg,Не прыгни на коробку с LEGO!,BRUNO,2026-05-05T14:17:00.486Z,https://www.youtube.com/watch?v=Elzc4YnZfDg
fn7L6p62ad8,Why Does Sonic Only Have One Eye?,ChaosDrive,2026-05-05T14:07:11.605Z,https://www.youtube.com/watch?v=fn7L6p62ad8
i9WeBc5toVg,What Happened to Sonic's Parents?,ChaosDrive,2026-05-03T11:58:48.079Z,https://www.youtube.com/watch?v=i9WeBc5toVg
-C8Dndd-tVY,“The Person Who Killed Batman’s Parents” #viral, Loafingtun ,2026-05-03T11:46:38.600Z,https://www.youtube.com/watch?v=-C8Dndd-tVY
JvFExJazwOI,What's Sonics Real Name?  #relatable #sonic#relatable,Anaheim,2026-05-03T11:44:27.560Z,https://www.youtube.com/watch?v=JvFExJazwOI
EpQY1Ascn5k,#pokemon #pokemoncards  650 HP like,ISHAN ANSARI 202,2026-05-03T05:14:20.437Z,https://www.youtube.com/watch?v=EpQY1Ascn5k
im3crSq-ixI,Frozen Prehistoric Animals Found in Ice... Last One Will Shock You! #facts,Curly Scope,2026-05-03T05:13:34.475Z,https://www.youtube.com/watch?v=im3crSq-ixI
-P4mGDQZGzo,Making New Mod Hero Siren Head Toy‼️,Bilal Twins,2026-05-03T05:10:55.087Z,https://www.youtube.com/watch?v=-P4mGDQZGzo
ndF7fzqA_nQ,The Saddest Ending of Teen Titans You Didn’t Notice 😢💔shorts #horrorstories#cartoontheory#teentitans,Whispered Unkn👁️wn,2026-05-03T05:10:45.827Z,https://www.youtube.com/watch?v=ndF7fzqA_nQ
YGl2o2tROWY,What Does Sonic The Hedgehog's Hand Actually Look Like 👀,JC Theory,2026-05-03T05:09:33.468Z,https://www.youtube.com/watch?v=YGl2o2tROWY
DJ_U00KRN-Y,Did you know why Shin Sonic has two mouths?,Raikun shorts,2026-05-03T05:08:05.230Z,https://www.youtube.com/watch?v=DJ_U00KRN-Y
wboWtRog61M,3 Dolls Not Recommended for Kids 😳 (Number 3 Feels Too Real!),3 In The World,2026-05-03T05:06:01.939Z,https://www.youtube.com/watch?v=wboWtRog61M
_XCcpAs_RkQ,Toys that saved lives 😨,English Universe Labz,2026-05-03T03:40:31.552Z,https://www.youtube.com/watch?v=_XCcpAs_RkQ
bNGWr_JJXlQ,Why does Sonic never take off his shoes?,Quivergames,2026-05-03T03:39:58.935Z,https://www.youtube.com/watch?v=bNGWr_JJXlQ
7hx3eTd_6KY,did you knew ? #roblox #skeay #rantshorts,Skeay_,2026-05-03T03:30:14.286Z,https://www.youtube.com/watch?v=7hx3eTd_6KY
8V5fjgD2Kb8,Do Not Make Slime,Brandon’s Randoms,2026-04-27T13:03:02.146Z,https://www.youtube.com/watch?v=8V5fjgD2Kb8
0-QkVHnWS4Q,Did you know Sonic was a Rabbit Before?,Raikun shorts,2026-04-27T12:59:31.834Z,https://www.youtube.com/watch?v=0-QkVHnWS4Q
bXGpt0R36XY,Why didn’t Sonic take off his glove when the BOMB got stuck to him?,Quivergames,2026-04-26T13:45:39.134Z,https://www.youtube.com/watch?v=bXGpt0R36XY
B5HEzzCqrNA,Most Dangerous McDonalds Happy Meal Toy Ever — Controversial Fitness Toy 🪀,Infamazing,2026-04-26T13:43:32.526Z,https://www.youtube.com/watch?v=B5HEzzCqrNA
P1tSVe8BNnI,POV Mario Color Matching Game! Support Princess Peach Toadstool Find Her Colors,GTA Toon,2026-04-26T05:23:04.008Z,https://www.youtube.com/watch?v=P1tSVe8BNnI
tM7fuaS4WV8,Who ACTUALLY are Sonics parents?,Quivergames,2026-04-26T05:17:43.438Z,https://www.youtube.com/watch?v=tM7fuaS4WV8
FHvBs5nnXJY,Did you know Bowser doesn’t actually want Princess Peach for love?,Raikun shorts,2026-04-26T04:26:45.758Z,https://www.youtube.com/watch?v=FHvBs5nnXJY
9COO-LtXU6k,“The Teen Titans Aren’t Actually Teenagers!, Loafingtun ,2026-04-25T16:52:39.573Z,https://www.youtube.com/watch?v=9COO-LtXU6k
n0A1Jx_m-rA,Raven’s 16th Birthday Turns Into a Nightmare 😳 (Teen Titans Secret),XyraNana,2026-04-25T16:49:51.291Z,https://www.youtube.com/watch?v=n0A1Jx_m-rA
ATJqYHUFJrU,Why aren’t Tails and Knuckles in the Sonic 4 trailer?,Quivergames,2026-04-25T16:48:48.626Z,https://www.youtube.com/watch?v=ATJqYHUFJrU
rv8UvC3Nhkk,How is Sonic So Fast?,Justabtanything,2026-04-25T16:42:43.033Z,https://www.youtube.com/watch?v=rv8UvC3Nhkk
Fri1UzP_-Ao,small creator not supported #cr7 #roblox #robloxfriends #stumbleguys #games,Flash king ,2026-04-25T16:41:54.791Z,https://www.youtube.com/watch?v=Fri1UzP_-Ao
W4Joi7nGi7U,Water Toy Prank! 😂 🔫,NichLmao,2026-04-25T14:50:25.027Z,https://www.youtube.com/watch?v=W4Joi7nGi7U
oQFzjKwBqgg,How Old Are The Sonic Characters?,Justabtanything,2026-04-25T14:49:57.022Z,https://www.youtube.com/watch?v=oQFzjKwBqgg
nqK0Ks6LgNs,Why Sonic Is Blue? 😱💙⚡ #sonic #theory,Detective Hank,2026-04-25T14:45:38.528Z,https://www.youtube.com/watch?v=nqK0Ks6LgNs
xTKKAbNwcCY,Kids Play With Paper Toys 🍃,BabyBillion,2026-04-19T14:21:33.773Z,https://www.youtube.com/watch?v=xTKKAbNwcCY
FCyhHASCxkg,Kids Learn To Share Slime 🤗,BabyBillion,2026-04-19T14:05:21.648Z,https://www.youtube.com/watch?v=FCyhHASCxkg
_-Je_D13Jro,Jeje makes a princess carriage 👸🐎,Doodle Galaxy TV,2026-04-19T06:15:23.737Z,https://www.youtube.com/watch?v=_-Je_D13Jro
bJ3PGNOA1kg,One Toy or Two? 🧸😲 | Big Sister Sierra Teaches Sharing 💛,Sierra and Rhia English,2026-04-19T06:13:54.137Z,https://www.youtube.com/watch?v=bJ3PGNOA1kg
P6FA0625pqc,Creative Art Ideas #drawing #cricket #trending #viral #art #kids #youtubeshorts #ipl,Golu Molu Kids 🚸,2026-04-16T13:51:56.768Z,https://www.youtube.com/watch?v=P6FA0625pqc
j2A-MKieCH0,Tips To Wash Your Body! #kids #learn,MEOWJI,2026-04-16T13:47:07.354Z,https://www.youtube.com/watch?v=j2A-MKieCH0
kBeSSY9aKbk,Count to ten with EGGS!🪺 #preschool #kidssongs #kidsvideo #counting,Pancake Manor - Kids Songs,2026-04-16T13:46:22.833Z,https://www.youtube.com/watch?v=kBeSSY9aKbk
FvpJ8-fJsOQ,🌈🚚 Refill the Truck with Colors! Fun Learning for Kids 🎨 #kids #fun,KIDZOKI,2026-04-16T13:44:31.208Z,https://www.youtube.com/watch?v=FvpJ8-fJsOQ
CdT3LV5aemE,Silly English Words for Kids! What’s a Booger?👃 What’s Ear Wax? 🤢,Maya and Mary,2026-04-16T13:41:58.632Z,https://www.youtube.com/watch?v=CdT3LV5aemE
ASpfvZUJg3o,"Robin Took Off His Mask, And Everyone Went Silent #roblox #relatable #cartoon",sozexclip,2026-04-13T14:01:04.955Z,https://www.youtube.com/watch?v=ASpfvZUJg3o
svQN_do9WKw,He Died Last Year… So Who Saved Her? 🧐💀 #roblox #robloxstory,Afe,2026-04-06T17:45:15.166Z,https://www.youtube.com/watch?v=svQN_do9WKw
cs2S_WwKbAo,who deserves to be the princess🥺 #tocaboca  #tocalifeworld,Saniaa Channel,2026-04-06T17:43:54.044Z,https://www.youtube.com/watch?v=cs2S_WwKbAo
MZtMAIW_H_M,I'm sorry I couldn't save you in time baby…💔🥹 #lego #puppy #dogloss  #dogs #doglove #rip #fyp,SnapBrick Pets,2026-04-06T17:43:24.511Z,https://www.youtube.com/watch?v=MZtMAIW_H_M
NbGU4A6CJkE,She was BORN with GREEN HAIR! #roblox #brookhavenrp,Danny Roblox,2026-04-06T17:42:14.629Z,https://www.youtube.com/watch?v=NbGU4A6CJkE
