video_id,title,channel,time,url
xzqBLNr4z8k,What would You do if you were me?🤔💬👇Ever seen product like this before?🧱 #couple #lego #gift,The Brick Couple,2026-04-06T17:40:34.916Z,https://www.youtube.com/watch?v=xzqBLNr4z8k
YMj0S-OPnaY,Have you ever noticed the weird things going on in Peppa Pig? #animation #anime #peppapig #cartoon,CMCM009,2026-04-06T17:40:12.298Z,https://www.youtube.com/watch?v=YMj0S-OPnaY
-SE8r2MabJc,I always loves his mother.#hearttouching #childrenmovie,CineSpotlight,2026-04-06T17:40:09.539Z,https://www.youtube.com/watch?v=-SE8r2MabJc
7NKt9t4TzZQ,I'm so sorry I didn’t save you in time baby...💔😔 #lego #puppy #dogloss #rip #dogs #doglove #fyp,SnapBrick Pets,2026-04-06T17:36:12.108Z,https://www.youtube.com/watch?v=7NKt9t4TzZQ
tFVnadmnn7c,"December 7, 2025",The Collins Kids Family,2026-04-06T17:32:14.029Z,https://www.youtube.com/watch?v=tFVnadmnn7c
uoSbDXDInHg,The truth about Frozen..,DillyPickle,2026-04-06T17:31:38.368Z,https://www.youtube.com/watch?v=uoSbDXDInHg
Ysaxrxt7lOw,100 ROBUX GIVEAWAY! | DONATING ROBUX TO VIEWERS! | REAL LIVE STREAM | Pls Donate | ROBLOX,Rxzav,2026-04-06T17:25:57.939Z,https://www.youtube.com/watch?v=Ysaxrxt7lOw
7cH8qnNFFBs,He swore he was the real Sonic… but the truth soon appeared 🤔⚡😱,Super Sonicous,2026-04-06T16:29:14.860Z,https://www.youtube.com/watch?v=7cH8qnNFFBs
Hcc9cJCh4cI,He Protected Him from the Bullies 😇💙,Super Sonicous,2026-04-06T15:01:28.584Z,https://www.youtube.com/watch?v=Hcc9cJCh4cI
NTMrAg-XBRE,From Accident to Art 😱🎨~ miniwood toy-wood working art skill wood / handcrafts #gamtng,No olty op,2026-04-04T15:40:20.291Z,https://www.youtube.com/watch?v=NTMrAg-XBRE
FpJLzyPVWvc,"Roblox Kiss, Marry, Kill!",Johnny and Marty,2026-04-04T15:39:04.655Z,https://www.youtube.com/watch?v=FpJLzyPVWvc
ZoArwP6coW0,Spider-Man or the Boy?😱 #spiderman,Moscow Spider,2026-04-04T15:34:24.273Z,https://www.youtube.com/watch?v=ZoArwP6coW0
G-rgWNk3wws,comment who the perpetrator is🤔#shrots #usa #english #funny #animation,Talin Cute,2026-04-04T15:27:48.767Z,https://www.youtube.com/watch?v=G-rgWNk3wws
CuL2mONvD58,Paranormal House Horror Story 😳 #scary #horrorstory #horrorstories #scarystories,Shadow Tales Roblox,2026-04-04T15:23:26.680Z,https://www.youtube.com/watch?v=CuL2mONvD58
5TD-TgDJJeg,Dad’s Dangerous Race 🚗🏁~ miniwood toy-wood working art skill wood / handcrafts #gamtng,No olty op,2026-04-04T15:21:24.126Z,https://www.youtube.com/watch?v=5TD-TgDJJeg
JYYGPdf4OYg,The Darkest Tom and Jerry Scene… Did Jerry Actually Die? #cartoon #tomandjerry,Hidden Theory Zone,2026-04-04T15:13:27.992Z,https://www.youtube.com/watch?v=JYYGPdf4OYg
ByA25qqLYwI,Sonic and Baldi Best Friends | Sonic Hugged Baldi Secret#sonic#baldi,jojo flick toon ,2026-04-04T15:12:12.172Z,https://www.youtube.com/watch?v=ByA25qqLYwI
Fz3uFl5ut3Q,She had the whole car customized for her despicable husband,miooshorts,2026-04-02T14:57:10.175Z,https://www.youtube.com/watch?v=Fz3uFl5ut3Q
G3mwKHnGWUc,¡Compró un Hot Wheels y encontró ESTO dentro! 😱,Banette,2026-04-02T14:55:29.145Z,https://www.youtube.com/watch?v=G3mwKHnGWUc
N93HAVxZZd4,Invisible Toy Car Is Real 🤯🔥,Gab Facts ,2026-04-02T14:50:58.937Z,https://www.youtube.com/watch?v=N93HAVxZZd4
geirWBd2ics,Did You Know Sonic Had a Girlfriend | Sonic and Amy Secret#sonic,jojo flick toon ,2026-04-01T14:04:01.721Z,https://www.youtube.com/watch?v=geirWBd2ics
J9vMtNJl1xw,Sonic Brother Part 4 | Sonic Brother vs Shadow | Sonic Dark Secret #sonic,jojo flick toon ,2026-04-01T14:01:55.321Z,https://www.youtube.com/watch?v=J9vMtNJl1xw
TXDt6ruZiv4,I Was Born Twice 👼#roblox  #brookhavenrp,StarPlayz,2026-04-01T14:01:11.193Z,https://www.youtube.com/watch?v=TXDt6ruZiv4
zDoH_0VDeRo,Gwen stacy + Lily lovebirds💜🩷 #poppyplaytime  #digitalart #ytshorts #spiderman #spiderverse,Janavee Gauswami,2026-04-01T14:01:04.835Z,https://www.youtube.com/watch?v=zDoH_0VDeRo
1VnrTMH2FkQ,Pick your Lego Ninjago airplane,Brix 4 Life,2026-04-01T13:58:25.536Z,https://www.youtube.com/watch?v=1VnrTMH2FkQ
5_i8WRMUONM,His Toys Disappeared After He Tortured Them,ClownOrbit8,2026-04-01T13:54:48.698Z,https://www.youtube.com/watch?v=5_i8WRMUONM
_uyowEu_2fI,Should you trust Toy Chica lose her Beak? #fnaf #fivenightsatfreddys,They Who See,2026-04-01T13:54:47.403Z,https://www.youtube.com/watch?v=_uyowEu_2fI
uhXz5ImQ4Tg,Teen Titans Are Hiding Their Real Age 😨 #teentitansgo,screen spooky ,2026-03-31T03:18:35.324Z,https://www.youtube.com/watch?v=uhXz5ImQ4Tg
YJRhJaTv2Mc,Sonic’s Dark Secret 😱🦔 #mario #bike,Detective Hank,2026-03-31T03:08:46.118Z,https://www.youtube.com/watch?v=YJRhJaTv2Mc
yLcZRN4YsWY,Sonic vs Baldi | Why Sonic Ran From His Best Friend|sonic|baldi,jojo flick toon ,2026-03-31T03:07:05.885Z,https://www.youtube.com/watch?v=yLcZRN4YsWY
l4BBgMP9j94,Sonic Dark Secret Part 2 | Sonic Lost Brother Returns | Sonic Hidden Brother Story#sonic,jojo flick toon ,2026-03-22T12:30:53.055Z,https://www.youtube.com/watch?v=l4BBgMP9j94
FymoJ0IrkrM,3 Animal Toys So Cute Kids Think They’re Real Pets‼️ #3 Can Actually EAT‼️ 😱,3 Fact Rush,2026-03-22T05:50:06.602Z,https://www.youtube.com/watch?v=FymoJ0IrkrM
Jr2cTOqNq9Q,Sonic Dark Secret | Sonic Has a Hidden Brother More Dangerous Than Him#sonic,jojo flick toon ,2026-03-22T05:48:06.863Z,https://www.youtube.com/watch?v=Jr2cTOqNq9Q
JeDdKLS1ZJE,TODAY Mila's Slime comes out on peachybbies.com & you local Target!,The Anazala Family ,2026-03-21T19:12:52.510Z,https://www.youtube.com/watch?v=JeDdKLS1ZJE
kq5XhHDj54M,Giving Barbie a Pink Palm Puff Hoodie,EverythingDolls,2026-03-21T19:05:58.691Z,https://www.youtube.com/watch?v=kq5XhHDj54M
pvTvWnQGwj8,Zootopia2 JUDY paper iphone unboxing💕 #iphone #papercraft #paperdiy #zootopia2 #unboxing #asmrvideo,kiwi Paper,2026-03-21T19:04:19.407Z,https://www.youtube.com/watch?v=pvTvWnQGwj8
UzN_mK7QW5s,Turning Barbie into Taylor Swift: “Life of a Showgirl”,EverythingDolls,2026-03-21T18:57:50.235Z,https://www.youtube.com/watch?v=UzN_mK7QW5s
vbN7usxc-pU,My mother is a mermaid.#fantasy #childrenmovie,MushroomScreen,2026-03-21T18:47:03.450Z,https://www.youtube.com/watch?v=vbN7usxc-pU
veuxlvt-psc,What Does Sonic’s Bare Hands ACTUALLY Look Like? #sonicthewerehog #sonicgloves,Chyz,2026-03-21T11:44:14.189Z,https://www.youtube.com/watch?v=veuxlvt-psc
03yDRgcIkyQ,Are parents responsible for their children's obesity?#series,Ivan Romaniukmovie,2026-03-21T11:34:40.771Z,https://www.youtube.com/watch?v=03yDRgcIkyQ
TAK6vQqa2aA,I Taught My Wife a Lesson… BABY SWAP Prank! 😂🍼😱 #prankwars #couplegoals #funnyvideos,Prank Me Later,2026-03-21T11:33:09.254Z,https://www.youtube.com/watch?v=TAK6vQqa2aA
MCEwg_Ee9p8,3 Dangerous Kids Toys You Should NEVER Buy (Shocking #3!) 😳,TECHUNBOX USA,2026-03-21T11:21:03.982Z,https://www.youtube.com/watch?v=MCEwg_Ee9p8
0HicYWti4Qo,The father's negligence led to the child's drowning and death. #3d #3danimation,laing3D,2026-03-21T11:09:42.498Z,https://www.youtube.com/watch?v=0HicYWti4Qo
dsLSOQwk2k8,INSANE Roblox Live Stream! You Won’t Believe This 😳🔥 DAY 16,The-Airbaaz ,2026-03-21T11:08:05.011Z,https://www.youtube.com/watch?v=dsLSOQwk2k8
lhiCMEoTxqo,The Flight Attendant’s Revenge That Went Too Far… Princess Died!” 😱,VibeVerse,2026-03-21T11:00:49.898Z,https://www.youtube.com/watch?v=lhiCMEoTxqo
OhwJf2RH7Yo,Haunted House Horror Story 😳 #horrorstory #scary #horrorstories #horror,Shadow Tales Roblox,2026-03-21T10:42:50.408Z,https://www.youtube.com/watch?v=OhwJf2RH7Yo
KIz8zRBIiwU,He was fed up with his brother's bullying and transformed 😱,SEGATOY,2026-03-21T10:31:30.434Z,https://www.youtube.com/watch?v=KIz8zRBIiwU
vsY-HMIlLeY,SONIC was meant to be a HUMAN at First,MarioBrosVerse,2026-03-21T10:27:08.463Z,https://www.youtube.com/watch?v=vsY-HMIlLeY
2Uo-Vurjars,Which Lego car? Are you picking?,Brix 4 Life,2026-03-21T10:21:57.528Z,https://www.youtube.com/watch?v=2Uo-Vurjars
HjRO1sSrr4s,The Sad Truth About Muffin In Bluey 💔,CreativeBites,2026-03-16T15:40:21.330Z,https://www.youtube.com/watch?v=HjRO1sSrr4s
3aWmgl_81k8,Who’s the Most Beautiful Person In Your House?🤔🏠 #roblox,babypiscess,2026-03-15T17:15:36.959Z,https://www.youtube.com/watch?v=3aWmgl_81k8
KiY68C45EGw,HUGE dumpling UNBOXING! #viral #trending #fivebelow #unboxing #haul,Chyler Emery,2026-03-15T17:09:25.320Z,https://www.youtube.com/watch?v=KiY68C45EGw
iGAi6OgWzD4,ROBLOX ULTIMATE SQUID GAME GLASS BRIDGE | LIVE DAY 41,Ansi is Live ,2026-03-15T17:08:46.218Z,https://www.youtube.com/watch?v=iGAi6OgWzD4
L6yTPZiKfjg,Biggest Cartoons From Different Countries 🌍📺 #cartoons #map #top #facts #naruto,Geo World,2026-03-15T16:55:27.413Z,https://www.youtube.com/watch?v=L6yTPZiKfjg
hbXfAY8PrjE,How long would it actually take to pick up a BILLION dollars 💵🤑,Story Snap,2026-03-15T13:49:59.241Z,https://www.youtube.com/watch?v=hbXfAY8PrjE
abAHWcAWNtY,Does Sonic owe Shadow a thank you?#Sonic#Shadow#SonicTheHedgehog#TeamSonic#TeamShadow #SonicFans,SONIC_ME,2026-03-15T13:48:09.306Z,https://www.youtube.com/watch?v=abAHWcAWNtY
grS4fZN8oZE,Why sonic never takes off his gloves ‼️🤯😱,Squid Empire ,2026-03-15T13:47:14.490Z,https://www.youtube.com/watch?v=grS4fZN8oZE
diLYFha0tL8,"Margo, Edith And Agnes Were Never Real Sisters In Despicable Me… 💔",CreativeBites,2026-03-15T13:43:53.831Z,https://www.youtube.com/watch?v=diLYFha0tL8
1fRS-oaF0s4,How Many Balls Will Hold Marty In Roblox?,Johnny and Marty,2026-03-15T07:27:17.242Z,https://www.youtube.com/watch?v=1fRS-oaF0s4
B6BL1gQgTJU,Color Matching Challenge - Help RUMI pick the right hair MUSIC Roblox 4 | KPop Demon Hunters,Buddy Toon,2026-03-15T07:23:53.777Z,https://www.youtube.com/watch?v=B6BL1gQgTJU
s3MFilOAgtM,Creepy Alien Secret You Missed In Bluey 😱,CreativeBites,2026-03-15T07:19:14.154Z,https://www.youtube.com/watch?v=s3MFilOAgtM
gl0Q2EaY4f4,Raquel Glaze is live! Happy Sunday Everyone 3/15/26 from #amazing #granny #trending #toys,Raquel Glaze,2026-03-15T07:15:46.738Z,https://www.youtube.com/watch?v=gl0Q2EaY4f4
h73xn5SkrlY,Did You Know Tom From Tom and Jerry Has the Saddest Family Story?,CartoonTheories,2026-03-15T07:10:35.428Z,https://www.youtube.com/watch?v=h73xn5SkrlY
aCicrT2RIAk,Princess Peach Is Evil #mariobros,Screen Secrets,2026-03-15T06:20:50.537Z,https://www.youtube.com/watch?v=aCicrT2RIAk
GRoGdvsi18M,What happens if you transform into the Hulk in Lego Marvel Super Heroes #videogames #legogames #lego,oreodzilla,2026-03-15T04:34:17.126Z,https://www.youtube.com/watch?v=GRoGdvsi18M
Gva_m3f1tTE,The Minecraft Challenge That No One Can Beat! #minecraft,Praxis,2026-03-14T15:09:24.472Z,https://www.youtube.com/watch?v=Gva_m3f1tTE
0vq3I-yOdUs,Which Lego plane would you pick?,Brix 4 Life,2026-03-14T15:09:02.432Z,https://www.youtube.com/watch?v=0vq3I-yOdUs
WBI3hRd9_xM,They Treated Him Badly Because of His Art 😭😢,Super Sonicous,2026-03-14T15:06:16.119Z,https://www.youtube.com/watch?v=WBI3hRd9_xM
ffH2xdpVNbw,"IF YOUR DAD’s NAME START FROM ANY LATTER FROM A TO Z , YOUR OUT , JUST KIDDING 😂 #funny #roblox",DAMAS_BLOX-US,2026-03-14T15:05:38.894Z,https://www.youtube.com/watch?v=ffH2xdpVNbw
mxw7bq0GHd4,“The Day the Teen Titans Almost Killed Raven…” 😱,CartoonTheories,2026-03-14T15:00:37.690Z,https://www.youtube.com/watch?v=mxw7bq0GHd4
-d7DtPnV13E,#storytime #peppapig #cartoon,Zegas Bolih,2026-03-14T14:53:47.979Z,https://www.youtube.com/watch?v=-d7DtPnV13E
X1tNoqx05Ok,Mythical Tales of ADVENTURE! 🦄🐉 | Tom & Jerry | #KidsCartoons @wbkids,WB Kids,2026-03-14T13:15:40.480Z,https://www.youtube.com/watch?v=X1tNoqx05Ok
22tc3Ru4hpk,Sprunki OC numberblocks VS Roblox animation #animation #sprunki #numberblocks #robloxanimation,Fal Animations,2026-03-14T05:44:29.954Z,https://www.youtube.com/watch?v=22tc3Ru4hpk
Cjqfu5GZhO8,Minecraft Movie Without CGI😭,Starshow,2026-03-14T05:40:49.041Z,https://www.youtube.com/watch?v=Cjqfu5GZhO8
xe_sOnHtIH0,Big Figs revert to their normal state in Lego Marvel #videogames #legogames #lego,oreodzilla,2026-03-14T05:34:38.086Z,https://www.youtube.com/watch?v=xe_sOnHtIH0
fPs5Hw5aXA8,She stuffed her mouth full of cotton just to play the princess perfectly.,Penguin Movie,2026-03-14T04:20:56.308Z,https://www.youtube.com/watch?v=fPs5Hw5aXA8
a60dhIZt3qQ,What If Bluey And Bandit Was Trapped In A Same Dream? 🤯,CreativeBites,2026-03-14T04:19:45.279Z,https://www.youtube.com/watch?v=a60dhIZt3qQ
cLhl3I52IT4,Is Jinu mean to his toys?,TrueToon,2026-03-14T04:03:22.168Z,https://www.youtube.com/watch?v=cLhl3I52IT4
KETb4Iqj-8o,Top 3 Toys Parents Regret Buying For Kids! 😅❤️,Kyro Scope,2026-03-14T04:02:18.633Z,https://www.youtube.com/watch?v=KETb4Iqj-8o
598Rh-2IdJw,The Cookie Contest Hero  #kidslearning #quotes #bedtimestories #kidsyoutube #familyfriendly #funny,SmartTales,2026-03-14T04:02:15.027Z,https://www.youtube.com/watch?v=598Rh-2IdJw
gM8sWJ5vDbc,Oldest Toy On Earth,Infamazing,2026-03-14T04:00:21.473Z,https://www.youtube.com/watch?v=gM8sWJ5vDbc
EHkFTjNAKo8,3 Toys So Addictive Kids Forget Their iPads 😲,TECHUNBOX USA,2026-03-13T13:51:09.512Z,https://www.youtube.com/watch?v=EHkFTjNAKo8
USSYN4xB7X0,Tom Eats Jerry!?   #tomandjerry #roblox,TheDunkingDoNot,2026-03-13T13:50:32.580Z,https://www.youtube.com/watch?v=USSYN4xB7X0
qHydplvAI9o,The 3 Scariest Toys in the World 😱,Wow Fact,2026-03-13T13:47:28.318Z,https://www.youtube.com/watch?v=qHydplvAI9o
XTLp1_D5uww,What If Bingo Never Woke Up In Bluey? 😨,CreativeBites,2026-03-13T13:46:02.699Z,https://www.youtube.com/watch?v=XTLp1_D5uww
t7a3fAvRp-Q,Tom and Jerry Talked!?    #tomandjerry #roblox,TheDunkingDoNot,2026-03-13T13:45:40.248Z,https://www.youtube.com/watch?v=t7a3fAvRp-Q
V1Jf90ML6xE,The Sad Truth About Coco In Bluey 💔,CreativeBites,2026-03-13T13:45:08.414Z,https://www.youtube.com/watch?v=V1Jf90ML6xE
dAuPKDqP_Qg,The Sad Truth About Bingo From Bluey 💔,CreativeBites,2026-03-11T14:14:38.278Z,https://www.youtube.com/watch?v=dAuPKDqP_Qg
cEbzWXQ3CJc,What If Jean Luc Never Returned In Bluey? 💔,CreativeBites,2026-03-11T14:10:41.924Z,https://www.youtube.com/watch?v=cEbzWXQ3CJc
2ixPWeWh8KM,"Venom, Orange Hulk, The Flash, Batman & Deadpool vs Zombies – Ultimate Chaos vs Undead! 🧟‍♂️⚔️🔥",Win or Defeat,2026-03-04T13:21:12.714Z,https://www.youtube.com/watch?v=2ixPWeWh8KM
iTIWowSJ4ew,CAN YOU survive this night with Foxy FNAF Animation..,They Who See,2026-02-25T15:48:01.456Z,https://www.youtube.com/watch?v=iTIWowSJ4ew
XoVnWA9drNU,Sonic’s Lost Movie Set,Zenrix Edits,2026-02-25T15:47:09.117Z,https://www.youtube.com/watch?v=XoVnWA9drNU
J9BZdOpXH8w,SLIPPERY vs SLICKY STAIRS In Roblox!,Brook and Riley,2026-02-24T14:34:01.234Z,https://www.youtube.com/watch?v=J9BZdOpXH8w
YlMP955wMGs,Minecraft Moobie #minecraftmovie,SGA,2026-02-24T14:27:01.603Z,https://www.youtube.com/watch?v=YlMP955wMGs
U-7CEe7V4lc,He got so tall… he couldn’t even fit in the school! 🤣🏫⬆️,Super Sonicous,2026-02-24T14:25:42.053Z,https://www.youtube.com/watch?v=U-7CEe7V4lc
4T62bfjhFew,ONE MISTAKE = GAME OVER ROBLOX ULTIMATE SQUID GAME GLASS BRIDGE CHALLENGE DAY 120,Aamir GamerZ,2026-02-24T14:18:26.139Z,https://www.youtube.com/watch?v=4T62bfjhFew
dgZrQmz8Qik,"Satisfying Unboxing with Patrick, Tom and Jerry Fun Toys Video",Chase Toy,2026-02-24T14:15:25.763Z,https://www.youtube.com/watch?v=dgZrQmz8Qik
BIDqPAG8mPg,The Genius Idea That Sold More Toys 💰,NYKentertain,2026-02-24T14:10:11.719Z,https://www.youtube.com/watch?v=BIDqPAG8mPg
vWWcfRXfwTI,What the heck happened to Patrick Star?! #animation #dannyphantom #hellopuppetsmidnightshow #funny,Ngozi Favour,2026-02-24T14:04:13.569Z,https://www.youtube.com/watch?v=vWWcfRXfwTI
BtLVjylzjLg,NO EATING TREX CLASS JURASSIC WORLD FUN REBIRTH Dinosaur Toy Collection NEW Video DREX Mattel Funny!,Ryder’s Dino World,2026-02-24T14:03:42.688Z,https://www.youtube.com/watch?v=BtLVjylzjLg
BtqLYK38T7g,Never Ever Help FreakBob Survive The Sonic Encounter,She Who Knows,2026-02-24T13:58:10.396Z,https://www.youtube.com/watch?v=BtqLYK38T7g
eihvosNIPrA,The Monster Wouldn’t Leave Him Alone… Until This Happened 👹😱🤣,Super Sonicous,2026-02-24T13:55:14.823Z,https://www.youtube.com/watch?v=eihvosNIPrA
JHgMiPODxOQ,MINECRAFT Happy Meals!,Mark Ryan,2026-02-24T13:53:47.395Z,https://www.youtube.com/watch?v=JHgMiPODxOQ
0Sc3SlfF1Ao,He just wanted love… but ended up alone and in danger 🐍💔😢,Super Sonicous,2026-02-24T13:51:26.952Z,https://www.youtube.com/watch?v=0Sc3SlfF1Ao
fROn3ypxPLM,This orca thought the small orca toy was her baby.❤️‍🩹,Hans Frame,2026-02-24T13:46:32.738Z,https://www.youtube.com/watch?v=fROn3ypxPLM
BgF6uU46Xoc,He Found a Creature That Shouldn’t Be Touched 🐙😨,Super Sonicous,2026-02-22T14:44:19.234Z,https://www.youtube.com/watch?v=BgF6uU46Xoc
0V_eJyGndvs,They Thought It Was Pasta… Until the News Came Out 📺🪱🤣,Super Sonicous,2026-02-22T14:43:03.299Z,https://www.youtube.com/watch?v=0V_eJyGndvs
-dsyx9nC5e8,CAN DOGS PLAY WITH CAT TOYS? #msbeanie @catsackett,Ms. Beanie,2026-02-22T14:37:58.781Z,https://www.youtube.com/watch?v=-dsyx9nC5e8
IPtLykphTNY,Homeless Man Spends His Last Dollar to Save a Mother Dog. What Happens Next Will Make You Cry,Felpit Things,2026-02-22T12:48:14.126Z,https://www.youtube.com/watch?v=IPtLykphTNY
R0YMU2Lfa1k,They were so mean to bacon but then this happened… 🤯 #roblox #robloxshorts,Fleecy,2026-02-22T12:40:46.798Z,https://www.youtube.com/watch?v=R0YMU2Lfa1k
LKkWd9VYU_A,SHIN SONIC FRIENDS,Mark Ryan,2026-02-22T12:39:10.606Z,https://www.youtube.com/watch?v=LKkWd9VYU_A
zCq2JYXMgAg,Tails Uses Crazy Inventions On Sonic!,TailsBlox,2026-02-22T12:35:48.306Z,https://www.youtube.com/watch?v=zCq2JYXMgAg
s7C-Rj-7A2c,They tried to fool her    but she was smarter 👮💰,Super Sonicous,2026-02-22T12:35:16.861Z,https://www.youtube.com/watch?v=s7C-Rj-7A2c
SDMi2m1ZMb4,A Million Dollar Jelly Bed ：The Ultimate Gift from Dad,Huong Bui,2026-02-22T12:34:16.951Z,https://www.youtube.com/watch?v=SDMi2m1ZMb4
HECTRXWfi4Y,Tung Tung Tung Sahur CHASES Sonic & Tails!,TailsBlox,2026-02-22T12:30:48.947Z,https://www.youtube.com/watch?v=HECTRXWfi4Y
1xhuMjCC6Xc,They Were No Longer Here… And Only One Person Was Suspicious 👻⚰️😶,Super Sonicous,2026-02-22T12:30:21.276Z,https://www.youtube.com/watch?v=1xhuMjCC6Xc
6xMpZ2tYv6Y,He Just Wanted Peace… They Chose Chaos 😴⚡🤣,Super Sonicous,2026-02-22T12:29:20.001Z,https://www.youtube.com/watch?v=6xMpZ2tYv6Y
FnPS1bi9efI,Who made these toys?😭,Angelia Mor,2026-02-22T10:32:30.942Z,https://www.youtube.com/watch?v=FnPS1bi9efI
UGVXLNjUMJo,Dubai Dad's Million Dollar Jelly Bed：A One of a Kind Gift,Clip Cloud,2026-02-22T10:20:37.289Z,https://www.youtube.com/watch?v=UGVXLNjUMJo
2fzJ9Ac0YmA,Which one is your favorite? (Into The Unknown - Frozen 2 Cover) #singing #intotheunknown #frozen,Kyan Palmer,2026-02-22T10:13:38.043Z,https://www.youtube.com/watch?v=2fzJ9Ac0YmA
CULOC8bqgsQ,This Batman Toy Sold for INSANE Money! 🦇💸,OpenAster,2026-02-22T08:57:48.855Z,https://www.youtube.com/watch?v=CULOC8bqgsQ
PzJ_4icygKI,Top 30 BANNED Kids Toys,WatchMojo.com,2026-02-22T04:37:34.407Z,https://www.youtube.com/watch?v=PzJ_4icygKI
UWsQsS_jjyY,DO YOU PLAY MINECRAFT? #msbeanie,Ms. Beanie,2026-02-21T16:58:57.781Z,https://www.youtube.com/watch?v=UWsQsS_jjyY
JhfMg7q5Glk,BLUEY BACKPACK PUDDIN 😱❤️,Josh puddin & Dozer,2026-02-21T16:53:45.439Z,https://www.youtube.com/watch?v=JhfMg7q5Glk
19MnvasutuI,The Most Hated Marvel Toy of ALL TIME 😬 | What Were They Thinking?,OpenAster,2026-02-21T16:51:22.110Z,https://www.youtube.com/watch?v=19MnvasutuI
3KVPFytlZxs,ROBLOX LIVE | Join Now 🔴,ROLIVX ,2026-02-21T16:51:18.813Z,https://www.youtube.com/watch?v=3KVPFytlZxs
xKiCHG4zB9A,POV Losing Aura in Roblox 🤣 Brookhaven Funny Meme,CyBear,2026-02-21T16:49:12.714Z,https://www.youtube.com/watch?v=xKiCHG4zB9A
30nXnACxgEM,Dry Pool#sonic #sonicthehedgehog,Super-sonic,2026-02-21T16:46:05.351Z,https://www.youtube.com/watch?v=30nXnACxgEM
0vM-n5RpU68,Toys that were banned 😨,English Universe Labz,2026-02-21T16:39:48.755Z,https://www.youtube.com/watch?v=0vM-n5RpU68
P4QGnpSyse8,The poor girl stole the money😡 ~ miniwood toy-wood working art skill wood / hand crafts #gamtng,James USA zx,2026-02-21T16:39:43.759Z,https://www.youtube.com/watch?v=P4QGnpSyse8
zhLDFKmIWnk,Toys that saved lives 😨,English Universe Labz,2026-02-21T16:38:27.755Z,https://www.youtube.com/watch?v=zhLDFKmIWnk
avjIF4eqwW0,I FOUND OUT what my BROTHER was doing IN THE SECRET ROOM #roblox #berry,PairBlox,2026-02-21T16:38:14.809Z,https://www.youtube.com/watch?v=avjIF4eqwW0
vWl9wBgZ6Sw,CAN YOU survive this night with springtrap FNAF Animation..,They Who See,2026-02-21T16:37:15.775Z,https://www.youtube.com/watch?v=vWl9wBgZ6Sw
bKDcSvvDTlY,BACON LOST HIS SISTER AND REGRETS IT #roblox #vialshorts #adoptme #berry #brookhaven,Stella Roblox,2026-02-21T16:34:34.864Z,https://www.youtube.com/watch?v=bKDcSvvDTlY
hDIdC1pqz1M,Why can‘t Sonic swim🙏😭,dailylifeguy,2026-02-21T16:31:04.995Z,https://www.youtube.com/watch?v=hDIdC1pqz1M
SlAxCvD2M_E,Humiliated for being poor… but he turned the tables! 💪💰,Super Sonicous,2026-02-21T16:21:51.424Z,https://www.youtube.com/watch?v=SlAxCvD2M_E
Y-R1f7xDJL8,Will You Share Pizza With Creepy Freddy In Midnight ? 🍕 #3danimation #horrorstories #creepy #scary,3AM Creepy Show,2026-02-21T16:18:27.746Z,https://www.youtube.com/watch?v=Y-R1f7xDJL8
yEq5s_0FdSA,Why does Sonic wear shoes🙏😭,dailylifeguy,2026-02-21T16:17:17.615Z,https://www.youtube.com/watch?v=yEq5s_0FdSA
A2TgWZ3b9pE,GUESS THE REAL HEAD OF LIRILI LARILA part#4 garry's modnewupdateshort #roblox #zoonomaly #edit,FullOn Fun TV,2026-02-21T16:16:57.435Z,https://www.youtube.com/watch?v=A2TgWZ3b9pE
glUrzUFZJko,The Smile Song for Kids 😊 Camp Song - Preschool Learning,The Alana Banana Show - Educational Music Videos ,2026-02-21T11:03:12.132Z,https://www.youtube.com/watch?v=glUrzUFZJko
lxN6O5kaH8g,🔅Maths Games In School Playing Method#games #school #funny #trending #students #activity #song #kids,BELIEVERS ACADEMY,2026-02-21T11:03:08.016Z,https://www.youtube.com/watch?v=lxN6O5kaH8g
FeuSQU7jbJc,İngilizce'de İç içe Kelimeler #ingilizce #çocuk #okulöncesi #eğitim,Kidshire,2026-02-21T11:03:01.159Z,https://www.youtube.com/watch?v=FeuSQU7jbJc
CrpT5Mem2Do,AI Cloud Slime #satisfying #slime,Slime Glitterz,2026-02-21T11:02:57.303Z,https://www.youtube.com/watch?v=CrpT5Mem2Do
fQBnbsB9LZI,3 Rules Disney Princesses HAVE To Follow When Meeting Guests 👑,Super Happy Mega Mouse,2026-02-21T11:02:55.625Z,https://www.youtube.com/watch?v=fQBnbsB9LZI
mE6e5SN6wVw,Sand slime on the moon,_vector_,2026-02-21T11:02:51.498Z,https://www.youtube.com/watch?v=mE6e5SN6wVw
jjp1dTVVtI8,#halloween #kidssong,Fun Squad Shorts,2026-02-21T11:01:29.786Z,https://www.youtube.com/watch?v=jjp1dTVVtI8
4U0L-M5hDII,EVERYDAY SONIC LIFE ANIMATION #funnyshorts,AAC Dream,2026-02-21T11:01:05.111Z,https://www.youtube.com/watch?v=4U0L-M5hDII
CnyWe2I9uKg,Fat & Thin | Busy & Lazy #kidslearning #englishforkids #oppositesforkids,JoyoKids+,2026-02-21T11:00:48.250Z,https://www.youtube.com/watch?v=CnyWe2I9uKg
60cElGghPpk,Let’s Learn Science While Playing With Glass as Mirror! 💡 #kids #learn,MEOWJI,2026-02-21T10:59:55.844Z,https://www.youtube.com/watch?v=60cElGghPpk
GJJMyj2vT7o,American vs UK English 🇺🇸🇬🇧 | Common Everyday Words Difference for Kids and Beginners,Anokha,2026-02-21T10:59:43.386Z,https://www.youtube.com/watch?v=GJJMyj2vT7o
qL2REoR9tk4,Peach! 🍑🥹 #doll #dolls #peach,Rodney Rainbow,2026-02-21T10:59:29.231Z,https://www.youtube.com/watch?v=qL2REoR9tk4
-G7djnMm804,When Noob tugs war with C00lkidd kid ☠️ PT3 - Roblox Dead Rails #robloxanimation,Ninja Roblox,2026-02-21T10:59:20.818Z,https://www.youtube.com/watch?v=-G7djnMm804
oZ8s3N-_qAg,Larva Season 1 Episode 14 | The BEST of Cartoon Box | Larva Full Episode | New Cartoon Comedy,ENJO - Cartoon World,2026-02-21T10:58:42.764Z,https://www.youtube.com/watch?v=oZ8s3N-_qAg
qpeLb6Q01_Y,They Accepted Her As a Disney Princess 👑✨ | Ralph Breaks the Internet Scene Breakdown,Clover Thompson24,2026-02-21T10:57:59.337Z,https://www.youtube.com/watch?v=qpeLb6Q01_Y
SyFxP36ZKxA,my FRIEND wanted that I WAS KICKED OUT OF THE CLASSROOM #roblox #berry,PairBlox,2026-02-21T10:21:04.792Z,https://www.youtube.com/watch?v=SyFxP36ZKxA
EarXxLtiGtY,Let's Make the CUTEST Stress Toy! 🥰,Sticki Rolls,2026-02-21T05:56:09.386Z,https://www.youtube.com/watch?v=EarXxLtiGtY
fL7c7E2wwmI,Sonic With His Girlfriend - Animals!😱 Passo Bem Solto Rank Up Challenge!😲 Help Sonic Save Amy?🙏,Mopki TV,2026-02-21T05:51:27.874Z,https://www.youtube.com/watch?v=fL7c7E2wwmI
u8fyMa22rYk,The Tiniest Labubu Doll Ever Made 😱,OpenAster,2026-02-21T05:48:07.532Z,https://www.youtube.com/watch?v=u8fyMa22rYk
i4IhzAXj2Ew,Turning My STRESS BALL into SLIME! 😱😳✂️ *rip squishy*,It’Sarah 💜,2026-02-20T14:07:34.911Z,https://www.youtube.com/watch?v=i4IhzAXj2Ew
L4TZHZ46Cuc,Why does Sonic need gloves🙏😭,dailylifeguy,2026-02-20T14:06:31.173Z,https://www.youtube.com/watch?v=L4TZHZ46Cuc
3pU2o43J9Dg,Would you work at the FNAF Animation Studio?  (FNAF Animation),They Who See,2026-02-20T14:03:05.908Z,https://www.youtube.com/watch?v=3pU2o43J9Dg
03VmCKdMWh8,kpop filter fun #kpopdemonhunters #kpop #zoey #mystery #anime #cartoon #diy #fypシ #photo #fortnite,JellyBean Adventures,2026-02-20T08:35:02.795Z,https://www.youtube.com/watch?v=03VmCKdMWh8
ay5T_kyIYvw,filter fun. #demonslayer #anime #cartoon #kpop #japanese #kpdh #diy #kpopdemonhunters #diy #photo,JellyBean Adventures,2026-02-20T08:35:01.287Z,https://www.youtube.com/watch?v=ay5T_kyIYvw
5tGG2uNPmjE,injection in Spider-Man's butt #kpop #anime #blackpink #spiderman,TomatoVerse,2026-02-20T08:33:59.811Z,https://www.youtube.com/watch?v=5tGG2uNPmjE
iDEh1g1QQfI,Did you know?  why the blue car keep following Mr. Bean,CartoonTheories,2026-02-20T08:23:35.014Z,https://www.youtube.com/watch?v=iDEh1g1QQfI
C_UX_MWYKoY,BARBIE TENT FLYING PUDDIN 😱❤️,Josh puddin & Dozer,2026-02-20T08:05:37.335Z,https://www.youtube.com/watch?v=C_UX_MWYKoY
