video_id,title,channel,time,url
_rbGVSENSzg,Ultimate Bluey Minisode Compilation! 🤩 💙 | 40 MINUTES | Every Minisode EVER! | Bluey,Bluey - Official Channel,2026-01-01T15:05:17.193Z,https://www.youtube.com/watch?v=_rbGVSENSzg
2PJwdgVyHr0,A Letter from Dad 💌 😯 | 30 MINUTES NEW Bluey Compilation 💙 + FULL MINISODE ✨ | Bluey,Bluey - Official Channel,2026-01-01T14:59:10.834Z,https://www.youtube.com/watch?v=2PJwdgVyHr0
koiI9TKIBBI,Blue Mountains Hands Puppets! 💙 🖐 | Bluey Episode Story and Many More Wonderful Moments ⭐️ | Bluey,Bluey - Official Channel,2026-01-01T14:57:22.592Z,https://www.youtube.com/watch?v=koiI9TKIBBI
aahtQ2Oncps,Spending Time With Friends 💙 | Bluey's Bestest Friends - Official,Bluey's Bestest Friends - Official Channel ,2026-01-01T14:43:27.835Z,https://www.youtube.com/watch?v=aahtQ2Oncps
BheR8IxrEpw,Bluey Animation Mistakes That You Can’t UNSEE,TubbyTank,2026-01-01T10:40:40.007Z,https://www.youtube.com/watch?v=BheR8IxrEpw
wXLBNFd1xro,"EVEN MORE Full Bluey Minisodes! - Part 2 💙 | Butlers, Alongside, Robo Bingo | Bluey",Bluey - Official Channel,2026-01-01T10:37:10.440Z,https://www.youtube.com/watch?v=wXLBNFd1xro
ed3T4-m7fR8,The True Story Of Dino Kid's Toy In 99 Night In The Forest 😭,AYCH,2026-01-01T08:10:01.318Z,https://www.youtube.com/watch?v=ed3T4-m7fR8
l8Dr7vzMSVE,"“Takedown” Official Lyric Video feat. Jeongyeon, Jihyo and Chaeyoung from TWICE | KPop Demon Hunters",Sony Pictures Animation,2026-01-01T08:08:21.138Z,https://www.youtube.com/watch?v=l8Dr7vzMSVE
F9rk_RdPqkM,Top 5 BANNED toys in America! 😱🔫,TheMiniBl4sters,2026-01-01T08:01:49.361Z,https://www.youtube.com/watch?v=F9rk_RdPqkM
EvYXrgE1hDs,Top toys that are haunting 😱,TheMiniBl4sters,2025-12-30T17:49:18.124Z,https://www.youtube.com/watch?v=EvYXrgE1hDs
eq70e88FNKI,Disney Princess Reveal! #kidsfun,J House jr.,2025-12-30T17:31:41.038Z,https://www.youtube.com/watch?v=eq70e88FNKI
hStzCGJKBlE,Where is thumbkin?! #kidssong,J House jr.,2025-12-30T17:31:39.403Z,https://www.youtube.com/watch?v=hStzCGJKBlE
6OD3-kvD-LI,5 pumpkins 🎃 #halloween #kidssong,J House jr.,2025-12-30T17:31:03.667Z,https://www.youtube.com/watch?v=6OD3-kvD-LI
eNyoqdY3X10,"💪If You Dream It, You Can Be It! ❤️",GVO Kids,2025-12-30T17:30:24.154Z,https://www.youtube.com/watch?v=eNyoqdY3X10
oJuNyoxX78g,KIDS! 🦀Can We SAVE this GIANT Horseshoe Crab from Danger?!🐚,Aaron's Nature Guide - Educational Kids Show,2025-12-30T17:29:59.185Z,https://www.youtube.com/watch?v=oJuNyoxX78g
HV-AUQvzPks,Ponies each have their own preferences#mylittlepony #cartoon,Movie cancanisay,2025-12-30T17:28:42.751Z,https://www.youtube.com/watch?v=HV-AUQvzPks
Qe1QTrX73YE,🤯Incredible POWER ❤️💪,GVO Kids,2025-12-30T17:27:51.915Z,https://www.youtube.com/watch?v=Qe1QTrX73YE
IgG0o_r6GSQ,Kids Learn to Be Grateful 🙏💛,Aidenya Kids,2025-12-30T17:27:43.648Z,https://www.youtube.com/watch?v=IgG0o_r6GSQ
uUNaUw6R5vQ,Learn 13 Homonyms for Kids 🎈💅🏻 | English Learning with Cartoon Animation,Anokha,2025-12-30T17:26:24.606Z,https://www.youtube.com/watch?v=uUNaUw6R5vQ
_RlrJWlEWAM,Kaycee David - Salamat | Blind Auditions | The Voice Kids Philippines Season 4,The Voice Kids Philippines,2025-12-30T17:25:10.237Z,https://www.youtube.com/watch?v=_RlrJWlEWAM
mvYZwDtxw7A,Hidden SECRETS In Bluey You Should SEE,TubbyTank,2025-12-30T16:01:17.794Z,https://www.youtube.com/watch?v=mvYZwDtxw7A
g_n4hQqcCUc,Toys which are way to dangerous,TheMiniBl4sters,2025-12-27T18:14:19.480Z,https://www.youtube.com/watch?v=g_n4hQqcCUc
QLDxXl9XKGM,POV Perfect Puzzle Challenge -  Sonic vs Shadow,Mr Buddy,2025-12-27T11:26:12.494Z,https://www.youtube.com/watch?v=QLDxXl9XKGM
RV5HsZ319Mw,They Finally Made K-Pop Demon Hunters Dolls… And Fans Are NOT Happy 💀,ThePopPoint,2025-12-27T09:09:31.496Z,https://www.youtube.com/watch?v=RV5HsZ319Mw
hJqkqqEIXhI,Sonic Part 3 and New Sonic Characters in Real Life! #sonic #funny #inreallife,Watch Me,2025-12-27T04:09:12.470Z,https://www.youtube.com/watch?v=hJqkqqEIXhI
uJZJJUW9lso,When Sonic Enters the Squid Game #squidgame #sonic,Cobexron,2025-12-27T04:05:50.662Z,https://www.youtube.com/watch?v=uJZJJUW9lso
kngyeDMq_oI,The importance of Elsa's hair in Frozen animation! 🤯,Movieflax,2025-12-27T03:57:52.580Z,https://www.youtube.com/watch?v=kngyeDMq_oI
hqJQuQ8hhfw,Why did Elsa really freeze in Frozen 2?,REXTOR ,2025-12-27T03:56:03.739Z,https://www.youtube.com/watch?v=hqJQuQ8hhfw
n1CdnyOpYzY,Fat vs Thin 😂 #englishforkids #kidslearning #kidsvideo #educationalvideo #oppositesforkids,JoyoKids+,2025-12-27T03:55:37.683Z,https://www.youtube.com/watch?v=n1CdnyOpYzY
5m9pyvHLw4Q,Muffin at the Ballet! 🥺 💜 🩰 | Bluey,Bluey - Official Channel,2025-12-27T03:54:52.165Z,https://www.youtube.com/watch?v=5m9pyvHLw4Q
ZyfDZ88Mn50,🔴LIVE: Bluey's Best Stories | 1 HOUR+ | Bluey,Bluey - Official Channel,2025-12-26T16:04:18.409Z,https://www.youtube.com/watch?v=ZyfDZ88Mn50
3-qzrzoCxnM,"Bluey Full Episodes Compilation! 💙 Onesies, Omelette, & More! | @disneyjr",Disney Jr. ,2025-12-26T15:50:12.387Z,https://www.youtube.com/watch?v=3-qzrzoCxnM
KJFH7li0Uz8,Best Friends Moments from Series 1 & 2! 💙✨ ﻿| FULL EPISODES! |  Bluey's Bestest Friends - Official,Bluey's Bestest Friends - Official Channel ,2025-12-26T15:49:48.872Z,https://www.youtube.com/watch?v=KJFH7li0Uz8
0tNet33cTdI,Masha and the Bear 2025 🐲🎅 Secret Santa 👸🎁 Best episodes cartoon collection 🎬,Masha and The Bear,2025-12-26T15:49:26.678Z,https://www.youtube.com/watch?v=0tNet33cTdI
1P-ozNAQ3ZI,Best of Bingo Minisodes! 🧡 | 30 MINUTES | Bluey Minisodes | Bingo - Official Channel,Bingo - Official Channel,2025-12-26T15:44:22.169Z,https://www.youtube.com/watch?v=1P-ozNAQ3ZI
OEYiwhWR_Vo,Tom et Jerry en Français | Jerry le farceur | WB Kids,WB Kids Français,2025-12-26T15:39:54.214Z,https://www.youtube.com/watch?v=OEYiwhWR_Vo
YU9lwq-lwO4,RACHEL takes care of her baby doll,KAYCEE & RACHEL in WONDERLAND FAMILY,2025-12-25T16:40:08.946Z,https://www.youtube.com/watch?v=YU9lwq-lwO4
IYbTYe6_mfo,KPop Demon Hunters INSANE JUMP CHALLENGE🤯 P.7 #kpop #minecraft,Epic Block Quest,2025-12-25T10:26:44.823Z,https://www.youtube.com/watch?v=IYbTYe6_mfo
VC61xSK8xe8,Which YouTuber would you go to waterpark with? 🌊,Ertoy Movie ,2025-12-25T10:24:55.724Z,https://www.youtube.com/watch?v=VC61xSK8xe8
RLlnGioNQXg,Extinct animals found frozen in ice! #animals,Facts media-81,2025-12-25T10:24:54.353Z,https://www.youtube.com/watch?v=RLlnGioNQXg
vUk-tdTtxNw,The Truth About Frozen..,DillyPickle,2025-12-25T06:49:39.480Z,https://www.youtube.com/watch?v=vUk-tdTtxNw
MSjz1F9fq8g,NEVER LEAVE THE COWBOY TOY ALONE IN YOUR ROOM 🤠⚠️😱,Vidbravo!,2025-12-25T06:41:48.227Z,https://www.youtube.com/watch?v=MSjz1F9fq8g
TajHi15crcU,BLUEY Characters That Exist in Real Life,ZigZag,2025-12-25T06:33:59.276Z,https://www.youtube.com/watch?v=TajHi15crcU
Cn9xO8FaJes,What color is the sky SONG PRANK 2😂😂  #roblox #robloxshorts,Nexay IA,2025-12-25T06:26:42.425Z,https://www.youtube.com/watch?v=Cn9xO8FaJes
kkmGppZYVmg,Mira’s Snow Prank Backfires… Nubini Gets All the Praise! #kpop #lego #rumi #roblox,AiBlox,2025-12-25T06:20:03.892Z,https://www.youtube.com/watch?v=kkmGppZYVmg
02KOJbdaWhM,He was born different… and nobody liked him 😔💔✨,Super Sonicous,2025-12-25T06:17:30.697Z,https://www.youtube.com/watch?v=02KOJbdaWhM
W3hAUgRmfB0,guess right with knuckles amy rose #minecraft,HAYZEN EXTRA,2025-12-25T06:07:04.700Z,https://www.youtube.com/watch?v=W3hAUgRmfB0
VCpuU4A4Ttg,kaka laka boom#viral#robloxstory,ANCHI ,2025-12-24T15:54:29.965Z,https://www.youtube.com/watch?v=VCpuU4A4Ttg
TQBMnq6jr20,Drawing Gary De’Snake from Zootopia #zootopia2 #fyp #viral #disneymovies #disneyanimation,The Sleepless Illustrator,2025-12-24T15:52:08.465Z,https://www.youtube.com/watch?v=TQBMnq6jr20
QtFM6o7fg6I,Choose potato chips would you like to eat! 🍟🤤,Ertoy Movie ,2025-12-24T15:47:29.169Z,https://www.youtube.com/watch?v=QtFM6o7fg6I
-FYO60qMuJY,guess right with sonic part 2 #minecraft,HAYZEN EXTRA,2025-12-24T15:46:36.697Z,https://www.youtube.com/watch?v=-FYO60qMuJY
Q0pDPhjzWs4,When Sonic Characters Enter the Squid Game #squidgame #sonic,Cobexron,2025-12-24T15:43:30.521Z,https://www.youtube.com/watch?v=Q0pDPhjzWs4
SjpzmCUSNJM,Which waterpark would you go to with your favorite YouTuber? ♥️😍🌊,Ertoy Movie ,2025-12-24T15:38:00.846Z,https://www.youtube.com/watch?v=SjpzmCUSNJM
W2i_nEFjuT4,KPop Demon Hunters Noob Pro Challenge Part.7 #kpop #minecraft,Epic Block Quest,2025-12-24T15:33:01.412Z,https://www.youtube.com/watch?v=W2i_nEFjuT4
o3GLGLHM1Mg,Bluey Le Cuenta a sus Padres que Será Madre ❤️ | Episodio Fan Made,Mr Bluey,2025-12-23T15:46:23.405Z,https://www.youtube.com/watch?v=o3GLGLHM1Mg
bo-aEVckKYM,POV ❤️ Naruto and Hinata in the Love Run! 120% #animation,Duhan Show,2025-12-23T15:46:00.482Z,https://www.youtube.com/watch?v=bo-aEVckKYM
6wqZxAAaOVI,KPop Demon Hunters vs Squid Game Lava Jump P.5 #kpop #minecraft,Epic Block Quest,2025-12-23T15:15:22.822Z,https://www.youtube.com/watch?v=6wqZxAAaOVI
4vQzirBmKfE,🔴LIVE: Best of Bluey Minisodes! ☺️ ✨ | Full Bluey Minisodes | 40 MINUTES | Bluey,Bluey - Official Channel,2025-12-22T16:56:52.013Z,https://www.youtube.com/watch?v=4vQzirBmKfE
LR5c1IWGBDE,Bluey – Short | Keepy Uppy | Disney Jr,Disney Junior Canada,2025-12-22T16:30:31.260Z,https://www.youtube.com/watch?v=LR5c1IWGBDE
-M9lvQADvAI,"Bluey ""Double Babysitter"" FULL Episode! | @disneyjr",Disney Jr. ,2025-12-22T16:23:18.045Z,https://www.youtube.com/watch?v=-M9lvQADvAI
fWBJTdq_pdU,Bluey Full Episode | Cubby | S3 E38 |  @disneyjr,Disney Jr. ,2025-12-22T16:16:19.186Z,https://www.youtube.com/watch?v=fWBJTdq_pdU
ukNeUB6dyeo,"🔴LIVE: Bluey Full Episode Celebration! 🎉 | The Sleepover, Baby Race, and More! | Bluey",Bluey - Official Channel,2025-12-22T16:04:04.554Z,https://www.youtube.com/watch?v=ukNeUB6dyeo
b3wCSBGT0V8,🔴LIVE: Amazing Travels 🚘 ✨ | 1 HOUR+ | Travel Games with Bluey and Bingo | Bluey,Bluey - Official Channel,2025-12-22T15:52:20.266Z,https://www.youtube.com/watch?v=b3wCSBGT0V8
3qm5W7aU8xE,😱 Nubini ran out of water in the pool. #kpop  #lego #rumi #roblox,AiBlox,2025-12-21T07:32:40.852Z,https://www.youtube.com/watch?v=3qm5W7aU8xE
jznntaEgfrs,SONIC 3 New Build a Queen Run Sonic vs. Shadow Day 83 funny EPIC Challenge! #Sonic,OGG Toca Story,2025-12-21T07:11:09.154Z,https://www.youtube.com/watch?v=jznntaEgfrs
RieyQrpBX4w,Anant laya 2 labubu doll,PoonamSikarwar,2025-12-21T05:06:56.655Z,https://www.youtube.com/watch?v=RieyQrpBX4w
ffHd8lRawaI,“She carried responsibility before she carried dreams.” || #emotionalstory #AnimatedShort#storytelin,Storytelling_Hub,2025-12-21T05:06:07.506Z,https://www.youtube.com/watch?v=ffHd8lRawaI
4JZ9I3Wlm5s,The Truth About Toy Story..,DillyPickle,2025-12-21T04:25:22.535Z,https://www.youtube.com/watch?v=4JZ9I3Wlm5s
920l8grRUNU,The Truth About Moana 2..,DillyPickle,2025-12-20T16:48:31.144Z,https://www.youtube.com/watch?v=920l8grRUNU
pRwPD-AZ9jI,The toy came… but at what cost? 🔫💔,Oovira,2025-12-20T16:34:58.307Z,https://www.youtube.com/watch?v=pRwPD-AZ9jI
e3Ork6FcpdM,The Truth About Frozen..,DillyPickle,2025-12-20T16:34:35.199Z,https://www.youtube.com/watch?v=e3Ork6FcpdM
5ePRysoAlpA,He Built a Lego Cat… But What It Turned Into Left Everyone Confused 😳🐱,Ezvonn,2025-12-20T16:34:30.314Z,https://www.youtube.com/watch?v=5ePRysoAlpA
MDKHHBhNXt8,The Lion Guard | DJ On Safari: Ono and Fuli | @disneykids,Disney Kids,2025-12-20T13:53:02.902Z,https://www.youtube.com/watch?v=MDKHHBhNXt8
unh66IcLpt8,KPop Demon Hunters - Laughs At Other Animated Movies,The Critical Drinker,2025-12-20T13:49:53.286Z,https://www.youtube.com/watch?v=unh66IcLpt8
QGsevnbItdU,"""How It's Done"" Official Lyric Video | KPop Demon Hunters | Sony Animation",Sony Pictures Animation,2025-12-20T13:45:38.561Z,https://www.youtube.com/watch?v=QGsevnbItdU
TbMEMCvFbZk,"""What It Sounds Like "" | Official Song Clip | KPop Demon Hunters | Sony Animation",Sony Pictures Animation,2025-12-20T13:45:24.987Z,https://www.youtube.com/watch?v=TbMEMCvFbZk
L6oxEZAI4Iw,🐉 Dragon Island | The Lion Guard | Disney Kids,Disney Kids,2025-12-20T13:44:07.514Z,https://www.youtube.com/watch?v=L6oxEZAI4Iw
UNUO02qsC74,The Lion Guard | Bunga and the King | @disneykids,Disney Kids,2025-12-20T13:38:06.568Z,https://www.youtube.com/watch?v=UNUO02qsC74
H8Ei6RGsKso,The Lion Guard | When I Became Scar 🙀| Disney Kids,Disney Kids,2025-12-20T13:31:30.224Z,https://www.youtube.com/watch?v=H8Ei6RGsKso
wDlr8DtunoM,Which Huntrix character would you like to dress up as Christmas? 🎅🎄,Ertoy Movie ,2025-12-20T13:28:53.177Z,https://www.youtube.com/watch?v=wDlr8DtunoM
9NO4D4WyVmo,Mall Stuff Pure Heart Person 🥷🔥~ mini wood toy-wood working art skill wood / hand crafts #gamtng,The SuperV,2025-12-20T13:26:34.484Z,https://www.youtube.com/watch?v=9NO4D4WyVmo
Nw7vCq1sQv0,The Truth About Moana..,DillyPickle,2025-12-20T13:25:31.480Z,https://www.youtube.com/watch?v=Nw7vCq1sQv0
QQhvXQly4ps,Guard Almost Caught Her 😨🔥~ mini wood toy-wood working art skill wood / hand crafts #gamtng,Liñdo Kerl,2025-12-20T13:15:20.184Z,https://www.youtube.com/watch?v=QQhvXQly4ps
IeX2nhwBCL0,Top 3 Weirdest Toys You've NEVER Seen Before! 😱🤯,Polaristuff,2025-12-19T14:08:56.527Z,https://www.youtube.com/watch?v=IeX2nhwBCL0
5LTLEY_ca7E,Which automatic hair machine would you trust your hair? 💇✂️💇‍♀️,Ertoy Movie ,2025-12-18T16:22:32.666Z,https://www.youtube.com/watch?v=5LTLEY_ca7E
jbmkwsf43kg,Sonic is Died💔#sonic,Dark Theory,2025-12-18T16:21:18.408Z,https://www.youtube.com/watch?v=jbmkwsf43kg
KYEc3SrvNSQ,Did you notice this detail in movie Inside Out 2?,Animation Odyssey,2025-12-18T16:20:56.661Z,https://www.youtube.com/watch?v=KYEc3SrvNSQ
Qu3AUF3PlNw,Which crazy bed would you choose rest of life? ♥️😍🛌,Ertoy Movie ,2025-12-17T17:05:42.030Z,https://www.youtube.com/watch?v=Qu3AUF3PlNw
vXaivi0GJRs,"If you could swap lives with YouTuber, who will it be? ♥️🤔",Ertoy Movie ,2025-12-16T16:27:28.040Z,https://www.youtube.com/watch?v=vXaivi0GJRs
38JQnEv-si4,Which dream room would you wanna live forever? 🛌😍,Ertoy Movie ,2025-12-16T16:20:17.718Z,https://www.youtube.com/watch?v=38JQnEv-si4
Bkv619EPzVM,Roblox Brainrot Update Let's Play Together Now🤩🔥,Englishwith Saniha,2025-12-16T16:14:27.191Z,https://www.youtube.com/watch?v=Bkv619EPzVM
DSkfs4InTQs,How Spider-Man Turned into a Black Snake! 🐍🤯 #spiderman #spiderverse #spidy,Viral-Hits,2025-12-16T16:11:34.966Z,https://www.youtube.com/watch?v=DSkfs4InTQs
InQELfl_V_M,Which SONIC will clean it up?🤔 #sonic,ElaFrame,2025-12-16T16:10:13.416Z,https://www.youtube.com/watch?v=InQELfl_V_M
