video_id,title,channel,time,url
cIRMHcH7SiQ,The Lost World of Roblox 💀,Zenrix Edits,2026-02-20T07:58:38.584Z,https://www.youtube.com/watch?v=cIRMHcH7SiQ
z6DN5DHRqUA,She gave the boy a gift for the snacks 😅,SEGATOY,2026-02-20T07:42:47.394Z,https://www.youtube.com/watch?v=z6DN5DHRqUA
AZqWE5V9OlQ,3 toys you should never buy,Wow Fact,2026-02-16T01:33:56.870Z,https://www.youtube.com/watch?v=AZqWE5V9OlQ
S3EUTp8FAVk,The story of a man who has a prosthetic arm made from Lego‼️😭,"Seriously, Guys?

",2026-02-15T09:45:12.608Z,https://www.youtube.com/watch?v=S3EUTp8FAVk
yM4zSDFXETI,Spider-Man Needs a Warm Coat to Survive Winter 🥶🕷️🧥,Nobi Tv,2026-02-15T09:44:41.882Z,https://www.youtube.com/watch?v=yM4zSDFXETI
RIk0VH1GfJA,Which bodyguard would you choose against scary Santa Clause? 🎅😱,Ertoy Movie ,2026-02-15T09:39:14.445Z,https://www.youtube.com/watch?v=RIk0VH1GfJA
LnVuOz-sQZA,Top 3 Toys Parents Should Not Buy! 🤯😲,Kyro Scope,2026-02-15T09:37:22.313Z,https://www.youtube.com/watch?v=LnVuOz-sQZA
asKmNLiS2Qw,A B C D E F LYRIC PRANK 🤣🤣,AvocadoBoyRoblox,2026-02-15T09:36:31.997Z,https://www.youtube.com/watch?v=asKmNLiS2Qw
e3alb-86d9s,Why is Sonic so fast?🙏😭,dailylifeguy,2026-02-15T09:34:11.768Z,https://www.youtube.com/watch?v=e3alb-86d9s
6GXSdIELRdA,ONE MISTAKE = GAME OVER ROBLOX ULTIMATE SQUID GAME GLASS BRIDGE CHALLENGE DAY 110,Aamir GamerZ,2026-02-15T09:28:59.961Z,https://www.youtube.com/watch?v=6GXSdIELRdA
ffkIeq-zPbQ,POV ᥬ🥲ᩤ Luffy and Nami in the Hair Run! 132% #animation,Duhan Show,2026-02-15T09:23:18.479Z,https://www.youtube.com/watch?v=ffkIeq-zPbQ
GV7zg-TIX7Q,Which hair color would you choose for Thanos? 💇,Ertoy Movie ,2026-02-14T18:18:11.514Z,https://www.youtube.com/watch?v=GV7zg-TIX7Q
q1AordMQXB4,Rumi vs Mira – Who Will Win? Who Would You Choose? #kpopdemonhunters #animation,ZinZin Toons,2026-02-14T18:18:05.793Z,https://www.youtube.com/watch?v=q1AordMQXB4
1ftvzGfdfS8,LOVE RACE | Judy Cop or Prisoner Judy | WHO WILL NICK CHOOSE? 😱,Furki Animation,2026-02-14T18:15:30.839Z,https://www.youtube.com/watch?v=1ftvzGfdfS8
UG_SkfE4J-k,Which K-pop Demon Hunters character would you want to be seated next to in school? 🏫,Ertoy Movie ,2026-02-14T18:12:53.627Z,https://www.youtube.com/watch?v=UG_SkfE4J-k
up0SzeIArjw,Can You Find This SECRET LEGO Base?,MasterBuilders,2026-02-14T18:04:37.196Z,https://www.youtube.com/watch?v=up0SzeIArjw
YDgHj5aYWlM,i HAD to ENTER this MYSTERIOUS HOUSE in roblox! 😱 #roblox #berry,PairBlox,2026-02-14T18:04:16.401Z,https://www.youtube.com/watch?v=YDgHj5aYWlM
nZWPycxwenU,I DISCOVERED THE SECRET OF MY LITTLE FRIENDS #roblox #berry,PairBlox,2026-02-14T16:17:34.900Z,https://www.youtube.com/watch?v=nZWPycxwenU
fFdhxqT1jKk,67 VS 69 WAR in 99 NIGHTS ROBLOX!💀🔵🔴 #99nightintheforest #roblox #usa,BlazeBlox Shorts,2026-02-14T16:17:15.535Z,https://www.youtube.com/watch?v=fFdhxqT1jKk
fV7iMKfGe-M,Trouble! Help Little Sonic Get His Milk! #SonicTheHedgehog #sonic,OGG Toca Story,2026-02-14T16:16:06.753Z,https://www.youtube.com/watch?v=fV7iMKfGe-M
qKMXnY8DcUs,“One more thing” 😭 / Fnaf 1 Animation #fnaf #fivenightsatfreddys,FazWade,2026-02-14T15:55:39.523Z,https://www.youtube.com/watch?v=qKMXnY8DcUs
OmRTlKUsI8M,SPIDER-MAN Searches for SONIC Inside the Egyptian Pyramid Tunnels 🔦 #SpiderMan #Sonic,Urbex Void,2026-02-12T15:01:53.120Z,https://www.youtube.com/watch?v=OmRTlKUsI8M
7AM7DJTh0Ec,3 Toys Kids Should NEVER Have… They Won’t Stop Playing 😳,TECHUNBOX USA,2026-02-12T14:55:17.926Z,https://www.youtube.com/watch?v=7AM7DJTh0Ec
uIV5Sb_eQoY,Can You Survive 10 Minutes in Growing Up Fazbear FNAF Animation,They Who See,2026-02-11T14:44:19.105Z,https://www.youtube.com/watch?v=uIV5Sb_eQoY
9igJs5QIm58,CAN YOU survive this night with Springtrap Part 2 FNAF Animation..,They Who See,2026-02-11T14:32:53.073Z,https://www.youtube.com/watch?v=9igJs5QIm58
k_O0uV572lU,CAN YOU survive this night with Foxy FNAF Animation..,They Who See,2026-02-11T14:26:13.287Z,https://www.youtube.com/watch?v=k_O0uV572lU
ixNE6Vxwd5U,CAN YOU survive this night with Fredbear FNAF Animation..,What They Never Say,2026-02-11T14:07:30.821Z,https://www.youtube.com/watch?v=ixNE6Vxwd5U
d063kSuObhw,Who even is Hello Neighbor?!#animation #facts #funny #talkingangela2newupdate2023 #talkingtomversion,Ngozi Favour,2026-02-11T14:03:25.563Z,https://www.youtube.com/watch?v=d063kSuObhw
IFw0Zk0hNss,Whispering Dollhouse: Terror in Miniature,Untold Mysteries,2026-02-11T14:02:13.196Z,https://www.youtube.com/watch?v=IFw0Zk0hNss
iaLappx91vE,CAN YOU survive this night with baloon boy and puppet FNAF Animation..,They Who See,2026-02-11T14:01:15.762Z,https://www.youtube.com/watch?v=iaLappx91vE
hcJE0sPTdhE,CAN YOU survive this night with Chica FNAF Animation..,They Who See,2026-02-11T13:23:45.301Z,https://www.youtube.com/watch?v=hcJE0sPTdhE
xeMuespq0WE,"They Found SONIC, SHADOW and Friends Inside an Abandoned Water Park 🔦 #sonic #Sonicthehedgehog",Urbex Void,2026-02-09T12:09:35.094Z,https://www.youtube.com/watch?v=xeMuespq0WE
woAjh5B_fwc,Three Amy？？！！！Who are Real？？ #cute #sonic3 #wedding #funny,LALA PRO,2026-02-08T11:35:15.417Z,https://www.youtube.com/watch?v=woAjh5B_fwc
6T1sXf5P3UY,Kpop Demon Hunter x 99 nights in forest MAZE CHALLENGE #maze #roblox#funny,LucckyToons,2026-02-08T11:34:23.159Z,https://www.youtube.com/watch?v=6T1sXf5P3UY
kH5RmqLluQA,Gru And The Girls Take The Stage! | Despicable Me,Musical Picks,2026-02-08T08:12:30.199Z,https://www.youtube.com/watch?v=kH5RmqLluQA
1PEXzJ5CN2Q,A Supervillain Funeral | Minions: The Rise of Gru,Musical Picks,2026-02-08T08:11:19.161Z,https://www.youtube.com/watch?v=1PEXzJ5CN2Q
_E_jv9o_oEQ,Bob Becomes King in the Most Ridiculous Way Possible | Minions,Musical Picks,2026-02-08T08:03:45.498Z,https://www.youtube.com/watch?v=_E_jv9o_oEQ
2eXNmRW0tmA,Despicable Me 4's Best Scenes,Movieclips,2026-02-08T08:03:36.366Z,https://www.youtube.com/watch?v=2eXNmRW0tmA
EyXEHaKveFc,Despicable Me 4 (2024) - Gru & Maxine Sing Everybody Wants to Rule the World Scene | Movieclips,Movieclips,2026-02-08T08:01:06.763Z,https://www.youtube.com/watch?v=EyXEHaKveFc
aZWN5YRmo5I,Gru & Maxime Sing “Everybody Wants to Rule the World” | Despicable Me 4,Musical Picks,2026-02-08T07:55:00.916Z,https://www.youtube.com/watch?v=aZWN5YRmo5I
omI3-WyP7cw,Zootropolis + | La Route Vers Zootropolis | Épisode Entier | Disney Channel Belgique,Disney Kids Belgique,2026-02-08T07:53:48.807Z,https://www.youtube.com/watch?v=omI3-WyP7cw
kyziYe6KyhU,Grandma punishes a mean lion! | Madagascar: Escape 2 Africa | CLIP, Boxoffice ANIMATION ☆ Movie Scenes ,2026-02-08T07:46:16.933Z,https://www.youtube.com/watch?v=kyziYe6KyhU
NkTqej1czY8,ANGEL OR DEVIL BURGER 🍔Zootopia 2 - Can NICK and JUDY Escape The Lava Pit?,Rumi Animation,2026-02-08T07:24:50.842Z,https://www.youtube.com/watch?v=NkTqej1czY8
9KBKmpdZ8Uk,¿Cuántos Globos SpiderMan? 👁️👄👁️,Alejo Igoa,2026-02-08T07:22:16.143Z,https://www.youtube.com/watch?v=9KBKmpdZ8Uk
b6uW6ig2u-s,They Found PAW PATROL Characters Deep Inside an Abandoned Playhouse 🔦 #pawpatrol #chase,Urbex Void,2026-02-08T07:18:06.448Z,https://www.youtube.com/watch?v=b6uW6ig2u-s
A65wwg6R184,puedes ordenar los pokemon ? ☠️😂,Alejo Igoa,2026-02-08T07:15:11.556Z,https://www.youtube.com/watch?v=A65wwg6R184
caXAowN4EKg,MAZE CHALLENGE – ❄Kpop Demon Hunter x Spongebob x Kpop Demon Hunter escapes the trap💥 #maze #roblox,LucckyToons,2026-02-08T04:52:02.780Z,https://www.youtube.com/watch?v=caXAowN4EKg
fUEbm-6mS3o,Dog Got His Favorite Toy 🧸🐶,Oppaw,2026-02-07T18:31:28.751Z,https://www.youtube.com/watch?v=fUEbm-6mS3o
LxAiKCdxpR8,POV😍 Sasuke and Sakura in the Love Run! 163% #animation,MambaAnimeShow,2026-02-07T18:15:17.829Z,https://www.youtube.com/watch?v=LxAiKCdxpR8
jvu2zGwWNQ8,The happy moments when kids receive Christmas gifts 🎁😆 #kids #christmasgifts #happy #foryou,Peter Bell,2026-02-07T18:11:34.437Z,https://www.youtube.com/watch?v=jvu2zGwWNQ8
zT-Tf5CzgAs,Sad Birthday Girl Becomes a Princess! This Face Paint Cheered Her Up Completely!,Lea Fvnky,2026-02-07T18:11:20.244Z,https://www.youtube.com/watch?v=zT-Tf5CzgAs
du2PL2fgryo,Giving Barbie UGGS,EverythingDolls,2026-02-07T18:10:21.798Z,https://www.youtube.com/watch?v=du2PL2fgryo
fDzp2JPofW0,Giving Barbie a Labubu,EverythingDolls,2026-02-07T18:01:28.522Z,https://www.youtube.com/watch?v=fDzp2JPofW0
Psx6opgsaMQ,Sticky vs Slippery Stairs In Roblox!,Johnny and Marty,2026-02-07T17:56:17.872Z,https://www.youtube.com/watch?v=Psx6opgsaMQ
VPffmnBM63E,The Most Realistic Barbie Doll Kitchen!,DelightfulDolls,2026-02-07T15:10:33.393Z,https://www.youtube.com/watch?v=VPffmnBM63E
ohb76ASUUJE,Crazy Roblox Live 236,6dog,2026-02-07T14:59:37.139Z,https://www.youtube.com/watch?v=ohb76ASUUJE
BzJS1UTqCBs,Shopping with a smart Toddler #roblox #viralshorts #adoptme #berry #robux,Stella Roblox,2026-02-07T14:58:04.379Z,https://www.youtube.com/watch?v=BzJS1UTqCBs
8Yl0TfPtIdo,Her toy car is even faster than a luxury sports car.,FF ANIMATION,2026-02-07T11:20:27.068Z,https://www.youtube.com/watch?v=8Yl0TfPtIdo
mQE3Sb4bXDg,Riley and Bash Play Roblox Hole In The Wall!,Brook and Riley,2026-02-07T11:08:55.280Z,https://www.youtube.com/watch?v=mQE3Sb4bXDg
Ei-byLxQ6VI,The Voice from Inside 🔊 | School Secrets Part 2 #familyfriendly #cartoonshorts #cartoon #ytshorts,Milo,2026-02-05T15:37:31.191Z,https://www.youtube.com/watch?v=Ei-byLxQ6VI
TtGuyJPbVHg,The Real Life Superhero Brother ❤️🎬,Wholesome Wendy,2026-02-05T15:33:41.660Z,https://www.youtube.com/watch?v=TtGuyJPbVHg
gInjZwUqVgI,FOUR toys that got banned from our childhood…,TheMiniBl4sters,2026-02-05T15:28:48.376Z,https://www.youtube.com/watch?v=gInjZwUqVgI
Y84xFXoQE9o,Should You Ever Trust Sonic Late At Night,She Who Knows,2026-02-05T15:01:18.969Z,https://www.youtube.com/watch?v=Y84xFXoQE9o
DqjFl8Jb2ZQ,They Found PAW PATROL Characters Deep Inside an Abandoned Police Station 🔦 | Urbex Void #PawPatrol,Urbex Void,2026-02-05T15:00:21.042Z,https://www.youtube.com/watch?v=DqjFl8Jb2ZQ
RZFS2qHvWyQ,Zombie vs Patrick Star #spongebob #animation #funny,SquidMode,2026-02-05T14:29:37.414Z,https://www.youtube.com/watch?v=RZFS2qHvWyQ
RAsbmvovcpc,Papa Pizza Roblox #animated #creepy,Haunted Minute,2026-02-05T14:23:09.809Z,https://www.youtube.com/watch?v=RAsbmvovcpc
RTWhvp_OD6s,"Where You Are (From ""Moana""/Sing-Along)",DisneyMusicVEVO,2026-02-02T06:00:14.006Z,https://www.youtube.com/watch?v=RTWhvp_OD6s
93lrosBEW-Q,Jemaine Clement - Shiny (from Moana) (Official Video),DisneyMusicVEVO,2026-02-02T05:56:28.198Z,https://www.youtube.com/watch?v=93lrosBEW-Q
ybVaRflGe7s,Don't Choose The Wrong Chair In Roblox!,Johnny and Marty,2026-02-02T05:55:45.017Z,https://www.youtube.com/watch?v=ybVaRflGe7s
lTVGL-LpBpQ,Maulana Vows to Get 10-Year-Old Children Married to Defy Family Law | Hassan Nisar Great Analysis,Straight Talk with Ayesha Bakhsh,2026-01-30T04:33:48.383Z,https://www.youtube.com/watch?v=lTVGL-LpBpQ
t3AzA0RR_ro,NEVER PUT A DINOSAUR TOY IN FRONT OF A MORAY EEL 🦖😱🌊,Vidbravo!,2026-01-30T04:08:04.788Z,https://www.youtube.com/watch?v=t3AzA0RR_ro
tQwVKr8rCYw,"Jessica Darrow - Surface Pressure (From ""Encanto"")",DisneyMusicVEVO,2026-01-28T15:58:27.509Z,https://www.youtube.com/watch?v=tQwVKr8rCYw
r5spS7xk1KE,Lucy Runs Into A Lunatic Lady at the Supermarket (Full Scene) | Despicable Me 4,HaHa Picks,2026-01-28T15:58:09.030Z,https://www.youtube.com/watch?v=r5spS7xk1KE
AYEXfb16K90,Sonic Plays Roblox Hole In The Wall!,SpeedyBlox,2026-01-28T14:33:02.749Z,https://www.youtube.com/watch?v=AYEXfb16K90
NZ1jL2oAG00,Don't Cross The Street In Roblox!,Johnny and Marty,2026-01-28T14:32:10.209Z,https://www.youtube.com/watch?v=NZ1jL2oAG00
DhCZeTp7ea4,The Lion Guard The Zebra Mastermind Invisible Goigoi,lil bee play toys,2026-01-23T14:30:02.588Z,https://www.youtube.com/watch?v=DhCZeTp7ea4
vD9lyDl9V2s,The Lion Guard Cave of Secrets Clip FULI'S TEST,lil bee play toys,2026-01-23T14:28:17.302Z,https://www.youtube.com/watch?v=vD9lyDl9V2s
4HnoVFCiUa8,Unity and smart thinking are stronger than force.#cartoon #cartoonforkids #animals #cartoonvideo,HappyPawsStories2,2026-01-23T14:27:11.305Z,https://www.youtube.com/watch?v=4HnoVFCiUa8
8cancJG2F1o,The Lion Guard The Underground Adventure - Fire Attack,lil bee play toys,2026-01-23T14:16:48.500Z,https://www.youtube.com/watch?v=8cancJG2F1o
CbPJaEaxt0U,The Lion Guard - Battle for the Pride Lands - Janja Sings Sisi ni Sawa to Simba,lil bee play toys,2026-01-23T14:11:53.230Z,https://www.youtube.com/watch?v=CbPJaEaxt0U
yL1M5Z19qLA,Sonic's Prank! #sonic #sonicthehedgehog,Super-sonic,2026-01-23T13:57:48.492Z,https://www.youtube.com/watch?v=yL1M5Z19qLA
0U1PM13blLY,"Sonic Plays Red Light, Green Light In Roblox!",SpeedyBlox,2026-01-23T13:56:25.603Z,https://www.youtube.com/watch?v=0U1PM13blLY
8sGuiJUTeLw,Which team wins?🤨 102% #minecraft,MineRot,2026-01-23T13:52:03.038Z,https://www.youtube.com/watch?v=8sGuiJUTeLw
W13IROAU-08,Four toys from our childhood that got banned 😱🚫￼,TheMiniBl4sters,2026-01-23T13:43:29.919Z,https://www.youtube.com/watch?v=W13IROAU-08
cmUUPuWanZY,NEVER WATCH KPOP DEMON HUNTER ON ROBLOX 😱🎤🔥,Vidbravo!,2026-01-23T13:23:03.599Z,https://www.youtube.com/watch?v=cmUUPuWanZY
9SJTfqD8LDM,ROBLOX NEW MAZE CHALLENGE Part 54   One Piece x 99 night   Escape Zantrix,SnappyToons,2026-01-23T13:23:01.655Z,https://www.youtube.com/watch?v=9SJTfqD8LDM
QnJWzmZ0Yo0,She really wanted to play with this toy,SrJinxed,2026-01-19T17:30:31.247Z,https://www.youtube.com/watch?v=QnJWzmZ0Yo0
om5Yq-Snphw,UNUSUAL GADGETS for home!🤩 You can’t leave without!  #unboxing #gadgets #tools #hacks,Kate Yepik,2026-01-19T17:27:29.739Z,https://www.youtube.com/watch?v=om5Yq-Snphw
xw9GYDjqBiY,What toy did you get? #lego #actionfigures #funny #stopmotion #memes #everythingisawesome #legoem,idontposthere😭🙏,2026-01-19T17:16:11.558Z,https://www.youtube.com/watch?v=xw9GYDjqBiY
R_NpLJdV78s,Top 3 Insanely Addictive Toys Everyone's Obsessed With!,TECHUNBOX USA,2026-01-19T17:15:55.128Z,https://www.youtube.com/watch?v=R_NpLJdV78s
DMcNj5tu_Pg,KPop Demon Hunter VS Noob Pro Challenge😱 P.18 #minecraft #kpop,Zeus Shorts,2026-01-19T17:15:52.003Z,https://www.youtube.com/watch?v=DMcNj5tu_Pg
AuzMU20Lag0,3 Toys you must buy 👻,TECHUNBOX USA,2026-01-19T17:11:03.198Z,https://www.youtube.com/watch?v=AuzMU20Lag0
tWGnNTH5P-w,Don't Get Punched in Roblox!,Johnny and Marty,2026-01-19T11:57:49.724Z,https://www.youtube.com/watch?v=tWGnNTH5P-w
hI6Qex9J79A,Don’t Jump on The Wrong Brainrot Box in Roblox!,Johnny and Marty,2026-01-19T11:56:52.682Z,https://www.youtube.com/watch?v=hI6Qex9J79A
blWsuiDHluY,Kpop Demon Hunter Insane Challenge! P.1 #minecraft #kpopdemonhunters,Zeus Shorts,2026-01-18T11:35:43.964Z,https://www.youtube.com/watch?v=blWsuiDHluY
qUxy_GF_1lg,Sonic Team vs Rapunzel SNOW EDITION ❄️💀 Wait for the bald reveal!,SonicLabs,2026-01-18T11:34:06.783Z,https://www.youtube.com/watch?v=qUxy_GF_1lg
0tXx8HqT3Y8,🔥 LIVE Roblox Gameplay | Everyone Can Join RIGHT NOW!,Ave Bloxi,2026-01-18T11:31:18.428Z,https://www.youtube.com/watch?v=0tXx8HqT3Y8
a0uSKyy97mA,The cat princess keeps wanting to open the door.,MyCat Princess,2026-01-18T11:28:45.955Z,https://www.youtube.com/watch?v=a0uSKyy97mA
6SZUBig-738,The Price of a Dream#sonic,Lothario,2026-01-18T11:22:58.537Z,https://www.youtube.com/watch?v=6SZUBig-738
gomHWUAeWk8,KPop Demon Hunter Noob Pro Challenge P.3 #minecraft #kpop,Zeus Shorts,2026-01-18T11:10:54.770Z,https://www.youtube.com/watch?v=gomHWUAeWk8
DIlyWO1l2s4,KPop Demon Hunter Squid Game Lava Jump🤯 P.2 #minecraft #kpop,Zeus Shorts,2026-01-18T11:05:06.057Z,https://www.youtube.com/watch?v=DIlyWO1l2s4
Bw7NXvzdu3U,Owl Crazy Story in 99 Nights In The Forest Roblox 😨 #roblox #99nightintheforest #robloxshorts,Gusbanan,2026-01-18T11:03:35.882Z,https://www.youtube.com/watch?v=Bw7NXvzdu3U
KPtk1SjG0rM,Why Is The Deer Scared Of Light? 🤔😲 #99nights #roblox,Goodboysaregood,2026-01-18T11:02:43.540Z,https://www.youtube.com/watch?v=KPtk1SjG0rM
gXiOC_g-Tmg,Johnny Plays Roblox Steal a Brainrot!,Johnny and Marty,2026-01-18T10:58:04.730Z,https://www.youtube.com/watch?v=gXiOC_g-Tmg
0fx61AqCWF0,Johnny's New Song In Roblox!,Johnny and Marty,2026-01-18T10:53:22.053Z,https://www.youtube.com/watch?v=0fx61AqCWF0
FUm4ULv1DC0,Don't Game On Roblox Late!,Johnny and Marty,2026-01-18T10:52:34.232Z,https://www.youtube.com/watch?v=FUm4ULv1DC0
bBeZSuHI4Qc,"Diane Guerrero, Stephanie Beatriz - What Else Can I Do? (From ""Encanto"")",DisneyMusicVEVO,2026-01-18T09:32:15.834Z,https://www.youtube.com/watch?v=bBeZSuHI4Qc
X05282eN1zI,Three. Most terrifying toys in the multi-verse.🧸💀,TheMiniBl4sters,2026-01-18T05:18:31.674Z,https://www.youtube.com/watch?v=X05282eN1zI
ttq_35Mv6qE,Toy Boat vs Marty in Roblox!,Johnny and Marty,2026-01-18T05:15:55.134Z,https://www.youtube.com/watch?v=ttq_35Mv6qE
xCx-8Ul7_FU,Sonic Movie: Sonic meets Amy!💙💖,IAmTheRawls,2026-01-16T15:47:45.668Z,https://www.youtube.com/watch?v=xCx-8Ul7_FU
V9MNXOcgkY4,Don't Guess The Wrong Smell In Roblox!,Johnny and Marty,2026-01-16T15:39:35.031Z,https://www.youtube.com/watch?v=V9MNXOcgkY4
9OZ0HEn4Hns,Help Princess Rumi and Jinu continuously singing to reclaim their hair!!!,AuraToons,2026-01-16T15:39:03.442Z,https://www.youtube.com/watch?v=9OZ0HEn4Hns
0gH2hY46qxY,Spiderman VS 999 LVL Boss  Can Spiderman Defeat Red Hulk Help Spider man,Khudo Comics,2026-01-16T13:59:46.985Z,https://www.youtube.com/watch?v=0gH2hY46qxY
s9_tnQ9BzRA,People vs Air Mattress In Roblox!,Johnny and Marty,2026-01-16T13:58:37.653Z,https://www.youtube.com/watch?v=s9_tnQ9BzRA
ev2tFu12Pe8,Should You Ever Trust Sonic and Mario When They Are Looking Something At Your House,She Who Listens,2026-01-16T13:57:16.897Z,https://www.youtube.com/watch?v=ev2tFu12Pe8
xFHUMJuwP-Y,If You Wake Up In Sonic's World,She Who Listens,2026-01-14T16:12:50.324Z,https://www.youtube.com/watch?v=xFHUMJuwP-Y
3OWM45fiNu0,I wanted to BE AN ANGEL but the VAMPIRES DID THIS #roblox #berry,PairBlox,2026-01-14T16:10:26.127Z,https://www.youtube.com/watch?v=3OWM45fiNu0
26tb0z_B5uc,Mithu Tota | Punjabi Rhyme | Vidhata Singh Teer । Sirjana Kids,Sirjana Kids (ਸਿਰਜਣਾ ਕਿਡਜ਼),2026-01-14T12:49:40.403Z,https://www.youtube.com/watch?v=26tb0z_B5uc
NkQm2WdFdNM,Mithu Pyara Tota (ਮਿੱਠੂ ਪਿਆਰਾ ਤੋਤਾ) | Punjabi Rhyme for kids,SikhVille,2026-01-14T12:49:11.138Z,https://www.youtube.com/watch?v=NkQm2WdFdNM
CsjLsIx6d8g,Who Can Run On the Treadmill the Longest? #Minecraft,Mongo,2026-01-14T07:19:54.819Z,https://www.youtube.com/watch?v=CsjLsIx6d8g
zuAkPaHMOzc,Becoming the Strongest in School… #minecraft,Mongo,2026-01-14T07:14:48.216Z,https://www.youtube.com/watch?v=zuAkPaHMOzc
01uCQPMXGS0,Johnny's Fan Girls Play Roblox Don't Choose The Wrong Slide!,Johnny and Marty,2026-01-14T07:05:36.092Z,https://www.youtube.com/watch?v=01uCQPMXGS0
OJ8DAPJDGsA,67 Game In The Roblox Library!,Johnny and Marty,2026-01-14T07:05:01.150Z,https://www.youtube.com/watch?v=OJ8DAPJDGsA
iUwotP19V7U,👉 ONE WRONG STEP = GAME OVER 💀 - ROBLOX  #mrbeastroblox #mrbeastronaldo #roblox  DAY -  80,Crossroad Valor ,2026-01-14T06:31:11.616Z,https://www.youtube.com/watch?v=iUwotP19V7U
tplTcgWULlA,Choose rumi from white or black kingdom? #kpopdemonhunter #hunterx #animation,Max VS Football,2026-01-14T06:21:29.989Z,https://www.youtube.com/watch?v=tplTcgWULlA
bDtjRk-jcQw,Rumi and Mira Doll Sad Story Adventure #kpop #kpopdemonhunters #sad,luneta,2026-01-14T06:20:10.329Z,https://www.youtube.com/watch?v=bDtjRk-jcQw
dkyxDgwnwNw,Ezskuup rice no stick cat litter #unboxing #bestpetsupplies #petlovers #amazonfinds #pets #cat,Misty-influencer ,2026-01-14T06:17:04.859Z,https://www.youtube.com/watch?v=dkyxDgwnwNw
uemHDr49JKE,"Rumi can go to the mall after school, and Jinu sings on stage #huntrix #animation #sajaboys",Chibi Cute,2026-01-14T06:16:43.893Z,https://www.youtube.com/watch?v=uemHDr49JKE
1hUDiRRIguc,RC Car vs Marty in Roblox!,Johnny and Marty,2026-01-14T05:37:45.947Z,https://www.youtube.com/watch?v=1hUDiRRIguc
PRZRQzY2Swk,Color Matching Challenge - Help Ballerina Cappuccina pick the right color MUSIC Roblox,Girafik,2026-01-14T05:32:31.155Z,https://www.youtube.com/watch?v=PRZRQzY2Swk
oPDRANkoHa8,Don't Get Pulled In Roblox!,Johnny and Marty,2026-01-14T05:29:57.386Z,https://www.youtube.com/watch?v=oPDRANkoHa8
5_mhqsUF_ks,DEER SAVES CHILDRENS.. 😱,Deyaaaan,2026-01-14T04:39:27.058Z,https://www.youtube.com/watch?v=5_mhqsUF_ks
NP23DeJKtZU,Guess The Correct Logo 🧐✅ | KPop Demon Hunters 👩‍🎤 #minecraft #kpopdemonhunters,Dina,2026-01-14T04:37:20.315Z,https://www.youtube.com/watch?v=NP23DeJKtZU
hf5DZg9sNtw,Castle Singing Challenge! - Will Prince Jinu win Princess Rumi's heart or fail? #shots #funny,PunnToons,2026-01-14T04:36:57.321Z,https://www.youtube.com/watch?v=hf5DZg9sNtw
z90pszLP6vE,Frozen Shark Found Inside the Cave 😱,Mema Shortz,2026-01-14T03:51:24.089Z,https://www.youtube.com/watch?v=z90pszLP6vE
j1g5hedaQKQ,He Entered a Frozen Castle… Big Mistake 😱,Mema Shortz,2026-01-14T03:45:44.955Z,https://www.youtube.com/watch?v=j1g5hedaQKQ
FHonaIwokVE,Top 3 Smallest Dogs That Look Like Toys 😉,Wildbuddz,2026-01-14T03:44:49.296Z,https://www.youtube.com/watch?v=FHonaIwokVE
LKujnN58icc,can yall pls help me get 5k likes for ppp hoodie🎀#dance #outfitideas #outfit #katseye #trends,Robloxgirl-123,2026-01-12T17:38:56.634Z,https://www.youtube.com/watch?v=LKujnN58icc
Tu0H9zxt7M8,They Tested Their Children! 🧪👧👦😱,Nox Jackson,2026-01-12T17:38:40.764Z,https://www.youtube.com/watch?v=Tu0H9zxt7M8
5-NwKVUzfU4,You found Huntrix character in a terrifying place! What would you do? 😱🤯,Ertoy Movie ,2026-01-12T17:38:09.525Z,https://www.youtube.com/watch?v=5-NwKVUzfU4
G-FaJaJtp-o,What Ex-Disney Princesses SAY About Disney 🤫,Super Happy Mega Mouse,2026-01-12T17:26:14.035Z,https://www.youtube.com/watch?v=G-FaJaJtp-o
Af0XWIoQQjs,Frozen Shrek Characters Found 😱,Mema Shortz,2026-01-12T13:43:49.633Z,https://www.youtube.com/watch?v=Af0XWIoQQjs
f80uveym4os,Rock Crawler 4x4 Unboxing | Remote Control Car | Monster Truck Unboxing | Rc Car 4x4 Off Road,Dilshad Khan,2026-01-11T04:39:39.659Z,https://www.youtube.com/watch?v=f80uveym4os
n_2_UKW4dRc,unboxing POP MART The Monsters - Exciting Macaron ( Lychee Berry ) Labubu blind box 💖 | loffi snow,LoffiSnow,2026-01-10T06:09:03.975Z,https://www.youtube.com/watch?v=n_2_UKW4dRc
6zy0EhmiTHc,Toy Button = Endless Snacks for This Clever Pup,ATTshorts,2026-01-10T04:36:17.503Z,https://www.youtube.com/watch?v=6zy0EhmiTHc
_5F2xZg7ZnA,The Children's Trampolines in the Park！,Keiner Oza,2026-01-10T04:35:21.657Z,https://www.youtube.com/watch?v=_5F2xZg7ZnA
iObhcv8u18c,Can LEGO Stop a Backflip?😳👀,Lucie Colebeck,2026-01-10T04:32:23.408Z,https://www.youtube.com/watch?v=iObhcv8u18c
-9F2fop7gHI,Toys parents hate 💀,TheMiniBl4sters,2026-01-09T05:39:02.347Z,https://www.youtube.com/watch?v=-9F2fop7gHI
BhNGeoEsoSU,Never Play With Legos At Night...,Real_USG,2026-01-09T05:38:42.822Z,https://www.youtube.com/watch?v=BhNGeoEsoSU
7J5IDNQs3vw,Top 3 Toys Parents Should Never Buy! 😱😮,Kyro Scope,2026-01-07T15:40:25.007Z,https://www.youtube.com/watch?v=7J5IDNQs3vw
Omj_SXTcv_k,Big & Small Car vs Sonic,Wroom Crash,2026-01-07T15:40:14.076Z,https://www.youtube.com/watch?v=Omj_SXTcv_k
dOOr9AnqKqQ,POV 🧠 Rumi & Jinu in the Wedding Run! 💍🔥 #animation,Max VS Football,2026-01-06T06:02:20.485Z,https://www.youtube.com/watch?v=dOOr9AnqKqQ
cWppAbqm9I8,"""Your Idol"" | Official Song Clip | KPop Demon Hunters | Sony Animation",Sony Pictures Animation,2026-01-06T04:47:08.582Z,https://www.youtube.com/watch?v=cWppAbqm9I8
yebNIHKAC4A,“Golden” Official Lyric Video | KPop Demon Hunters | Sony Animation,Sony Pictures Animation,2026-01-06T04:46:59.112Z,https://www.youtube.com/watch?v=yebNIHKAC4A
983bBbJx0Mk,"""Soda Pop"" Official Lyric Video | KPop Demon Hunters | Sony Animation",Sony Pictures Animation,2026-01-06T04:44:11.071Z,https://www.youtube.com/watch?v=983bBbJx0Mk
Bqm9XHq5BZk,Top 3 Crazy Toys You Should Never Buy! 🤯😱,Kyro Scope,2026-01-05T14:53:33.118Z,https://www.youtube.com/watch?v=Bqm9XHq5BZk
6Sr0j6F5WDQ,Drone Catches CURSED BLUEY HEELER Pranking! Bluey.EXE in Real Life,Anglikosik Angelina,2026-01-02T03:25:59.652Z,https://www.youtube.com/watch?v=6Sr0j6F5WDQ
fjOeJssZX_Q,"""Free"" | Official Lyric Video | Sony Animation",Sony Pictures Animation,2026-01-02T03:25:26.305Z,https://www.youtube.com/watch?v=fjOeJssZX_Q
UtmeLFqWhKA,"NEW Full Bluey Minisodes - Part 1 💙 | Phoney, Tattoo Shop, Whirlpool, and Government | Bluey",Bluey - Official Channel,2026-01-01T16:18:05.794Z,https://www.youtube.com/watch?v=UtmeLFqWhKA
IrH7rkJRTsM,EVERY Bluey Minisode + Bonus Bit! 💙 ⭐️ | 60 MINUTES | Bluey,Bluey - Official Channel,2026-01-01T16:00:27.354Z,https://www.youtube.com/watch?v=IrH7rkJRTsM
uscUfL7vrTo,Full Bluey Minisodes So Far 💙 | Bluey,Bluey - Official Channel,2026-01-01T15:59:58.644Z,https://www.youtube.com/watch?v=uscUfL7vrTo
j2ofkxnctB0,"EVEN MORE Full Bluey Minisodes! - Part 1 💙 | Strong Potion, Goldilocks, and Where's Bingo? | Bluey",Bluey - Official Channel,2026-01-01T15:53:56.823Z,https://www.youtube.com/watch?v=j2ofkxnctB0
Exxrma3i-Ak,Tattoo Shop 🖍️ ✨ | FULL BLUEY MINISODE | Bluey,Bluey - Official Channel,2026-01-01T15:52:33.144Z,https://www.youtube.com/watch?v=Exxrma3i-Ak
Sod8mskDcWI,Bluey Couple Life After Happy Full | Go WOW,Go WOW,2026-01-01T15:50:33.435Z,https://www.youtube.com/watch?v=Sod8mskDcWI
K0CshsrAnMA,Bluey Characters in Real Life – You Won’t Believe Their Looks!,Quiz BuddyKids,2026-01-01T15:42:10.894Z,https://www.youtube.com/watch?v=K0CshsrAnMA
NA351QW_x_o,"Bluey Plays Charades with Bingo, Muffin & Nana | Fun Read-Aloud Story for Kids #bedtime #stories",Book Smart!,2026-01-01T15:41:33.805Z,https://www.youtube.com/watch?v=NA351QW_x_o
R7lwlVj8_vw,EVERY Bluey Minisode! 😯 💙 | 20 Full Minisodes | 40 MINUTES | Bluey,Bluey - Official Channel,2026-01-01T15:36:39.882Z,https://www.youtube.com/watch?v=R7lwlVj8_vw
