video_id,transcript,status
9UmAHufIupc,"In the middle of bustling trains, crowded crossings, and packed city streets, many people in Japan are quietly struggling with loneliness. The country has the oldest population in the world with nearly 30% of people aged 65 or older. And as younger generations move away from work and families become smaller, more elderly Japanese are being left to live and die alone. [music] Government figures show nearly 77,000 people were found dead alone in their homes last year. Some undiscovered for days, even months. It's known in Japanese as kodokushi, or lonely death. Toyama Heights in Tokyo is one of Japan's oldest public housing estates, where several such cases have been reported. 88-year-old Setsuko Kurahara has been living alone here for more than 15 years. Her children are grown up and live far away. She spends most days with other elderly residents who live in the estate. >> I have some incurable diseases and I'm constantly ill. I have to go to the hospital a lot. If I can't walk anymore, I'll go to a nursing home. But right now, I'll stay here with everyone. >> One unlikely support network is a company that delivers yogurt every day. For some seniors, the brief doorstep conversation may be the only human contact they have all day. >> They really look forward to us coming and they wait patiently for us in the morning. If they seem unwell, we don't want them to collapse, so we report it to the company immediately in those situations. >> But loneliness isn't just a problem among the elderly. Experts say social isolation is also increasing among younger generations facing intense work pressure, shrinking social circles, and increasing emotional disconnection. It's become so widespread that Japan created a Minister of Loneliness position in 2021, tasked with combating isolation. Some people seek help through hotlines and mental health support applications. It's created an industry worth billions of dollars. >> One example of that is a range of online platforms where users can book a time with a conversation partner, someone to talk to either by video or phone, not for counseling, but simply for company. In a country where many people say they struggle to find regular social contact, it turns conversation itself into something that can be bought on demand. >> The loneliness crisis is already reshaping the way people live, work, and interact with each other. But without deeper social connections, isolation could become one of Japan's defining challenges in the years to come. >> Patrick Fok, Al Jazeera, Tokyo.",ok
xAcvIhbItb4,"Safety first for this driver, strapping on his seatbelt as he settles into the driver's seat. One big problem. He's just seven years old. Dashboard cameras captured Daniel Wittenbach taking his family's SUV for a morning joy ride. He almost hit another work vehicle. It was a boy, a child. He's driving the wrong way into oncoming traffic in Middletown, Ohio. Cars swerve to avoid young Daniel, who's a decade shy of getting his license. You can hear him playing music along the way. But then the inevitable happens. He hits a median and slows down. Another driver tries to help, wrapping a shirt around his hands, trying to smash in the window. Only then does Daniel think he's going to get into trouble. Stop! (thump on window) It's my mom's car! He didn't understand that people were trying to help him and trying to stop the vehicle. Another driver tries to body block the SUV but it still hits this Jeep head on. Ow! You're okay, you're okay. Daniel wasn't hurt and remains blissfully unaware of the danger that he was in. So where was he going? His only response is, ""Well I just wanted a Slushy from Speedway."" Turns out his parents keep the keys stored high on a wall, but Daniel's a climber. I'm just thankful that he's alive. (outro music)",ok
