video_id,transcript,status
pYbttIST-qA,"Here are some of the biggest mistakes nurses and phlebotomists make whenever they're drawing blood. So, the first thing is that after they clean the site, they let it dry, and then they think, ""Okay, I think I forgot where that vein is. Let me just touch it one more time."" But, the thing is when they touch it, they contaminate the site again. So, just always remember once you've cleaned it, it's off limits. You can no longer touch it. The next mistake has to deal with the fist. So, whenever you're drawing blood, you have to make sure your patient isn't doing certain things with their fist because alter their lab results. For instance, one thing you don't want them to do is just opening and closing the fist because that has shown to cause hemoconcentration, which can alter hematocrit and potassium. Also, if the patient holds a very tight fist throughout the whole procedure, that can cause it as well. So, don't do those two things. However, most guidelines allow for a gentle light fist to be done, but that fist has to be released once blood flow is established. Another mistake is that they don't seat the needle. So, after you insert and you get that flash of blood to let you know, ""Hey, you've hit the vein."" You don't want to just start popping on tubes. You have to take a little extra step and seat that needle. So, you're going to gently lower your angle and go in just a little bit like the thickness of a nickel. And this is going to help prevent hemolysis of your lab sample and prevent collapsing that vein. Next is not using a waste tube when you need to. So, you always want to follow your facility's protocols on this, but using the wing butterfly blood collection set, you take a peek at that set, it has a long tube, and there's a lot of air in that tube. And some blood tubes, such as like the sodium citrate, has a specific blood-to-additive ratio, and you got to clear that air out and put it into your waste tube, and then you pop on your tube that you need. Another mistake is leaving that tourniquet on too long. So, you always want to make sure you're popping that thing off because if you don't, you leave it on more than a minute, it could alter lab results causing hemoconcentration. So, the best thing is is you stick the patient, whenever you get blood flow established, you go ahead and you pop that tourniquet off. And then we have the issue with not following the order of draw. So, you know, it would be awesome if we could just draw blood and just pop on any tube we wanted, right? No, you have to follow a specific order of draw because you don't want to contaminate with certain additives that may be in other tubes. Now, if you want to check out the actual order of draw, I have it up there. Another mistake is that they don't hold pressure long enough after they are done with the blood draw. So, what happens is that the patient gets a nice beautiful hematoma on their arm where their blood is just leaking into their tissue. So, you always want to take the time to just sit there and hold pressure, especially if they're on anticoagulants cuz they will bleed for a while. And some patients don't really understand this and understand what can happen and why we want to hold that good firm pressure. The next mistake is a little bit controversial. Not everyone agrees on it. So, the mistake would be using concentric circles to disinfect the site. That is how they recommended that we do it back in the day, you know, you start in the middle and you work your way outward. That was like literally drilled in our head. They have changed it to the back and forth friction where you take it and rub it back and forth to kill those germs. However, you always want to follow your facility's protocols and what they want you to do. And then lastly, not letting the site dry long enough after you clean it. So, I know in healthcare we're extremely busy and waiting 30 to 60 seconds for something to dry seems like a very long time, but there's purpose for that. We have to allow the alcohol enough time to kill those germs. Okay, so that wraps up this video. Now, if you want to watch a comprehensive demonstration on how to draw blood from beginning to end, I have a video up here that you can access.",ok
TfvhzthE9vU,,failed
Rws1niDxqK8,,failed
V_eRWJus_Pg,,failed
8m9negKqZLo,the question is if the motion be agreed to those in favor will say I I uh those opposed will say no the eyes have it uh we're in the middle of a vote we're in the middle of a vote Mr Speaker I call it a personal vote no sit down we're in the middle of a vote the um uh the eyes have first a party vote's been called Mr Speaker a part vote has been called for there's a process here New Zealand national 49 votes in favor New Zealand labor 34 votes opposed green party of Alo New Zealand 15 votes opposed X New Zealand 11 votes in favor New Zealand first eight votes in favor to party Mai well come on come on [Applause] [Applause] [Applause] [Music] [Applause] the house is the house is suspended until the ringing of the Bells the gallery is to be cleared [Music] spee foreign fore,ok
zl_M2opGkuE,"Hey everyone, it's Sarah with registered nurser.com and in this video I'm going to go over family nurse practitioner job overview. In this video I'm going to talk about what an FMPP is, their job duties, educational requirements, salary, and the likes and dislikes of this profession. In my previous videos, I talked about acute care nurse practitioners, how to become one, and other videos like that. So, if you're interested in those topics, be sure to check out those videos and a link should be in the description below. So, first, let's talk about what an FMP is, a family nurse practitioner. This is a registered nurse with advanced practice education. They've either obtained a master's or a doctorate, and there's an asterk by that, which I'll explain that here in a second. And they work in a variety of se settings with um the general population of children to older adults. and they coordinate and provide care to patients under a doctor's supervision. Now, in some states in the United States, not a lot, but some states, they can actually work under their their own authority and they don't have to work under the supervision of a doctor. Now, why does this have an asterk? Starting in 2025, nurse practitioners, all nurse practitioners, in order to become one, will have to obtain a doctor of nursing practice, a doctorate degree in order to be a nurse practitioner. Now, if they're already a nurse practitioner, they'll be grandfathered in, but the new nurse practitioners will have a doctorate degree and master's degrees will no longer programs will be offered, and that's starting in 2022. So, just keep that as a side note if you're thinking about this profession. Job duties include they function m much like a primary care doctor where they care for for most of their patients from birth to old age. Uh they generally a lot of them work in clinics. I'll see their patients in the clinic. Uh they provide the routine care. You're going to go to this person your primary care doctor if you're sick need something or your routine annual checkup. They order diagnostics. They refer you to consults if you need to see a cardiologist, endocrinologist, anything like that. They prescribe medications, diagnose you. They assist in minor surgical procedures as well. Now, like I said before, some states can't allow nurse practitioners to practice on their own authority and even allow some nurse practitioners to open up their own practice. So, that's interesting. And um some specialties that nurse practitioners, family nurse practitioners like to work in, they like to work in surgery. uh the emergency room, they go into cardiac, oncology, renal. So, they can go into a variety of different um job settings. So, educational requirements. First, you have to be a active registered nurse with a BSN, a bachelor's degree. Next, you'll need to attend a nursing program with an FMP program focus. A nursing school will offer that. And like I said, starting in 2022, these programs will the masters will no longer be available. And um by 2025, if you're going to go in, you'll have to get a doctorate degree. And then after you do pass that, you um set for your state board exams to be licensed as a reg as a family nurse practitioner. Now, salary. How much do these nurse practitioners make? They make, according to payscale.com, an average of $84,785. This took all the nurse practitioners throughout the whole US regardless of experience where they work any setting added it all up divided it and that was the average. So it can vary on how much year of experience you have where you live and things like that but that was the average and the emergency room is the highest paying profession according to paycale.com. Okay. What are the likes and dislikes? Okay. a nurse practition family nurse practitioners report that they like having autonomy being independent because whenever they were a registered nurse, they knew what that patient needed. They knew what tests needed to be ordered, but they had to go through the doctor call and get an order. And they feel like now they can provide better care to the patient because they have the authority to do so because they can write the order and the patient gets better care and they have more respect since they've earned the title of nurse practitioner. What are some of the dislikes? Some of the dislikes reported is that some of the MPs were frustrated because they say that some of the patients don't truly understand what the scope of a practice of a nurse practitioner is and that they actually function as a doctor and they're actually cheaper on your medical bill compared to what a a doctor charges. Um, another thing was that they tend they went from working maybe three 12s a week, which is full-time, to having to work Monday through Friday, sometimes 10 12 hour days. So, they report working a lot more than normally. And they're on call, too. So, they may work through the week and even work the weekend, then go ride again and pick up the week again. And it's hard going from being hourly to salary because hourly you're getting paid by how much you work. and salary. You can work as many hours, but you are salaried, so you only get a specific amount regardless of the hours you work. So, those were some of the dislikes that they reported. So, that is the job overview of family nurse practitioner. Please check out our other videos and consider subscribing to this YouTube",ok
7NY3PAGzhBM,"Let's get to the reason that we're here and it's a beautiful reason because we're honoring truly talented people. Today we're thrilled to host the 2025 MLS Cup champions Inter Miami. Great job. >> [applause and cheering] [applause] >> And it's my distinct privilege to say what no American president has ever had the chance to say before. Welcome to the White House Lionel Messi. Lionel Messi is My son said, ""Dad, you know who's going to be there today?"" And I said, ""No. I got a lot of things going on."" He said, ""Messi."" And I said, ""Really?"" He's a big fan. He's a big fan of yours. He thinks you're just a great person and I think you got to meet a little while. So, he's a big soccer fan, but he's a tremendous fan of yours and a gentleman named Ronaldo. Huh? We have uh Cristiano is great. You're great. You boys have some some big champions, some great great athletes in that sport and people that really they really love they really love what they're doing and they're doing it well. And it's an honor for us and everybody at the White House to be honoring you today. So, So, Mr. President, it's USA 250. On the front we have our own jersey. And this is uh Trump 47. And Lionel Messi's number 10 is the best-selling jersey in the world. >> [applause] [applause] >> The ball was remade, which hopefully will have a rightful place in the Oval Office and dedication of you dedicated for our for our championship. That's where you was president. And then, most importantly, this is this is a very, very special limited edition Inter Miami pink Tudor watch. It's etched on the back with your name in a tribute to you and special because time is a precious element. Time has a lot of meaning, I think, to all of us. And we wanted to to give you that. And also, we have an an additional gift, which is another jersey for very luscious chief of staff. >> [applause] [applause] >> So, we do have we do have her jersey in somewhere. Number num- number number 32. Um, but thank you, Mr. President. Very much. And I want to just invite the team to the Oval Office, very, very special place. It's sort of the center of the world, especially now, but always. It's the center of the world. We have a little present for you there. And anybody would like to come, you can just follow me on down there, okay? You'll see the Oval and you'll have some fun. Thank you all very much. >> [applause]",ok
53LQVHy9aE0,,failed
YQQjjeFe_UU,hey everyone happy Thursday my name is Ashley I'm a women's health nurse practitioner I'm going to be taking over nurse.org's Instagram story so for the next 24 hours you all will be able to spend time with me ask me any question you want to but before we get started I want to know more about you all I want to know what part of the country you're in and also where you are in your nursing Journey so as far as the scope of practice for a nurse practitioner caring for pregnant women you're able to provide prenatal care postpartum care the only thing you're not able to do is deliver babies now if you want to be able to deliver babies then you should become a certified nurse Midwife which is another form of an advanced nurse practitioner but they are able to deliver babies it really just depends on what your job requires there are women's health nurse practitioner positions where you practice strictly in the clinic there are some where you practice strictly in the hospital and there are somewhere there's a mix of the clinic setting and going to the hospital to around on postpartum patients or anti-partum patients it took me about a year before I found my women's health nurse practitioner position and I believe that was due to me not willing to want to relocate and also not having any nurse practitioner experience which are two things you can run into with any specialty when looking for your first nurse practitioner job but I will say majority of my women's health nurse practitioner classmates they were able to get jobs at their clinical sites and also a lot of them relocated so women's health nurse practitioner positions are popular in States like California and New York I want to also add that as a women's health nurse practitioner new grad you don't want to limit yourself to only applying to jobs in an OB GYN clinic setting because as a women's health nurse practitioner you're able to practice in a variety of settings and in the next post I'm going to show you what different settings you can practice in as a women's health nurse practitioner to best prepare I recommend getting some type of women's health nursing experience whether it's on a labor and delivery unit postpartum unit anti-partum unit or in the clinic setting at an OB GYN clinic on Maternal Fetal Medicine Clinic Fertility clinic get at least two years of women's health nursing experience to best prepare to become a women's health nurse practitioner oh what led me to become a women's health nurse practitioner was the high maternal mortality rates in African-American women also I practice in Maternal Fetal Medicine which means I provide care for a high-risk pregnant patients and high risk pregnant patients are at an increased risk of dying during childbirth pregnancy and during the postpartum period so I feel like working in this specialty aligns with my purpose yes I do practice with other fnps in women's health settings so family nurse practitioners they're able to practice in women's health settings among a host of other settings so yes it is common to see family nurse practitioners working in a women's health setting I got two questions in the comments about my experience at Vanderbilt University if you all didn't know I received my Masters of Science in nursing from Vanderbilt University and I don't have anything but good things to say about Vanderbilt my experience was a 10 out of 10 top tier if I had to go back and do things over in nursing I would still choose Vanderbilt a hundred times over so Vander built their program they weren't trying to weed you out they actually wanted everybody to succeed I made lifelong friends during my time at Vanderbilt University I still keep in contact with my nursing instructors nursing professors from Vanderbilt and I very much so enjoyed seeing nursing instructors and nursing professors that look like me Vanderbilt is an amazing school they have an amazing nursing program so I recommend anybody wait a minute wait wait a minute how wait first of all you're not gonna speed past that like you didn't just say what you just said,ok
6hjWq8h5nnk,"(soft piano music) - My role is to ensure
preventative wellness for women, kinda serve as a frontline screener and to be able to get
them where they need to go if they have problems, but just to be able to also just handle their
basic screening needs. Knock, knock, Ashley? You ready? Hi.
- Yeah. - How are you?
- Hey, I'm doing well. - So a typical day for me
is in the OB-GYN clinic, I see about 20 patients per day. Some are OB/pregnancy related, where we would talk about the
dos and don'ts of pregnancy, medications you can take, kind of what the what's the plan out for these next nine months. And then as they come back
for their follow up visits, measuring their belly, making sure that the
baby's growth is good, listening to the heartbeat, and doing the various testing that are needed for each gestational age. As far as for the GYN visits, people who come in for their annuals, which is just baseline screening for breast cancer or cervical cancer, or with problem visits
for things like discharge, pelvic pain, issues with PMS, all kinds of the spectrum
of women's health. I started up a specialty clinic in 2019, for patients who have what's called PMDD. PMDD stands for premenstrual
dysphoric disorder, which is a very severe,
debilitating form of PMS. And so I serve as kind of a place to come and get information about the condition and be able to individualize
a treatment plan for the specific patient, because it's very individualized
of what we wanna do to kinda get them to a
better level of functioning. GYN in particular is a
very vulnerable population. When you're coming in, nobody wants to get undressed for anybody. It isn't as scary as you think. When you come in most of the time, to us, private parts are like, I
say, it's like an elbow. So to me, it's like, we've seen it, we've had it, don't ever feel ashamed or embarrassed to ask things. So really just to know
that when you come in, it's a place that feel
good, feel comfortable, and that's my main goal. I love it. I love the shop. I feel blessed to be able to
meet so many various women at different stages in their life. Just getting their period years later to getting married, thinking
about starting a family and being able to be with them, helping them each step of their way.",ok
-yOjy7MKNdA,,failed
