video_id,transcript,status
6B9kcC6zYjA,all right guys we've seen a lot about shin Sonic we've seen this man battle we've seen origin stories well today we've got Shin Sonic and his crew singing songs yeah you heard that right we're going to have Shin Sonic I think Shin Shadow and shin Knuckles is in this too but we're going to have a bunch of songs we're going to be reacting to every bit of this today is by H skunks big shout out to him I think he recorded the vocals and all that so I'm very impressed big shout out and let's get to it hold up I got to crank this up it's got to go all the way up in the headphones Knuckles on the drums we're getting straight into it too I like it there's three songs today this one is called Good Karma let me know which one you like the best in the comments cartoon cat what's he doing or is that car who is yeah that's cat who are these guys he was booing on and [Music] on oh now they're [Music] [Applause] Hy Shadow is getting it over [Music] here bro hor skunks with his animations dude they always look so good I think I say that every time is that PO what's he doing self explode joking on smoke yours are falling on and on oh B [Music] up I like this song [Music] [Applause] [Music] [Applause] dude hey this is a good start I like [Music] this my boy's bopping are Echo you [Music] can't and bro my neck's going to hurt after this man I'm over here bopping yeah hit that subscribe button if you haven't yet by the way get you some good karma hit that like button too let's [Applause] [Music] [Applause] [Music] go I can't believe I'm bopping into a song about humans getting erased but here we are oh my gosh well now we're off to song number two and it's called a liar this one sounds a little bit more on the calm down no it doesn't here we go I'll take it back I'll take it back [Music] immediately I like the beat to the first song A little better but we'll see let it ride let it ride [Music] poor sc's kind of got some got some vocals on them go [Music] scre [Music] ticket he got on you [Music] this is basic [Music] therapy you do it like that rank them at the end stay tuned to the end for the ranking cuz I already know how I'm going to rank these two the first and this one he said yeah just take the emerald no big deal oh it's about to be super it wasn't super but he's destroying the world the fire Bo liar I'm moving speed the of the Bro his animation videos are so good dude I love watching these and we haven't seen a shin Sonic song all right that's the second one and now the third and final song is called Running simply put running what are we running from just a bluish guy oh okay y I like this be hold up oh we've seen this video we haven't heard the song we've seen that video though he was getting [Music] disrespected ands ands see I can Bop this song too I like it's the Beats for me I [Music] am just a bluish guy man even though we're talking a super uh Sonic it's not really bluish but that's okay he told me on the adsun run it run it run it I think it's safe to say that the first one that we listen to easily the best that went hard it had its own music video but none of them were bad none of them were bad at all a hero you won't see no light whole long time you're running you're running but there's no Escape in the night out of sight out of I am I came with the ad Li [Music] dude let me know what you thought about the running song in the comments like I said we got one more video after this but this was the last song we're going to actually see how these videos are made and I'm hyped for that one I've always been interested in how he makes these running all right here we go music video called liar this is how they filmed liar oh they so they just got a big green screen back there I mean that makes [Music] sense wow that's sick actually that cave wasn't even there we had a little how did they my boy's talented [Music] man did y see the people in the background back there look at them just over there on their bikes they're like what are they doing you suck you didn't watch me if you film closer you can tell more emotion what kind of camera is that okay that thing looks crazy maybe that's just something you can view the leaf blower a not this angle Ys F on this abandoned highway this one's meant for Animals anyways as you can see I'm a little bit stiff but no problem no problem as knowing it's too late I'm faster than thought never you can escape the world fire scream just around see bro they do so good man I didn't know we had like a little Squad with him too I like that that's [Music] sick all right we now know how to make horor skunks videos let's go do it I'm just kidding I don't know how to make those models that's for sure my boy making gen Sonic before and after look at that that's what it looks like and then after that is insane shout out to horror skunks like I said though let me know what song was your favorite my favorite was the first one I maybe say the the third one was second place and the second one was third but let me know your ranking in the comments I will see you guys tomorrow thank you for watching with me I love you goodbye,ok
Mr-tMi97aeU,"building it with a view. Look at this view. Every day they work up and down here, up, down, up, down. Full body pain. But you know what? These guys, they have bodies of steel. Isn't that right, guys? >> Yeah. Bodies of",ok
xAcvIhbItb4,"Safety first for this driver, strapping on his seatbelt as he settles into the driver's seat. One big problem. He's just seven years old. Dashboard cameras captured Daniel Wittenbach taking his family's SUV for a morning joy ride. He almost hit another work vehicle. It was a boy, a child. He's driving the wrong way into oncoming traffic in Middletown, Ohio. Cars swerve to avoid young Daniel, who's a decade shy of getting his license. You can hear him playing music along the way. But then the inevitable happens. He hits a median and slows down. Another driver tries to help, wrapping a shirt around his hands, trying to smash in the window. Only then does Daniel think he's going to get into trouble. Stop! (thump on window) It's my mom's car! He didn't understand that people were trying to help him and trying to stop the vehicle. Another driver tries to body block the SUV but it still hits this Jeep head on. Ow! You're okay, you're okay. Daniel wasn't hurt and remains blissfully unaware of the danger that he was in. So where was he going? His only response is, ""Well I just wanted a Slushy from Speedway."" Turns out his parents keep the keys stored high on a wall, but Daniel's a climber. I'm just thankful that he's alive. (outro music)",ok
1YUFk6cPUDw,"guys I'm back in Dubai once again and in today's episode we are going to be stepping into a life that most of us can only dream of a home in Bush Khalifa the guest of today's episode is a multi-millionaire woman entrepreneur who has worked her way up from a middle class household in India all the way to the 80th floor of the world's tallest [Music] building and we're going to 76 how much time does it take 2 3 minutes it take that's too fast and learn about what exactly does it take to go from middle class to multi-millionaire we delivered massive projects my favorite projects is the IPL 2016 opening ceremony you did that yes wow her lessons on money her lessons on entrepreneurship I've been in debt I've been bankrupt you've been bankrupt I've been bankrupt I'm very aggressive at business all this good and kindness and women women and all no sorry there's no apology I will win when somebody else loses so it's not that empathy that oh my God you lost sorry buddy you lost you lost you lost so if you want to stay here one day you will watch till the end [Music] hi hi Sharon hi Hi shra how are you doing I'm good hi very good morning welcome to my channel welcome to B this is my first time ever on the 80th floor of any building I would love to know how does it feel like to live here come I'll show you please let's go [Music] wow this is the living room yes this is the living [Music] room I just want to know this is the B Khalifa most people are not aware that there are Apartments here no this is a residential building till uh 20 108th floor okay then from 123 to 158 we have offices oh there's more after that there's more after that 158 is offices yes 123 to 158 we have offices okay we have our residence Lounge on the 123rd floor okay and uh what's the last floor uh it's more than 60 but then it gets little steeper and it's more uh it's not for Public Access okay so we are actually in the half level yes we're in the half level tell me about this this dining area so this is more like a Bohemian maximalist kind of a design you like to maximize stuff yes look at these candles yeah these are these are a tribute to the fun evenings with friends that we've had this living room looks like I can stay here and Netflix and chill the entire entire life yes it is nice to be just uh when I'm home to not have any noise around me okay because otherwise I have a lot of noise I have a lot of interaction so it's nice to have the silence it's spin drop silence spring drop silence and then downstairs we have the Beehive for Dubai Mall you know honestly it's not about bulge it's home it's home where I come where I rest where I get to get mind space where I can be myself so shra you have a fantastic home now home is like a a symbol of achievement for most people and to have a home in B Khalifa I'm sure there's a lot of uh struggle and hard work that you had to go through to your life you know these sort of things don't come easy so I want to ask you a few questions uh about your journey is that okay absolutely sh come let's go to my favorite part of my house all right where is that you're going to play chess uh maybe not all right shra we've come to the favorite part of your house uh my first question to you is for someone to be living in the BJ Khalifa uh what do you do what do you do as a living uh I specialize in mega events okay and uh that's where I've built my career now what do you mean by Mega events Mega events is everything uh from ceremonies to award shows to uh large scale festivals so can you name anything I've done all the big work in India that you see all globally of Commonwealth Games Opening Ceremonies Asian Games okay femin Miss India film Fair Awards mchi Music Awards okay World Cup kabudi I think I won that tender five years in a row okay so uh big festivals I did the do tourism Festival so those are the mega outings where we either dealing with public including public with broadcast so I've delivered business in over 70 countries in my 30e plus career wow okay and I've been glob trotting forever 70 countries yes my God yes so this is just like one of your residences yes it is so you mentioned that you began this business 30 years back right so how did you begin like what is that first step that you took to begin it did you sort of get a lot of money in the beginning or did you start from scratch I have a very basic formula start where you are use what you have and do what you can okay so for example my sector is a service industry if I have the skill all I have to do is take a job because I don't need capex I only need Opex so I take the job deliver it uh the business within that budget and make my money so we delivered massive projects like especially one of my favorite projects is the IPL 2016 opening ceremony you did that yes okay and technically even today it's one of my one of my favorite shows okay because of the way it came together but no logic could have brought it together if you apply logic it's not happening so today can you tell me like what are the things that you're doing like what does a day in your life look like so uh earlier on as I said the minute uh my business had Surplus money what I was doing with it was different today I am not doing operations I'm acquiring companies having the founder uh still have a skin in the game with a majority State and let them run the businesses so the nature of my business has changed on scale and which is suiting me because I'm chairperson of the group of companies that I have so how many how many companies six companies right now so basically it's like you have the network and the contact so you know how to bring business in across the world in terms of execution you sort of uh you know give it to the other companies which you already have a St in absolutely this is ex exactly what I do there are certain instances in life where we are like okay work is also important but friends or my family is also asking for my help and if I choose the latter then the work can get impacted and this is the reality for most people in India right now that they're like they are always choosing work over everything else in life because if work gets impacted then they're like okay I'm not going to get the promotion I'm not going to get the money so that's the mindset that people usually tend to have how do you look at it the minute you're chasing money there's a stress point correct because the joy of the journey is gone correct but when I say that I'm okay with less I'm okay with having nothing I'm okay with if I lose everything I'll still make it again not because am I happy doing what I'm doing and happiness is not like Yay it's like a bliss Point am I okay am I all right am I eating right am I drinking water all of that the default is the money so the minute you chase your craft and the joy of the craft everything else is a side Side Story but let's say there's somebody who is let's say still working in an 9 to5 job they're earning let's say 50,000 Rupees a month 1 L rupees a month and the number one problem that they say is that okay I don't have enough money to start something you have a phone you have Internet it's enough so it's there's never shortage of resources it's always resourcefulness that people are lacking in okay what do you mean excuses excuses you don't have a big good body because you didn't eat right you didn't work out it's as simple for work and business so let's say at your Peak you had 300 employees right like how did you sort of manage so many people like what are some um um you know entrepreneurial learnings that you've had to order in order to get the best out of 300 people organization see nobody is okay with just money it's not human nature you mean like nobody's okay with just salary yeah it's they need more of themselves when the minds are used when they're challenged so I've seen that in my career in different countries that it's never it's never the salary which is an incentive it's the work culture it's the environment it's the people that you work with let's say knowing what you know today your entire journey and how hard it was or how difficult it was if the 20-year-old shubra gets to know that okay this is the journey ahead of me do you think should have taken it see there's so many Corrections that one can do it's like acting an actor seeing the scene can say oh I could have done it this way I could have done that so obviously when I look at her show I'm like oh my God I could have done this I could have done that but uh whatever is done Sharon is set in stone it's over no I'm saying like knowing how like the last 30 years you would have seen a lot of struggle lot of hard work lot of faure lot struggle lot of hard work if the 20-year-old shra is like she gets that knowledge okay this is how hard it's going to be do you think she have taken that first step yeah should have still taken I love I love what my journey has been every day tough money without money no money zero money minus money it's one has see as an ENT minus money also as an entrepreneur you have to see it all sometimes you're working capital when you're bidding for big tenders you don't have money for emds you don't have Bank credits we are a service industry a dentist is also service industry event management is service industry as per rules and msme rules you're supposed to get one CR CC limit but you event companies don't get it at least in a dentist you'll get they'll come and take your chair or Machinery what will they get with us old costumes so that struggle for money is part of your understanding also and yes I've been in debt I've been in debt I've been bankrupt you've been bankrupt I've been bankrupt I've had cases I've had frauds in the company I've had uh but when I look at the plus sides of what I have gone through and what I I wouldn't change anything about it so when you mean bankrupt the business had zero money and then you had to take debt also yes okay like how do you sort of like most people if they feel like okay they've made a business they made some money there after four or five years the the market forces have changed the business is not working anymore and it's not making that much profit so now it's loss making so they'll be like okay let me just cut my loss and stop like how do you sort of think say that okay I'm bankrupt but I'm going to borrow more money and still go into it ABS it again as I said that all of those decisions come from fear that oh my God this what has happened is really bad but if you see that as a learning uh you know the story of David and golat after a point there is a neutral place where only a human willpower will surmount it so if you have the willow that's when you win a race that's when but you don't have to that's one thing that is there I'm very aggressive at business all this good and kindness and women women and all no sorry that job is has to be brought in and I will do whatever it takes so I've I mean I have I think uh in the Tenders in India or globally it's a so all the equilibrium and all is one part getting the business keeping it alive keeping it in profit is part of the job because very earlier on I realized that the business and me are separate my personal life could be a certain way but my business is very aggressive H yeah there's no appology right I'll will win when somebody else loses correct so it's not that empathy that oh my God you lost sorry buddy you lost you lost you lost right so I'm focusing on the win because that win is what is keeping the company alive correct and in profit capable of getting the next job paying for the emis and the salaries of the team that is relying on that entity which is my business shra you are somebody who are lucky enough to find your passion right from the age of 20 so what lasting piece of advice you would give to somebody to find that thing for themselves which will make them work so hard that that that work doesn't feel like work anymore it feels like play how do you find that thing for themselves so I request all young people to understand that there is no formula there is no given of course there are acquired skills with the academic space which you know but to what output should they be applied to I'm driving a car does not mean I'll be sharker and do a Formula One racing I just drive to job and whack and just drive around right so it's it's pretty much that shra thank you so much I think this was a very enlightening conversation for me uh I think everybody has their own U journey to talk about about how they became successful your was very unique and very different about the way you look at life and the way you sort of look at success in general um and lots to learn from you I think this one hour conversation uh will um I'll keep watching this again and again to see you know what I can incorporate into my own life and I'm sure a lot of youngsters watching this in India uh will be take a lot of inspiration from this video thank you so much I think it's very sweet of you to say that and you are an accomplished person what you've done is credible and commendable and may you have a lot of success in what you are doing because you're doing it very very well God bless you I mean from the outside maybe it looks that way but I think from the inside the chaos is always there I think if I'm able to IM half of the things that you told me here today I think um I'll be a very successful entrepreneur not just in terms of money but also in terms of life and happiness in general yeah I hope and wish you an absolute wonderful journey ahead thank you for having me on your show guys thank you so much for watching till the end I'll see you in the next one",ok
UiWTm6yKCyo,"You're responsible for the erection. >> Yeah. Erection. >> There's a burge to buy from 156 up to the spire. >> Yeah. Yeah. Yeah. >> Was it a good job? >> Yeah. Good job. >> Full body pain? No. >> No. No. No. No. No body pain. >> No body pain. Up, down, up, down every day. No problem. No body pain. Your body pain your body. Your bacteria",ok
OKoF4l68qW4,,failed
mRogiWobJhg,foreign foreign foreign [Music] foreign [Music] [Music] foreign [Music] foreign [Music] [Music] foreign [Music] [Music] [Music] foreign [Music],ok
duH3Q7JjSkg,"Isn't that right, guys? >> Yeah. >> Bodies of steel. No problem. No task. Too big. >> Yeah. Yeah. Body is no pain. >> No pain. >> Yeah. Still ready. Up down. Up down is experience ready.",ok
wvhhuZWwZnA,"Hello, friends! 6th January, 2004. Dubai's sandy soil started being dug to build the tallest building in the world. Around the end of 2004, world's tallest building was Taipei 101. Located in Taiwan, this building was a little over 500m tall. But the goal they set out to achieve in Dubai, was unimaginable and record-breaking. They wanted a building so tall that not only would it be the tallest building in the world but also be 62% taller than the second-tallest building. The difference between the tallest and second tallest would discourage anyone attempting to break its record. Before Burj Khalifa, the previous world's tallest buildings, were about 5%-10% taller than their predecessor. At most, 19% taller. But here, they were aiming to build it 829m tall. A difference of 62%. It took about 5.5 years to construct this building, and on 1st October 2009, the construction of the Burj al Khalifa ended, and this building left the world astounded. After the success of Burj Khalifa,
several countries announced that they'll build even taller buildings. Many attempted it. But till now, all plans have flopped. It has been more than 13 years, and till now, the record set by Burj Khalifa remains unbeaten. Why? Why is it so difficult to beat this record? And practically speaking, how tall can the buildings built by humans be? Come, in this video, let's try to understand this. ""When the Burj in Dubai is complete it will be the tallest structure that mankind has ever built on the face of the planet. Until someone builds an even bigger one."" ""This is the story of the tallest tower mankind has ever built. Hald a mile high."" Friends, for about 4,000 years the tallest structure built by humans was It was built around 2500 BC as a tomb for the Pharaoh Khufu. Its height is 145m. This record was broken only after the 1300s, when a cathedral was built in England that was ~160m tall. For the next 500 years, this record was beaten by a series of churches, until the Eiffel Tower was built in 1889. But then, Eiffel Tower isn't precisely a building. It's not a building in which people can stay or work in. In terms of proper buildings, this building by Chicago Home Insurance, built in 1884, is known as the world's first skyscraper. This was a building built for humans. Where people went to work,
it was used as an office space. Before this, the previous tall structures, were either built for monarchs, or for Gods. This was a major turning point in human history. Though this building was only 55m tall. Shorter than the Great Pyramid of Giza. But only after this, did we get the innovation and technology that we could build habitable skyscrapers. When the competition to build tall buildings began, it was limited to New York and Chicago. Because America was the world's largest and most productive economy till the end of the 19th century. And these 2 cities were central to the most economic boom. Many people wanted to live in these cities. Big companies wanted big office spaces, and to accommodate people better in the city, these skyscrapers had to be built. Some honourable mentions here, New York's Empire State Building. It remained the world's tallest building from 1931 to 1971. It held the record for 40 years. And in the modern context, it held the record for the longest time. It was beaten in 1971 by another building in New York. the World Trade Centre at 417m. 9% taller than Empire State Building's 381m. In 1998, the competition spread out of America, and shifted towards Asia. When the Petronas Towers were built in Kuala Lumpur at the height of 452m. They held the status of the world's tallest building till 2004, after which, it was beaten by Taipei 101. And in 2009, with the biggest margin, Burj Khalifa beat all of them. From 510m, to 829m. Initially, when Burj Khalifa was being planned, its initial proposed height was around 550m. During planning, they kept on increasing the height, until it was as tall as we know. At that time, the brief of the tower was to design a tower which was 550m. Which was then slightly taller than the world record holder at that time which was Taipei 101. We learned as we got into the project that we could go higher. And there was a desire to go higher. And not only break the record by a little bit, but we could break it by a big margin. The reason was that in the downtown area of Dubai this building would be the centrepiece attraction. Before the 1990s, Dubai was basically a village for fishing and pearl diving. That had discovered oil recently. But by the late 1990s and the early 2000s, the leaders in Dubai wanted to diversify their economy. To move beyond the dependence on oil. They wanted to make Dubai an international tourism hub. To grab international attention and 
