video_id,transcript,status
Az3LtBz8G5M,,failed
35ahPKGHO5s,"This is a day in the life of a Japanese toy maker. [Music] [alarm sounding] [Music] This is Kana, 27 years old living in Tokyo and she's just waking up for work. she lives on her own in this 1LDK (Living room/Dining Room/Kitchen) apartment [Music] Her morning routine is fairly simple, because like most Japanese she prefers to take a bath at night so getting ready is quick, and finished after applying her makeup. Oh! She's wearing circle contact lenses, quite common in Japan! In fact 1 out of 4 Japanese women in their 20's and 30's wear either circle or color contact lenses [eye] see what they're doing! ;D How long does it take you to get ready? You don't eat breakfast?! Although she gets ready quickly, before she leaves the house she makes sure to quickly check her personal email as it's typical in Japanese business culture to only read work emails during work hours. [Upbeat music] Kana is originally from Aichi prefecture but moved to Yamanashi prefecture to attend university, majoring in regional sociology. Like many Japanese university students she started her 'shushoku katsudo' aka job hunting while in school, and was able to secure employment before graduation, which led her to Tokyo to start her new life and career. And as a person who has a deep appreciation for all things cute and fun, she naturally found a fit at a job for the last four years as a toy planner! Hey y'all we're doing another day in the life this time with a Japanese toy maker, maker. Kana should be coming on the next train, so excited for this one! Let's see how she's doing this morning! [Music] Good morning! So how did you sleep last night? She works at Sega Toys, creating some of the most popular toys in Japan. Formed in 1998 from its parent company Sega. One of the largest video game and entertainment companies in the world! Although many of the Sega Sammy companies are located in the same building, Sega Toys operates independently with 110 hard-working staff to create award-winning 'omocha', in English, [it means] toys, even with major brands like Anpanman and Disney. [Music] So our first task of the day is to check emails. How long does it usually take? Can you show me a toy you created? Wow! I guess this is a stock room for previous products! So cute ~ Now, Kana has her weekly meeting where each member is responsible for sharing how their own project is coming along; such as schedule milestones as well as possible delays or issues. And these days because of covid, what was once highly frowned upon in Japanese business culture, online meetings with co-workers at home has become part of everyday business in Japan. Otsukaresama desu ~ (Thank you for your hard work) Oh, it seems like they're done with the meeting! [Music] Where are you going now? So the company has a wellness system called the 'input day', which allows employees to use up to 3,000 yen (about $26) every month to experience new entertainment to help encourage creativity and understand new trends! [Music] Oh she's going somewhere! Where are you going? Kana usually goes to lunch around this time, but since she has a bit more work in the office, she's gonna grab a little snack to tide her over. Fortunately there's a convenience store in the building just a few floors down. Fairly common for large office buildings in Japan. How many toys do you plan a year? [Music] So it looks like Kana has a little bit more desk work, so while she's doing that, let's go toy around this place! :D [Music] Alright so this looks like the break area on this floor. They've got basic kitchen appliances and vending machines! Let's see what they have in the fridge! Oh! I guess people put their bentos in here! Wow and check this out, and this is the history of all the Sega arcade games. They even have the first one, the Sega 1000! Wow! Check out this amazing view! Ooh ~ That guy's playing with toys! Hi can I talk to you? What are you doing right now? So you made this toy? So what's Chain Rencer all about? Oh, I see! The little mini cards are propelled by the power of springs and slopes, and you can link together these mini tiles to make a unique track! Damn, the combinations must be endless! [Music] What was the hardest part about making this? So this is pretty cool seeing what everyone is doing, let's see if we can find some more people! Hello! Can I ask what you're doing? What does this dog do? [Music] [Music] Oh it dances too! Apparently Coco can understand and perform 24 different tricks! What was most challenging when making Coco? Apparently Japanese kids have a distinct voice compared to other countries, so there aren't many existing programs made for them. So, it was a challenge for her team to make the right adjustments. So which one did you choose? Thank you! :D Hello! Can I ask you a question? What do you do here? Oh, you're the CEO? Why are you sitting in the same room as everyone? So what do you think is the most important thing when making a toy? Apparently she was promoted to CEO this last April from the global and planning division! Must be inspiring for the employees to see someone from within the company to become its leader! [Music] Hey! Why are you reading a magazine? So Kana needs to produce four new toy ideas a month, about one idea per week. Everyone in her 12-person department set a goal for each term, and this is her goal for this term. In order to generate so many product ideas it's critical for her to gather information on trends, in addition to personally test new toys on the market. Today she's working on one of her new toy ideas using slime. Can I see what an idea board looks like? So cool~ Did you draw this? What are you doing now? It's also her job to help update the company's social media for toy she's managing. One of these toys is 'Maskook', where kids can design and personalize their own mask! Did you decide the color of the frame? Why blue? She says that the best part of her job is that she can think about ways to have fun, while also being creative at the same time. In reality it's not just her but a sign of the company culture. She's surrounded by co-workers who likewise enjoy toys and entertainment. Oh! You can make it like an earring! So what's the deal now? Yay! Finally lunch time! Kana usually goes to lunch with her co-workers but since she had some work to finish today she's eating by herself. Damn! Look at all these options! I must say the company has a dope ""Shain Shokudo"". In English, employee cafeteria. It's not free, but definitely a lot cheaper than restaurants outside. All the dishes on the menu today are all under five dollars! Itadakimasu! What did you order? White baked fish with half a boiled egg over rice! Looks delicious! [Music] So it looks like Kana's still busy at her desk, so while she's doing her thing, let's take advantage of this time and explore a little bit more. [Music] On the top floor of the office building,  SEGASammy have their shared reception for all of the group companies. It looks like they even have a shop at the SEGA office to buy goods! You can buy a mega drive, a nanoblock, and even a ninja trainer! Nice free SEGA water! And it looks like these are all the client-facing meeting rooms! Cool! Each room has its own design and theme! Since we have a little bit more time, let me see if anyone's having a meeting right now. Excuse me, can I ask you a question? What are you guys doing? [Music] What does it do? Ah! Got it! You can even press the forehead to make it blink and talk! And it also plays music! Oh, it also comes in leopard, unicorn, and fox! All based on what kids think are popular colors and patterns these days. So what's important to consider when making toys like this? So what's next after this? Ooh, can I have a peek? [Laughter] [Music] Excuse me! What is that? You made this toy? So it's a toy laptop with a popular Japanese character ""Sumikko gurashi."" In the Japan toy industry, it's considered a top seller when the toy has sold more than a hundred thousand units. This one launched this year and is already a top seller! So it must be ultra popular! Nice, you can switch characters as well! How long did it take to produce this one? Thank you! oh Kana's co-worker is doing something! What's that? Where did you get all of this? So which one do you think is usable? [Music] Now, she has a meeting with a 3d designer to discuss the design improvements for the next version of masscook. [Music] Oh, it looks like one of their Hong Kong office staff, who manages the factory production, is joining via video conference as well! Apparently when designing a toy, it's very important to consider the age of the kids using it, and absolutely imperative that every safety measure is taken to protect their customers. Meaning that any new revisions they decide today maintain or even improve safety. As her final task of the day, she writes a daily log of her activities to share with her co-workers. Are you done? Yay! Finally done! After work, Kana often has dinner with co-workers. But due to Covid, like many other workers in Tokyo, she goes straight home. [Music] Oh damn, it seems like she's pretty good at jisui, cooking at home. Interestingly, the average monthly cost of food for a single japanese working household is 40, 331 yen per month, about $350. So cooking at home is fairly common. [Music] So tonight, she has an online nomikai. In English, drinking get together. With some of her co-workers. These days, this is what a typical night would be like for her. She says she appreciates being able to catch up with her co-workers outside of the office, as well as see what everyone else is eating at home. So it looks like Kana is going to be in here with her co-workers until 11 o'clock, drinking. And then after that, probably go to sleep around midnight. But that's pretty much a day in the life of a Japanese toy maker. Let me know what you thought in the comments. If you guys want to see what I'm doing on the daily, check out my Instagram account. If you want to help support the channel then check out the Japan merch. And if you guys have any questions about Japan or Japan travels check out my discord community. Finally, if you want to see more videos like this or day in the life videos, hit that subscribe button and the bell button and I'll catch you guys in the next one!",ok
e_TxH59MclA,"This is a day in the life
of a Japanese game programmer. This is Masa, 23-year-old programmer living in Tokyo and working for one of the largest
video game companies in Japan and this is how he starts his workday. He lives alone in a typical Japanese apartment
which are known for their efficient use of space like this enclosed unit bath
with built-in sink facilities. Masa, how long does it take
for you to get ready for work? I only wash my face and change in the morning so. I only need 5 to 10 minutes. Like most salarymen in Tokyo,
he commutes to work by train. Door to door about 40 minutes so it's not bad but more than half of his trip is walking
to and from the train station. Not pleasant on rainy days like this. All right so Masa should be coming soon but the typhoons these months have really really crazy and look the trains are super packed. Good Morning! Crazy typhoon right? My pants are wet so I want to take a bath already. So Masa works for Bandai Namco Studios which is the network entertainment
unit of Bandai Namco Group. They're known for developing popular game titles
like Tekken, Mario Kart and even Pac-Man and there's about a thousand employees
in the Tokyo office spread across 5 floors. That's his digital time card. He's officially clocked in now. Also common in many Japanese companies is for employees to change
into slippers for the workday. So this is Masa's office. Very common Japanese style desk with low dividers. So Masa keeps his desk area
simple like many of his co-workers. It's very different when compared to western desks which are often littered
with decorations and family pictures. 1st thing in the morning he checks his email
as well as the internal company social network for updates while also having a quick breakfast. Masa where did you buy your juice? This? I usually buy ones on sale at the near supermarket. What is that? This is CalorieMate. It's kind of like a cereal or cookie. So Masa's doing his morning tasks right now. It's going to be some time before he has kind
of like a break because he's pretty focused. So let's go walk around the office
and see what kind of facilities they have. So right behind Masa's desk they have
a game corner kind of place right here. And they have the Switch,
they have PlayStation, they have Xbox and they even have some Virtual Reality here. I guess you get to play games
anytime you want which is pretty cool. Oh wow and just below here there's a big big computer. I think it's an alienware computer.
It looks like one powerful machine. All right so this is the break
room area on the 2nd floor. Let's see what they have. They separate all of the trash. They have your burnables, your cans and your bottles and you also have the non-burnables like plastic. They have a hot water pot and microwave. So this behind me is their snack corner
but it runs on the honor system. So basically at the top you have
a place where you deposit money, all the different chocolates or candies. They have a price for it and even the refrigerator
has a frozen treats like ice cream and whatnot and you just need to pay on the honor system
and then you take what you actually paid for. I don't know how would
this do in your country's office. All right and so let's check what's down here. So this place says library but in fact it's not
a library of books, it's a library of games. Check this out. They have all these different consoles
all the way from like Nintendo to PC and I don't even know what that is. An original NES here, GameCube, an original
Sega, Sega Saturn, even a Family Computer. They have like every single game ever
and it's not just in this aisle. They have this aisle and they have
this aisle and then they have this aisle but this aisle actually looks like books. They even have all kinds of game
cartridges from back in the day. Nintendo DS. They even have like a baseball game. Sim City. I wonder how many years it would
take to play all of these games. What's your favorite old school console
because i'm sure they probably have it here. So this area here is their
administration section of the office. It's kind of like the business side of the company and this behind me is where all the executives stay. So this area is a lot nicer than the common area but as you can see the offices are fairly reasonable. The president's room is fairly
the same size as the other executives. 'Otsukaresama desu'. Let's go get some lunch? Finally lunchtime. So he's Masa's 'douki' which means a co-worker who started working
at the company at the same time. In fact it's common for many Japanese companies to do mass hiring once a year for college graduates. Just outside this dope cafeteria,
food trucks come during lunchtime. Apparently the trucks vary each day but damn, it doesn't look like a pleasant
experience waiting in line during this typhoon. Masa, do you always eat here? I sometimes go out to eat or just pick something up
at the nearby convenience strore. So is this the only office in Japan? There are many companies in the BANDAI NAMCO group. If you consider all the group companies,
it's literally everywhere. Can I get 1 roasted duck bowl, large? I'm so hungry! That's a decent option for lunch. 'Itadakimasu' is a customary term used
by Japanese before each meal meaning let's eat or thank you for the meal. Looks like they have a little time
before their lunch break finishes. I wonder where they're going. What is that? This is our beloved Pacman! Oh wow they take their Pac-man serious here and like all the games here
it's also free to play anytime. Masa, so what are you doing now? Now I'm going to continue coding. So I've kind of got some free time while Masa
is working so why don't we spend this time and maybe go meet some people. So apparently they have all their different
teams working in different parts of the office. We're actually on a different floor right now. Excuse me, so what kind of work do you do? I am the Director and Development Producer
of CodeVein whcih was just released last month. What's CodeVein? So CodeVein is a dramatic exploration action RPG with animated out characters in a challenging
and dangerous dungeon environment. So can you show me? Oh the game itself? Let me show you in a different place then. Could you wait a little bit? I don't think he was ready to show
anyone the game right now but he's just asking some of his guys
to prepare the game for me and they're going to put it on the screen. So yeah I'm kind of excited
to see what kind of game it is. The main characters in CodeVein are all Draculas. So you can customize your own Dracula. Wow this is an attractive looking game. How long did it take to develop this game? Since we started to plan the game, it took... about 5 years. He also said that at one time there was about
200 people involved in developing the game and even when it's released development
is still not complete as they update the game based on user feedback and create
new downloadable content. Alright this is kind of fun let's go
ask more people what they're doing. It looks like just over there people are having a meeting. Let's see what they're doing. Excuse me, can I ask you guys some questions? Sure. So what do you do? We make a game called Tekken 7. And I am a Game Director of this game. What were you guys doing just now? We have downloadadble content called Season Pass 3. And we were just checking that. Can I get a peek at what you're working on? It's a secret. Oh wow they have a real deal Tekken 7 machine found at game centers right next to their work desks. I guess testing character
functionality is part of a day's work for these developers or maybe this is how
they settle arguments in the office. So it looks like Masa's not in his seat right now. He's supposed to be here but I guess not. Maybe he went somewhere.
Let's go find out where he is. Oh there's Masa. He's having a scrum meeting. I believe he has this meeting every day for 30 minutes. They review what they programmed
the previous day, what needs to be done today, and share and discuss problems for the future. And they use software to manage all the tasks
and display it on the screen during the meeting. Oh are you going to code again? I am going to continue coding but I'm a bit tired. So I'm going to special spot in the office. So where are we now? This is a space where you can rest or take a nap. Are you going to rest? Yup. I am! Okay so Masa has a full-on
employee nap space at his office and he even brought his own heated steam eye mask. He sure doesn't mess around
when it comes to his naps. What is that? the company offers free drinks. I usually get most of my drinks here. Now he's back to his coding again. So basically this is what Masa does all day. I mean from morning till the afternoon
until the evening before he goes home. He is programming like this in front of a black screen. I need to go to the 5th floor. Do you mind if I go? Oh he's going with finance
department to ask about expenses. So this is the 2nd scrum meeting. The sprint review held once every 2 weeks. Usually they combine it with their 1st scrum meeting but due to scheduling issues with one of the other
members they had to break up the meeting today. It is interesting though that they use
post-it notes to do their final review. I guess sometimes analog is just better. By the way the meeting rooms can
be booked from this digital panel here. That's pretty convenient. Now he's finishing up his tasks checking
emails that he missed during the meeting and writing a log of today's activities. I got to meet my friends today so I'm taking off soon. I am starving so I can't wait for dinner. Yay! Finally work is done. Just a little over 8 hours but Masa says he does have to do overtime
once in a while during large projects. Overall though that's pretty good for a Japanese
company as many other places require their staff to work a lot of overtime hours which is often unpaid. Now Masa is meeting up with his workmen for dinner. 'Otsukaresama-desu' is another customary
office term often used to greet your co-workers. A difficult translation loosely translated to mean
thank you for your work and today is payday and it's Friday as well so time to let loose a bit. Usually in Japanese drinking culture
everyone orders drinks at their own pace while everyone shares the food. Group splits the entire tab equally at the end
no matter how much each person drank or ate. Also smoking indoors in Japan is fine
as long as the restaurants are okay with it which is usually the case
with 'izakaya' drinking restaurants. So Masa what else do you do in your free time? I love games and other things but I've recently got into something that I'll show you later. Even after work, his PC desk is his go-to spot. Masa, do you watch YouTube? Yeah, I've recently been watching... this GUNDAM Channel that SUNRISE launched. I can watch GUNDAM all the time now. Well I don't know much about Gundam but I can tell from looking around he sure loves it. So what are you going
to do for the rest of the night? I'm going to build a GUNDAM model until I go to bed. I have several models that I haven't built yet. But today I'm building this one. So Masa is going to be doing
this for another couple hours. It looks like he'll be doing this until midnight so yeah this is what he does
at the end of the night. Alright so that's a day in the life
of a Japanese game programmer. What did you guys think? I actually have quite a few day
in the life videos so if this is your first time I'll leave a link to the playlist
and you guys can check that out and as always if you want to help support the channel then definitely check out the Tokyo merch
and if you want to see more day in life videos then I have so much more
coming so hit that subscribe button and the bell button and I'll catch
you guys in the next one.",ok
yC-DDo3ESwA,"This is a day in the life
of a Japanese university student. This is Yusuke, 22-year-old Japanese
university student living in Yokohama, part of the greater Tokyo area,
and it's time to get up for class. He lives in a two-storey house with his parents,
as it's within commuting distance to campus. In fact, it's fairly common in Japan for people
to continue to live with their parents even after graduation well
into their adult working career. And like most Japanese salarymen,
he also prefers to take a bath at night, so he forgoes a morning shower. So Yusuke is your typical 4th-year
Japanese college student with a good balance of school coursework, part-time job, and social life,
which we'll all get into later in this video. So he skips breakfast in the morning, but makes
time to feed his cat before he goes to class. His house is about a 10-minute walk
to the nearest train station, which is not bad at all. And as a student, Yusuke
is able to purchase a 'teikiken', which is a commuter pass,
allowing him to take unlimited rides on the specified route between his home and school. So Yusuke should be coming soon,
and this is actually the end of the line, so I don't know whether the train is going
to be coming from this end or this end, So we'll just have to see. 
I'm guessing it'll be coming from this end. - Good morning!
- Good morning! Yusuke, where are you going now? I will get on a bus to get to university. So Yusuke takes the train and bus to get to campus, with a total commute time of about
1 hour and 10 minutes door-to-door. And since this campus doesn't have direct train access, most students take the bus from
the closest train station to get to campus. Yusuke, is it always this crowded? When it's really crowded... The line goes down to the subway gate. He says that the university has a 'ryo',
which in English means dorm. Only a limited number of students can stay there, so many students not living
with their parents at a commutable distance, will rent apartments near the campus. This is Yusuke's school, Keio University,
one of Japan's top universities. So Keio, like many Japanese universities,
don't just have one large campus, but rather is made up of multiple campuses. Shonan Fujisawa campus, where Yusuke attends, is one of 10 plus campuses spread
throughout the greater Tokyo area. A student's study focus will dictate
which campus he or she attends, and since Yusuke is a policy
management major, he attends this campus. Yusuke, why is the campus so quiet? It's pretty early so that's probably why it's quiet. Also, the student population is smaller for
the size of this large campus. That could be another reason as well. Do people drive to school? If you have a car, there's a parking space down there. Some people drive I guess. What percentage drive? 5% very few. So it's customary in Japan to take off your shoes
when entering the house to keep it clean, and this also applies to some
public facilities at the school. Most gyms in Japan, just like this one,
you need to bring a second pair of indoor shoes. I personally appreciate how clean it is in Japan. This campus has a pretty nice gym, open to all students. He says that you need to pay at other campuses,
so I guess it really depends on which one you go to. Do you do that every morning? Sometimes. I do karate 3, 4 times a week. And when I can't practice karate, I workout. So, what are we doing now? I'm going to study and do homework a little bit. This area has seats for individuals
so I'm going to work here. In his 4th and last year at university,
he can opt to take an easier schedule, as his future job once he graduates
