video_id,transcript,status
so it gets pretty high up on our list here. 134 is Necrozma Dusk Mane, followed by number 133, Necrozma Dawn Wings. The Dawn Wings one is slightly better, but also I think the Dusk Mane one has technically a higher peak, so it's it's ambiguous which one is actually better. 132 is Hatterene, a good Pokémon with a great design that also you can't argue with results, because it kind of defined an entire archetype in Psyspam thanks to how strong it is as an Expanding Force + Trick Room user. Speaking of Psyspam, at number 131 we have Armarouge. I think Ceruledge's design is a lot cooler than Armarouge, but by far the better Pokémon between the two is Armarouge in a competitive setting. Armarouge is another Pokémon that's able to really use the Expanding Force Psychic Terrain archetype. It's a pretty, pretty scary results. 130 is Tingus-Lu. 129 is Alolan Marowak who, fun fact, is a World Champion. I think Alolan Marowak is really sick, because they took the original Marowak and just like kept the parts about it that made it good, but just improved them. And I think the new typing is awesome. 128 is Dusclops. Dusclops was like running the show back in the beginning of Sword and Shield. It was so good against Dynamax Pokémon. If Dynamax comes back- which I think it will in Champions- I think Dusclops could be good again, because of how bulky it is, and how good it is as a Haze user. And at number 127 putting us back in the bad Pokémon with spectacular designs category, we have Mewtwo. I love Mewtwo, it's one of my all time favorite Pokémon, but undeniably it's a terrible,
terrible, terrible Pokémon competitively- in the formats it was legal. It's a very important qualifier;
if you use it against like, weaker Pokémon, of course it's strong. Mewtwo's so bad that even though it has two Mega Evolutions, it still doesn't see any play. Fun fact, there was a period where Mewtwo was like decent in 2010. Like way, way back in the day, it was at least usable, but I'm pretty sure it was mostly usable to blow itself up with Self-destruct. Number 126 is Exeggutor, speaking of my favorite Pokémon. Iconic, classic, and also pretty good. And closing out our category, at number 125 is Mawile. Mawile's another Pokémon where you just can't argue with its results, and I like the design of Mega Mawile a lot- I think it's a great, great, great Mega Evolution design, and it's very strong. We're at peak now, okay? All the Pokémon left are incredible. This category's name is Real Heroes. And fittingly enough, kicking us off at number 124, we have Palafin. 123 is Landorus Incarnate. 122 is Azumarill. 121 is Kingdra. That's a real hero to me, especially last year, with my little Perish trap team. 120 is Deoxys Attack, followed by 119 Deoxys Speed. I do wish Deoxys were legal at some point, it's a cool Pokémon. 118 is Excadrill. I think Mega Excadrill's gonna be an even bigger hero. 117 is Chandelure. Now, Chandelure's not like, a super good Pokémon, and so it actually ends up in a subcategory here which I'm going to call Masterpieces. These are Pokémon that maybe aren't as good competitively as the rest of the tier,
that maybe aren't as good competitively as the rest of the tier, but they're just so good from a design angle or from an iconic- iconicity angle that they deserve to be up here anyway. 116 is Origin Form Palkia. 115 is Sky Form Shaymin. 114 is Tinkaton. 113 is Baxcalibur. 112 is Roaring Moon a really high placing Paradox Pokémon. I do wish it were a little bit better, but I think it's a really cool design. 111 is Archaludon. They did a really good job making a Duraludon evolution, and the fact that it's so viable
and has so many different sets it can run, I think is awesome. Great job, Archaludon. 110 is Indeedee Female. Really nice design, and also just a very good Pokémon. 109 is Butterfree. It's both usable and so memorable. 108 is our final fossil Pokémon, Dracovish. Dracovish took over the game in a way that no other Fossil Pokémon ever has, and hopefully never will-
until they make Mega Dracovish. 107 is Entei. Great Pokémon, and also just so memorable because of the movie, because of how like, cool it is. 106 is our two time World Champion, Iron Hands. Iron Hand, fun fact, is our highest placing future Paradox Pokémon. 105 is Reshiram. This is another masterpiece with a great design. It's not like, a super good Pokémon, but it's good enough, and I think the design is really cool. 104 is Scrafty. Scrafty's another Pokémon that was on that first team I ever used in tournaments. I really like it a lot, and I think, especially given that it now has a Mega form, I think it's just going to end up being one of the most beloved Pokémon of all time. 103 is Corviknight, followed closely by another regional bird at number 102, Talonflame.
 Corviknight and Talonflame are our final regional birds on this list, which makes sense because they were also the best two regional birds out there. I went back and forth between the two of them because I like Corviknight's design more, but Talonflame was just so overwhelmingly broken in a way that Corviknight never was, and frankly, no other regional bird ever could be, and so in the end, I decided to give it the edge. But it was close. And our final Pokémon before the Top 100; coming in at number 101, it's Blaziken. And with that, there are only 100 Pokémon left to cover. The 100 Pokémon that I've estimated are to the best of my abilities, the best ones ever made. These Pokémon put the rest to shame, but before we start talking about them, I thought it could be fun to talk about some of the statistics for the Top 100 on the list as a whole. Generation 5, for example, performs a by far the worst out of the Top 100. It is true that 6 has the fewest Pokémon represented, but again, remember that that regional Dex is really small. And so actually, percentage wise, it's not doing as bad as Generation 5. Three of the generations actually have fewer than ten representatives in the Top 100: Generation 2, 5 and 6. Generation 5 only gets seven Pokémon in the Top 100, which is especially surprising when you consider that Generation 5 has the single biggest Pokedex on our list. Having closer to 4 than 5% representation in the Top 100 is really bad, and I don't know exactly why this is, but I do think Gen 5 is kind of in this uncanny valley, where a lot of the Pokémon are not as like, iconic and memorable as the ones from earlier generations, but they also tend to not be quite as strong as the Pokémon that have benefited more from powercreep in later generations, and also do just generally received a little less love- in terms of like, regional forms or Mega Evolutions or, you know, Gigantamax forms. Generation 5 does tend to be kind of the black sheep of the Pokémon franchise. Now, it is worth noting that Legends: ZA introduced a ton of Mega Evolutions to these Pokémon, so I'm hoping that going forward, they will see a little bit more love. But as of the time I'm recording this, that's the way things stand. Also interesting to note is our top performers. Now, we all know which generation we would expect to be the most represented in the overall Top 100 list, and that's Generation 1. And Generation 1 does perform quite well; but actually, Generation 1 is only the second most represented in the Top 100. The best performing generation overall is Generation 9. This is in large part due to powercreep. Almost all of the Generation 9 Pokémon are viable, and many of them are very, very, very good. Even though the Generation 1 Pokémon do across the board tend to perform better in terms of how iconic they are, because they're the first generation, at this point on the list, all the Pokémon remaining are so good in terms of design and in terms of how iconic they are, tjat being really good competitively actually is making up a big difference here at the top. Generation 9, by the way, has the most Pokémon represented, but it has a significantly smaller Pokedex than Generation 1. Now, we didn't want to talk about stats when we got to the top 200 because you know, it just this is already a long video, and we didn't want to overwhelm you, but, there is something interesting that Zane just pointed out to me that, is actually- Zane, you can just tell him. So yeah, I've been doing most of the stat collection here, and I feel obligated to mention this, because Generation 5 is one of my favorite generations of all time. Generation 5 was doing pretty well in the bottom half vs top half stats. And what's actually interesting is that in top 200, it was doing okay also; it was still the second worst performing generation. But in terms of the actual mons there, it had a pretty high amount of mons with 22, which is right in the range of other things there. But when we get to Top 100, there's this huge fall off. And I think that that's because there are all of these Pokémon that we think of ""it's really cool"" from Gen 5, but that just having, like Wolfe said, got the love- things like, you know, Terrakion and Ferrothorn and Mienshao, and I do think it's interesting that they all like, just couldn't quite make it that extra mile. And it's a lot of these Pokémon that performed really well back then or are really cool, and yeah, the ""when are we getting Gen 5 remakes, Game Freak?"" I guess that's what I'm saying, really, here. I really like your stats, Zane, but I did notice that you called Ferrathorn Ferrothorn, and therefore your entire opinion is invalid. 100 Pokémon still remain. 100 Pokémon better than all the rest. 100 Pokémon that have stood the test of time; that have persevered in the face of adversity. 100 Pokémon that have the grit, the gumption, the memorability, and the competitive results to back up their placement as the 100 best Pokémon of all time, each of them painstakingly evaluated on multiple criteria, so they could each be placed exactly where they belong, with precision that would impress a surgeon. And so it is my honor to introduce you to the 100th best Pokémon. The Pokémon that, when all the dust had settled, landed firmly atop one of the most illustrious categories in all of gaming. The 100th best Pokémon is Pikachu. I swear we did not rig this. Pikachu obviously gets maximum scores for both iconicity and design. What might be surprised to know is that it actually has a pretty decent competitive history thanks to its signature item, the Light Ball, and its signature Gigantamax form. Pikachu may be the biggest benefactor of nepotism in the entire franchise, but make no mistake, it has earned its place on this list with its own hard work. Number 99 is Tatsugiri, a Pokémon that is perhaps a little bit too viable, with an incredible design. Number 98 goes to our highest placing regional form, Hisuian Arcanine. Arcanine was already a great Pokémon, but I think they did a good job of redesigning it in a way that feels both memorable and has a unique way to play it compared to the base form. They also managed to take Magcargo's typing and make it usable, which I think deserves major props. Number 97 is Sneasler. I do not like Sneasler, but I cannot deny that she is a girlboss
(fun fact, Sneasler is called ""Snieboss"" in German) and she deserves her place here in the Top 100, as much as I don't want to admit it. Number 96 is Greninja. Greninja is an interesting case, because I think it's one of the most memorable
and famous and well-loved Pokémon of all time, and that's the reason why it deserves its spot in the Top 100. It can't be put much higher up because Greninja's competitive Viability is a lot lower than you might expect given how cool it looks, but there were times where Greninja was good. It never got to be great, but maybe Mega Greninja will change that. Number 95 is Jirachi. Now, Mythical Pokémon are not competitively legal, but if Jirachi was legal, it would be quite good. Jirachi I think is especially memorable- Did anyone watch that Jirachi movie as a kid? I loved that movie as a kid. And Jirachi has a great design, it's certainly one of the 100 best Pokémon. 94 goes to Dondozo. If this list were purely based on my emotions, Dondozo would be in the 1100s; it would be after the Pokedex ends. However, it is very memorable, it's very good and the design is really cool. Dondozo ntroducing a super mech combination style mechanic to the Pokémon franchise I do think is neat, and Dondozo outplaces Tatsugiri because even though I do like the three different colored Tatsugiris and their unique interactions with Order Up, Dondozo can function without Tatsugiri in a way that Tatsugiri could never dream of. Even though Tatsugiri is the commander, it seems like it's Dondozo who's calling the shots. Number 93 is Tapu Lele. Bulu is the only Tapu not inside the Top 100, and I honestly think the Tapus as a whole really nail the concept of a Legendary quartet. All the Tapu Pokémon are memorable, because they introduced terrains to the series in a way that was actually accessible, rather than clicking Grassy Terrain with your Gogoat, and I think it's really a testament to how broken the taboos were that Lele, who can destroy your entire team with a Psychic move, places only at rank 96. We'll have to see where the other Tapus end up. 92 is Darkrai. Darkrai is another Mythical Pokémon, meaning that it's almost never legal in official competitive tournaments. However, its design is great and its signature move has certainly had an impact on the competitive scene. 91 goes to a generation 9 evolution of a Generation 1 Pokémon: it's Annihilape. I think that they really nailed Annihilape from a design perspective, and I also love its signature move, Rage Fist, because it introduces a really new way to play Pokémon that we haven't ever had to manage before. They also did a good job in making sure that that multiple viable sets that it could use and wasn't just forced to be a set up Rage Fist Pokémon. Overall, I think it's a great design and they really nailed it from a competitive standpoint. Number 90 goes to a Pokémon that in some ways we've seen before on this list, because it has multiple forms. The second highest placing among them, though, is Rotom Heat. The design is so funny. I love the idea of like a possessed Easy-Bake oven; and Rotom Heat for a while was a very good competitive Pokémon. 89 is another evolution of a Pokémon that's been around for a while. A Pokémon whose pre-evolution saw success before it even was a pre-evolution. The 89th best Pokémon on the list is Kingambit. Kingambit has an incredible design. I love that it completes the chess imagery and naming system from the pre-evolutions, and it is a very good competitive Pokémon that has a cool signature move, a really sick signature ability, and ends up feeling consistently like a very good Pokémon without overstepping into broken territory. Number 88 goes to another classic Generation 1 Pokémon, and this time it's a Legendary. It's Articuno. Articuno for a long time was thought out as one of the worst Legendary Pokémon competitively, though I think everybody agreed that the design was incredible. However, during Scarlet and VIolet's lifespan, it actually won a tournament, and a major tournament at that. With its newfound competitive success and its incredible design, it absolutely deserves to be here in the Top 100. Number 87 Regieleki. I love the Regis. I loved the Regis back in Generation 5. I brought Registeel to Worlds. That was not a good decision, but I did do it. When I heard they were making New Regis, I was both excited and worried because like, there's pretty big shoes to fill; prior to Generation 8, none of the Regis had ever been considered any good, and so I kind of figured, ""well, if they're making new ones, they're probably also going to be bad"". And so I was quite surprised that Regieleki was actually quite good. What I was more surprised by, though, is how fun the design is. I mean, it's basically this, like overflowing light bulb. And despite not being a Pokémon that, like, has a super expressive face, it's actually quite cute. The way that it bounces around in battle I find really endearing. I think Regieleki hits this nice sweet spot of having a really fun design that is inspired by the original trio that it's based on, or I guess, adding on onto, while still having its own unique and distinct feeling. Number 86 Maushold. First of all, the name. I mean, how could a Pokémon that a household of mouse not end up in the Top 100? That's why you know this list is serious, okay? Anyway, Maushold is awesome. I love Maushold. This has got to be one of the best, Generation 9 Pokémon, certainly. Maushold's a cool Pokémon from a competitive standpoint, because it has two roles that it can fill: the first uses its signature move Population Bomb to just destroy opponents, and the second plays a more supportive role. I think Maushold is a good example of how Generation 9 introduces Pokémon that are fun and don't take themselves too seriously, while still having good and memorable designs. Number 85 is Togekiss. If I told you the Togekiss was at one point the single best Pokémon in the game, you might find it hard to believe, but it's true. During the first formats of Sword and Shield, Togekiss was not only good, it was extremely centralizing. Even back when Togekiss was running the game, it had a couple different sets of could use. One involve combining the ability Super Luck with the old item Scope Lens, which meant all of its attacks had a 50% chance to critical hit. So players would Dynamax Togekiss and then just hope that it crit everything, which it would do 50% of the time. It also could play a supportive role outside of Dynamax, using moves like Follow Me and Yawn and Helping Hand to disrupt your opponents or boost your teammates. As with pretty much every Pokémon of the Top 100, Togekiss has a great design, but I think that Togekiss is especially memorable because, like Togepi was so memorable for those of us who grew up with the anime. And while I like Togetic, I do think it's a little bit disappointing, at least from a competitive angle, and so having Togekiss be introduced and have it be actually one of the best evolution introduced in that Generation 4 like, period- I personally think is really cool. Number 84 is Nihilego. Nihilego is one of the best Ultra Beasts. It gets extra points because the scene where it takes over Lusamine's mind I think is pretty memorable, and therefore makes it more iconic. And I think also the idea of this Poison/Rock jellyfish is really cool. Nihilego was also one of the best competitive Pokémon in Sun and Moon, and even had a little bit of success in Sword and Shield. I think it would have been pretty good in Scarlet and Violet if it had been in the game as well. It functions as this fast and offensive special attacker who takes advantage of the fact that it has like, pretty good special bulk to actually be pretty annoying, and it uses its ability Beast Boost quite well, where every time it gets a KO, it can get either a special attack or a speed boost, depending on how you've trained it. It's a cool and fun Pokémon to use. It plays a pretty big role in the main story of the Sun and Moon games-
and maybe the anime, I didn't watch it. And I think its status as an Ultra Beast elevates it even further. Also, Zane has just reminded me that Lillie's design is actually based on Nihilego. Like there's a parallel, because Lusamine's so obsessed with this Pokémon and is not obsessed with her daughter- I think that's pretty cool. Number 83 is Gardevoir. I don't think that anybody's going to argue with me that Gardevoir is both memorable and iconic, but what I think is interesting about Gardevoir is that it's actually filled a couple different roles and competitive Pokémon. If you look at Gardevoir stats, it doesn't seem like a super good Pokémon, but it actually won the World Championships
when holding a Choice Scarf. Mega Gardevoir has also seen a fair bit of success, even winning the US National Championships back in 2015. Gardevoir benefited a lot from the addition of the Fairy typing, and I think it's really great that they also let it keep the Psychic typing, because even though there are other Psychic and Fairy types, it still lets Gardevoir keep a somewhat unique identity. Number 82 is Swampert. It's been a little bit since we had a starter Pokémon, but there are- There are a fair few of them in here. Swampert is just the best, right? Mudkip is probably the most popular Generation 3 starter? That's a tough one, because all three of them are so beloved, but I think Mudkip is probably the most popular. Swampert being its final form is pretty cool, and even though I think Swampert is a lot stronger in a playthrough than it is in competitive Pokémon, it has a couple results. In fact, it actually got Top 8 at the World Championships back in 2012. It's not a Pokémon that I think is mostly known for being a competitive threat, but I think the fact that it's so memorable and it still can keep up competitively is pretty cool. Number 81 is Tornadus Incarnate form. This is one of the best competitive Pokémon of all time, period. Tornadus is the original Prankster Tailwind setter, and Prankster Tailwind is one of the best forms of speed control in all of competitive play. Tornadus is also interesting because it's filled a bunch of different roles over the years. Tornadus, when it was first introduced, was actually a physical attacker, using the move Acrobatics in combination with the Flying Gem. And actually, when Tornadus won Worlds, it didn't even have the Prankster ability, it used its hidden ability Defiant. Over the past decade, though, Tornadus has changed a lot, and is now good generally, but especially good when it's paired with Kyogre. Kyogre makes all of its inaccurate Flying moves 100% accurate, and that is a pretty nice buff for a Pokémon that is actually quite strong, given that it mainly fills a supportive role. Number 80 is Farigiraf. I think Farigiraf is my favorite Pokémon introduced in Scarlet and Violet; it's just so cool. Its signature ability Armor Tail is just a lot of fun to play with, because it lets you shut down your opponent's priority moves without needing to commit to using Psychic Terrain. It can function both as a defensive Trick Room setter or as an offensive Trick Room sweeper- That's my personal favorite set- and I think it's a Pokémon that's really skill expressive. In the first few years of Scarlet and Violet, Farigiraf got second at the World Championships and then won. I also feel like I like Farigiraf extra because Girafarig is a Pokémon that was so forgotten for so long and also is just so bad. Like, nobody was ever considering using Girafarig, right? And so to give it an evolution, and have that evolution end up in this really nice sweet spot of being really good, sometimes even great, but not being overpowered and still feeling true to the original Pokémon... I just think it's awesome. Number 79 Clefairy. You might not expect to see a not fully evolved Pokémon up this high, but Clefairy is actually better than Clefable in competitive play. This is in large part because Clefairy has the ability Friend Guard, which Clefable loses, and Friend Guard is really great in the official competitive format. Clefairy is a really fun Pokémon. It's also the Pokémon that I personally associate with like Stone evolutions just as a whole. I guess that and the Eevee's, probably, because that was the first Pokémon I think I ever evolved using a Moon Stone, which might have been the first Pokémon ever evolved with a Stone, period. It's a fun Pokémon. It's super cute, super memorable, very iconic, and the fact that it also gets to be good competitively is just the cherry on top. Number 78, Heatran. I love Heatran. Is he a frog? I think he might be a frog. Some Legendary Pokémon just feel like weirdos, but I think Heatran really feels very Legendary. I just made a lot of people mad. Like, okay, here's what I'll say about Heatran. Heatran is who Volcanion thinks he is,
but he's not. Heatran's Heatran. Heatran's a cool Pokémon competitively; in years it was used, it was one of the best; now I would say it's only okay some of the time, but it is still pretty cool. Fire and Steel typing is sick, having an immunity to Fire type moves is really cool... Heatran can work both in and out of Trick Room. I can work with sun, and doesn't need sun to be up. It's a pretty flexible Pokémon. Also, it's a frog, and I guess I guess what I'm learning is that I like frogs. Number 77, Ursaluna Bloodmoon. This Pokémon is strange. Competitively speaking, it's very powerful. It's been good with Legendary Pokémon are banned, it's been very good with Legendary Pokémon aren't legal. What I think is most interesting about Ursaluna Bloodmoon is that it exists. I feel like in recent Pokémon games, they really are trying to give love to Pokémon that are older and have kind of been forgotten by time, but Ursaluna Bloodmoon is a play on Ursaluna, who was only just introduced in Legends: Arceus. That being said, I'm glad that it exists, even though it sucks to play against, because the idea of this zombie bear that walks on two legs is very unique and very memorable, and I think it does a good job of taking the moon like, iconography that exists in the Teddiursa and Ursaring and Ursaluna line, and kind of giving it this more spooky Halloween theme. And I think that it's a Pokémon that even if you only see it once or twice, you are likely to remember. And I'm sure the people only grow fonder towards it the longer it remains out. I'm future proofing this list, okay? I'm predicting that people are going to
