video_id,transcript,status
somewhat awkward for them, right? I'm going to Draco Meteor this Flutter Mane,  and I'm gonna pray to God it switches to Chi-Yu. That's not the right move. Hello? Okay. They're locked into Shadow Ball, though. If the smartest. Okay. I mean, I made the right play. I just did it in the wrong way. Like. I mean, I could have Earth Powered for a little chip there, I guess. Anyway, sun ends now, so they lose their Booster Energy. I think I have to save Drago here. Okay. Protect plus Heavy Slam. Okay, they didn't switch. I think that they're probably just gonna double Steel again here. Yeah, well they couldn't. No they can't. they can. Draco. That's strong -okay I made the wrong fight. But honestly like- oh, that's really strong. Yeah. You see the issue with the Bolt, right? Although, like, what are they doing here? Wait. Hang on. What are they doing here? Are they going for Snarl? Wait a second. Hang on a second. What are they doing here? Are they going for Heat Wave? You know what I mean? Like, what move are they going for here? I'm gonna Draco Meteor. Draco Meteor + Protect. I still have my Tera as well, though it doesn't really help me here. I don't think I should use Steel Tera. I wonder if I should have exploded earlier. Anyway, let's see. This is the crucial turn; I'm so far behind. I really don't expect this to work. They go for Heat Wave. Okay, so here's the question, chat. It's pretty strong. I hit Draco, so Chi-Yu is going down here. They can't Draco Meteor me, right? Like, I don't think they're allowed to go for Draco Meteor here. Also, how heavy is Registeel? I actually don't know. I know Raging Bolt is really heavy. It's Thunderbolt. Okay, Heavy Slam is about 16%. You know, I actually think I could have won if not for that. Isn't that crazy? The para changes a lot. Like, I actually think without it, with a 3 to 1 lead, I think it was possible. Thunderbolt I should live. Good job, Registeel- Heavy Slam. Here's the thing: I'm faster with Regirock. So if I Explode, they're Giga dead. Who else thinks it went to Drago again? And Heavy Slam. My heart is going like a million miles an hour. Okay, they KOed Drago, but now they're -2. Hold on a second. Hold on, hold on a second. I can't explode anymore. But I can Heavy Slam, they're -2 It didn't Thunderclap, and explosion w ould have made the game I should be. I should be living in other one. I can just Rock Slide here. I think they have to crit me to win. I think I can win, I have to Rock Slide here. I have my Tera left. It doesn't help me. Thunderclap, do I survive? I don't, that's fine. Regirock, you did a good job, buddy. I'm really proud of you. It's winnable. It's winnable. Registeel might Heavy Slam this thing to death, because I'm not taking very much, and I still have my recovery. I think that's in range of one more. That did like 25%. I Protect here in case of Thunderbolt para full para. Yeah. The Draco really changed things. Thunderbolt. Okay. All right Registeel, bring us home. One Heavy Slam. One Heavy Slam, and we're in it. Just get one more attack off, buddy. Raging Bolt counter that we need. I need to not get crit, which is like 94% of the time. Okay, here's Thunderbolt, is Registeel gonna tank it? Okay. Only takes about half of its remaining health, it doesn't para'd, Heavy Slam. Okay, I know I don't have an actual, like, Tera Fairy Raging Bolt answer, and I know, like, based on how well this opponent played, I'm probably so likely to lose this set, but my God, does that feel like a good win to get. My God, that feels good. Oh God, oh my God, that was so stressful. And even still, I have to do it again somehow. So okay, I think the first thing to do is I'm feeling a little amped up. Let me take a second. I just refilled my chug chug here. Let's think this through. Okay, so I think that I've learned more about the matchup now. I've confirmed that they are, that they're smart,
 which is a huge, huge problem, to be blunt. The fact that they know that they're like, good,
is like the worst case scenario. My original idea was to switch to a Eleki + Rock lead game two. I'm gonna try this. It's- it's- it's risky. It's risky. I'm basically hard calling out that Flutter Mane is not in the lead, which is a decision that I can make and one that I am making. Honestly... is it Gigas? Gigas is like kind of my homie. I think it's Gigas. I'm bringing Gigas in the back. I'm- I'm leaving Drago behind. This is a mistake, probably. I'm doing it. I'm doing it, I'm doing it. Okay. I expect to see Raging Bingus + Torkoal lead. AAAHH! That's not good! Holy cow, that is not good! All right, well, now I'm eighth. I'm going eighth. I think I forced them to give me something here. Yeah, yeah. This is better, because this way. Yeah, yeah. Okay. Torkoal comes in. They could because they could go after Regirock. Here is the thing. Okay. Here's Torkoal. Thhey could go for Moonblast into Rock. Oh, but they don't really want to Tera, do they? Yeah, I don't think they want to Tera. Okay, into Eleki. I made the wrong play and I die. And now- And I'm dead. And now I'm dead. Okay, Regirock, Rock Slide connects on both. Do I die to Moonblast?? Wait, do I die to Moonblast? If they Tera yes, otherwise no, right? I think that turn one went badly, this is my current position. Is the official position of Mr. Glick. If I'm them, I'm going Helping Hand + Moonblast, and just clearing my Rock here. Oh, so I'm surprised that I died to Moonblast there. Oh. It's guaranteed. Nevermind. Okay, they may intuit that I don't have Drago in the back, because I showed Gigas, but I also could. You're steel. We need them to go for Helping Hand plus... Okay, we're saving Torkoal. Yeah, because sun last game was pretty important for them. Here is probably Bolt, right? Yeah, here's Bolt. Okay, cool. Oh, they called it. Oh, wow. That's a brave move. Special attack drop doesn't really matter- okay. Now what? Now what do I do? Okay, I paralyzed the Flutter Mane, but I suspect that I'm about to be very much losing Pokémon. I did not get Light Screen up. I have Icy Wind available. I kind of like Icy Wind + Iron Defense. I wish I had Confuse Ray. Okay, they Moonblast again, they're still faster. Gigas survives, but is going to go down to another one- or to the Thunderbolt here, probably. I need the Icy Wind so that my Rock will outspeed their Bolt. That's not good, hello? I'm dead. I'm dead. Okay, so here they actually, I think, have a pretty safe way to win. They don't.- Yeah. Yeah. Like, basically here, their Flutter Mane
is still faster than my than my Regirock, even though I'm like max speed. So here I think in order to win what has to happen is I need to get a full para. I think I need some luck. Okay. Regigigas! You've gone down, but you've left us a parting gift of this paralysis on this Flutter Mane. They need to clear Regirock, and they need Flutter Mane to do it. Please. Here's the Tera. This is going to be Fairy Tera on the Bolt. Okay. My arch nemeses: Faereus Thereus.
(Latin for Tera Fairy) I think even if this turn goes well, I'm still Omega losing. Thunderclap. Okay, here. We need the para. We need the para. Why do I do it? Okay, I'm getting 4-0'd by Bolt and Flutter. I mean, listen, this is exactly what I was worried about, right? Like, like, it's very difficult for my team to break through this. And their lead is really- It gives them a lot of options in the first turn, no matter what I lead. Okay. There's the pair at one turn to late. It didn't matter, to be honestm because two Thunderclap is going to KO me. And then like, what's my Tera type of Water? Yeah, like, I just don't have the tools. Straight up. Straight up do not have the tools. I can't lead Rock + Steel because they'll just Moonblast + Heat Wave and I'll die. Rock is good, Steel is good, the others are all kind of questionable. If I can get through the Flutter Mane, I think Gigas becomes slightly stronger, because I can only paralyze stuff. So if the goal is to get rid of Flutter Mane, I should lead with Registeel. I have my Tera available, but I don't really want to use it on Registeel, right? Torkoal? Overheat or Heat Wave. Overheat. Good dodge Now what? Can't stack Registeel, Can't sack Regirock. Can't sack anybody. I don't like it, but I'll do what I can. This forces Torkoal off the field
at the cost of Terastallizing my Registeel, making it significantly weaker to Regieleki- or to Regi Bolt. Okay, let's see here. Overheat misses again, okay, didn't need to Tera. Good job Registeel, you're my goat. Body Press, good damage. Okay, and they're dead. This forces Torkoal off the field. It makes it so it can't attack for the turn. These are the early turns that I thought through. Now in comes Regi Bolt. How slow is Chi-Yu now? It's a it's paralyzed and it's at -1, so it should be around... If it's modest, it will be still faster. But not faster than my Raging Rock. It's good. It's still locked into Overheat. The second miss is actually bad there, I think. Okay. And here what I'm going to do is I'm going to get my Light Screen up and I'm going to try and win this game by switching in a lucky here and going for another Icy Wind to intentionally not take the KO on the Chi-Yu and to cover for switch in here. Presumably this is Thunderbolt into my Raging Steel. Well, this is this is the crucial turn, because they could also just KO Gigas here, which would be pretty bad for me, especially if I don't get the Icy Wind off; with Light Screen up, this game becomes a little bit more interesting, I think, because this Raging Bolt, remember, can't Protect itself. Here's Eleki. Thunderbolt. Okay, that's the right move. My Gigas should survive the turn. Okay. My God, is that a crate? Oh, Lord. Okay, I'm taking a lot of damage. I guess you got this. Great job, Regigigas, you are so goated. Now we just need you to, not KO Chi-Yu, which I'm actually not worried about in this case. Okay, I've taken a lot of damage. I've taken a ton of damage. However, I've got the Icy Wind off. Raging Bolt's at -1. I could lose both here. I don't really want to, but I could. Chi-Yu is -2. Okay, now I get Light Screen on. I don't think this is going to be enough,
but I mean, I have to go for it, right? They still have Tera available. I don't have Tera. Okay, they switched. Oh, I'm actually- I can't outspeed, so maybe this was a bad Rock Slide. An overambitious Rock Slide- just Fluttered presumably. Okay, I got Light Screen up. Here's the Light Screen. So I have eight turns of this, which is good. Here's the bad news. I should use Icy Wind again. Electroweb, always survive. Okay. Honestly, the little chip might be nice. No no no no no no no no. Oh, no. Like, I think- I think it's pretty- It's looking pretty bad, folks. But it's not over, and that's important to me. If I go down 4 to 2 they're just going to clear Regirock, right? I don't think I have a choice. Like I can't let the back Pokémon take damage. They are too important, unfortunately. Okay. Sorry, folks. Okay, Eleki, you did a good job, you set up Light Screen. Now let's see if we can bring it home. Yeah, I couldn't switch into this very easily,
because I've already Tera'd. Even with Light Screen up, I can't survive. Okay, let's see if the Proto ends this turn. Sun ends. Okay, cool. Like, I know I'm down 4 to 2, but I at least have the Light Screen up this game, so it is a little bit different than last. And Chi-Yu is nearly dead. So I have Explosion. That's one option available, but I don't think that I'm supposed to use it here. I think I need to Rock Slide my way through this. If I'm them, I might just go after the Regirock this turn and go for Moonblast + Thunderclap.
I think I need Flutter gone. They might Tera Fairy Fairy Flutter Mane to just try and clear my Regirock. I think I think I'm losing, but I did my best and that's what matters. I'm KOing Flutter this turn. They go into Chi-Yu? Torkoal, okay. I still the paralysis that I invested earlier as well. Moonblast! Light Screen is up. I live a Thunderclap. I don't know if I live Helping Hand Thunderclap, though. Big damage. Like, you see I'm close, right? But I don't think it's going to be enough. Sun-boosted, Helping Hand-boosted, yeah, Protosynthesis- I think they've got me here; I really tried, I really tried quite hard, but I don't think Regirock takes this. Yeah, yeah I don't think Regirock can take this Helping Hand boost. I have a Light Screen up, but Regirock does not- I have no bulk, right? So you would expect me to go down here. Okay. If I live this, it's possible, isn't that wild? Yeah. They played really well. Yeah. Tera Fairy Bolt, my arch nemesis. It's not likely, I'll tell you that much. Okay, maybe they went after Registeel. The problem is, since I can't Protect,
I can't even play the mindgame. Yeah.  Nice play. Yeah. I don't think the crit mattered, I'll be completely honest with you. Like, you see it was close, right? Like, I have Tera Water Regirock- or Registeel, like I got I making good calls, but I'm a little bit short on the damage department, so I think that's going to be all she wrote. I think really what they did especially well was they recognized that  part of the reason why I was even able to win game one
was because I got rid of Torkoal. Like, if they allowed me to take Torkoal and when I could, like once I started the sun, it was
a lot easier to handle the Raging Bolt- without, well, without sun or Helping Hand. I certainly would have lived that Thunderclap, but yeah, with access to both- Registeel's so good. Yeah, Heavy Slam is not winning me this one, unfortunately. Yeah, with access to both, I just.- I can't stop the damage output from Bolt,
which is how I was able to win game one, right? Like, I was able to cut its damage output significantly enough that I was able to stall it out. But yeah, here with the sun and with Tera Fairy and the Assault Vest, I just didn't have the tools to get through. And honestly, like, I don't even feel that bad, because let's say I knew that this was my opponent, right? And I had as much time as I wanted to prepare, I actually don't- It's really difficult for me to imagine a world where I'm able to beat this even with like full teambuilding at my disposal. Like I would have needed to do something really weird with Regice, probably- Tera Fire Regice maybe would have like- certainly would have been better here, but only because- even still, I don't know if I would have ever beaten the like, Assault Vest. I needed to use like Sheer Cold Regice or something, probably and just get lucky. But anyway, good game to my opponent. They played really well. Good luck in the rest of the tournament and honestly, I'm proud of myself for getting a game win. I think that was a really... I think this- this matchup showed, I think, a weakness when you use like solely Regis. So I'm certainly not to upset about it. But yeah, GGs to my opponent, I hope you all enjoyed watching this. It was fun to use all the Regis together. There were like, a lot of memorable moments for me. Yeah, that's going to be it. Thank you for watching. If you enjoyed this video, make sure you watch the most recent one. Where I entered a tournament with only Bug types. I will tell you that this tournament for all the or this challenge, I should say, for all of the weaknesses of the Regis, it was still easier to do this than than when I had access to every Bug type. So thanks for watching and I'll see you all soon. Bye bye.",ok
