video_id,transcript,status
SKpHsXjvBqw,"Hey, hey, welcome to Quiz Genius. Please subscribe to my channel. Click like this video. Sonic the Hedgehog 3 characters and their favorite movies. Shadow, The Dark Knight, Sonic, [music] The Fast and the Furious, Knuckles, The Flash, Tails, Bumblebee, [music] Eggman, Dr. Strange, Metal Sonic, Transformers, Gerald Robotnik, Patch Adams, Amy Rose, Turning Red, Super Sonic, Meet the Robinsons, Super Shadow, Wonder Woman. Who is stronger? Sonic [music] like this video. Shadow subscribe to my channel. Who is faster? Sonic. Like this video. Shadow. Subscribe to my channel. Sonic the Hedgehog 3 characters and their favorite drinks. Shadow. Monster Energy, Sonic, Prime, [music] Knuckles, CocaCola, Tails, Crush, Pineapple, Eggman, Seven Up, Tropical, [music] Metal, Sonic, Zevia, Gerald Robotnik, Dr. Pepper, Amy Rose, Starbucks, Pink Drink, Super Sonic, Sun-Kissed, Super Shadow, Mellow Yellow. Who is your favorite Shadow? Like this video. [music] Sonic, subscribe to my channel. Who is faster? Tails. Like this video. Shadow. Subscribe to [music] my channel. Sonic the Hedgehog 3 characters and their biggest fears. Shadow losing control. Sonic being too slow. Knuckles betrayal. Tails failure. Eggman. Sonic winning. Metal Sonic malfunctioning. Gerald Robotnik. His experiments failing. Amy Rose. Sonic rejecting her. Super Sonic, Super Shadow. Spot three differences. [music] It's here. Find the odd one out. It's here. Sonic the Hedgehog 3 characters [music] and their favorite candies. Shadow, Snickers, Sonic, I'm Joy, Knuckles, KitKat, Tails, Milk Duds, Eggman, M and M's, Metal Sonic, Jolly Rancher, >> [music] >> Gerald Robotnik, Three Musketeers, Amy Rose, Nerds, Super Sonic, Reese's Pieces, Super Shadow, Skittles. Spot three differences. [music] >> [music] >> It's here. Find the odd one out. It's here. Sonic the Hedgehog 3 characters and their favorite snacks. Shadow, Doritos, Sonic, Chips, Aoy, Knuckles, Ritz, Tails, Funions, Eggman, Cheeit, Metal, Sonic, Pop-Tarts, Gerald Robotnik combos Amy Rose Pocky Super Sonic Pringles Super Shadow Cheetos. Spot three differences. It's here. Find the odd one out. [music] It's here. Sonic the Hedgehog 3 characters and their favorite [music] breakfast foods. Shadow pizza. Sonic. Shrimp. Pasta. Knuckles. Boiled eggs. Tails. Cereals. Eggman. Pancakes. Metal Sonic. Sushi, Gerald Robotnik, Lasagna, Amy Rose, Donuts, Super Sonic, Taco Bell, Super Shadow, Avocado Toast. Spot three differences. It's here. Spot three differences. [music] It's here. Sonic the Hedgehog 3 characters and their favorite apps. Shadow, Tik Tok, Sonic, Messenger, Knuckles, Reddit, Tails, [music] Snapchat, Eggman, Pinterest, Metal Sonic, Twitter, >> [music] >> Gerald Robotnik, Uber, Amy Rose, Lyft, Super Sonic, Chat GPT, Super Shadow, Chrome, Sonic the Hedgehog 3 characters, and [music] their favorite TV shows. Shadow, The Legend of Kora, Sonic, Pinky and the Brain, Knuckles, [music] Carmen San Diego, Tails, Octonauts, Eggman, Spider-Man, Metal Sonic, Zigg and Sharko, Gerald Robotnik, Sanjay and Craig, Amy Rose, Peppa Pig, Super Sonic, Spongebob Squarepants, Super Shadow, Teen Titans Go, Sonic the Hedgehog 3 characters, and their favorite mobile games. Shadow, Geometry Dash, Sonic, Hungry Shark, Knuckles, Toon Blast, Tails, Angry Birds, Eggman, [music] Among Us, Metal Sonic, Sonic Dash, Gerald Robotnik, Plants Versus Zombies, [music] Amy Rose, Dress Up, [music] Super Sonic, Subway Surfers, Super Shadow, Minecraft, Sonic the Hedgehog 3 characters, and their favorite fast [music] food restaurants, Shadow, Steak, and Shake. Sonic, Long John Silvers, Knuckles, KFAC, Tails, In and Out Burger, Eggman, Panda Express, Metal Sonic, Taco Bell, Gerald Robotnik, Sonic Amy Rose, Dunkin Donuts, Super Sonic, Subway, Super Shadow, Chick A.",ok
1mTZjWePlxI,this morning 21 year old Otto warmbier is behind bars in North Korea sentenced to 15 years in a North Korean prison with hard labor a visibly shaken warm beer paraded before cameras speaking at his trial Wednesdays which only lasted one hour I was huge and manipulated please save my life warm beer was found guilty of what the government calls subversion part of the U.S hostile policy towards North Korea in court they showed this video accusing warm beer of trying to steal a political Banner from an area off limits to foreigners at the hotel where he was staying with the tour group two weeks ago warm beer tearfully spoke at a government arranged press conference I have made the worst mistake of my life his family enlisting the help of former Governor Bill Richardson the veteran Diplomat meeting face to face with North Korean diplomats Tuesday he did a college prank a mistake but 15 years to be sentenced that's crazy hopefully now after the sentencing it'll mean negotiations can start on his release on humanitarian grounds now those kinds of negotiations have worked in the past about a dozen American tourists have been arrested there since 2009 all of them eventually released hopefully that will happen again soon,ok
ZSLxLWILT_o,"Dubai, a city built on dreams and defying gravity. Behind me is the Burge Khalifa, the tallest structure ever built by human hands. 82028 m. That's where I'm going. But to reach the very top, you don't take the tourist elevator. Up there, safety isn't just a rule. It's the only thing keeping you alive. The mission, replace the aircraft warning light at the pinnacle. This bulb guides planes away from the tower. If it goes out, the skyline goes dark. The ascent begins in the central core. Speeds reaching 10 m/s. You have to control your heart rate before you even step outside. side side. >> Level 160. the end of the line for the elevators. Beyond this point, it's all human power. This is where the real climb starts. The spire tier one, the internal spire structure. 200 m of vertical climbing inside a steel tube. It's hot in here and you can hear the wind howling outside. The temperature inside the spire can rise significantly above the outside air. Don't look down. Just keep moving. Altitude 700 m. Still inside. That hatch is the gateway. Once I open that, I'm in the sky. Beyond this hatch, the luxury of Dubai ends. Welcome to the machine. We are now inside the spire's skeleton. Altitude 750 m. You can feel the building breathing. It's vibrating with the wind. >> Every step higher requires navigating a maze of structural steel. >> It's tight. If you're claustrophobic, you turn back here. Equipment check number three. There is no room for error. Power is live. We have to cut it before we reach the top. The pressure and sway increase with every meter climb. People think the height is the scary part. No, it's the isolation. The path narrows. The cage begins. Rhythm is everything. Hand foot. >> A rare glimpse of the world they left behind. Condensation makes the steel slick. Always two points of contact. Always. >> Outside, the sun is blazing. Inside, it's a twilight zone. Hydrate. The dry air up here sucks the moisture right out of you. The chimney. 50 m of straight vertical ascent. Just keep moving. Don't think about the drop. The thermal expansion of the steel creates eerie groans. We're entering the final tier. The Spire's heart. Welcome to the Spire. A steel pipe reaching for the stars. >> It's like being inside a cannon barrel pointing straight up. The sun beats on the black steel outside, turning the inside into an oven. Hear that? That's the wind screaming at 800 m. There is barely enough room for a man and his gear. Grip strength is everything. Don't let go. The cargo is fragile. One slip and the mission fails. Isolation increases with every rung. The air currents in here are weird. It's the chimney effect. Rest stops are non-existent. You take what you can get. Click clack. That's the sound of safety. A reminder of the blinding world waiting outside. It's a mental game now. Your legs burn. Your arms shake. >> Step, pull. Step, pull. Repeat for two hours. Watch the snags. Everything wants to catch you. 780 m above sea level. The geometry changes near the top. You have to adapt. The end of the internal spire is approaching. Okay. Stage two complete. Now comes the hard part. Above this hatch lies the dead zone and the open sky. It's not just a climb anymore. It's a a squeeze. Air is thin. Heat is rising. Everyone is screaming. One wrong move and you're stuck. Panic is your enemy. Control the panic. Dehydration sets in fast in this vertical oven. Muscle fatigue. The silent killer. 800 m up, buried in steel. Radio signal is weak inside the core. You're on your own. Sensors everywhere, monitoring the building's pulse. Drive with the legs. Save your arms. A momentary reprieve before the final push. There it is. The lid of the world. Procedure is key. Secure yourself before you open it. Sealed tight to withstand sandstorms and hurricanes. Pressure equalized. Here we go. From the belly of the beast into the light. Listen to that wind. Level 160 plus. The pinnacle light. Too much light. Your eyes need a second to adjust. From darkness to blinding altitude in one second. Look at that. Look at that. We are above the world. The wind speed here is double what it is on the ground. A lone human speck against the infinite sky. First rule, clip in before you even stand up. Footing is precarious. The platform is merely a grid of steel. Do not fixate on the ground. It pulls you down. >> It's freezing. The temperature dropped 15¬į instantly. >> Exposure. There is no shelter here. The cargo is safe. Now, let's get to the beacon. >> The final ascent. The most exposed climb on Earth. Trust the gear. Trust your grip. At this altitude, the sky turns a darker shade of blue. Slipper breeze. Morning dew freezes up here. >> You feel like you're floating. It's surreal. Focus one rung at a time. Target in sight. 10 m to go. Arrival 828 m. Mission phase one complete. Affirmative. Here at the edge of space, the air is thin and the margin for error is zero. Lean back. Let the harness take your weight. Your hands need to be free. A drop from here simply doesn't end. Slow is smooth. Smooth is fast. Don't rush. Every tool is tethered. A dropped wrench from this height would be a lethal projectile. Corrosion from salt air and high humidity makes the job harder. Got the cover. Don't let the wind catch it like a sail. >> The heart of the signal burnt out after thousands of hours. Sweat in the eyes. Stay focused. Extraction complete. Now for the swap. One down. Now let's get the new star in there. Secure the debris. Leave nothing behind. Here's the replacement. Highintensity aviation LED. Pristine technology meets raw nature. >> Whoa. Gus, hold on. Okay. Just got to get this up there. The weather at 800 m is unpredictable. Thread it gently. Don't cross thread it. Test successful. The beacon is alive. Light is green. Housing goes back on. We're halfway home. Locked down. That light isn't going anywhere for another 5 years. Pride in the work. Even at 828 meters. Job done. Now take a look at this view. To the west, the ocean. To the east, the endless desert. King of the world. For a few minutes at least. The shadow of the tower acts as a sund dial for the city. The UV radiation up here is intense. Don't stare too long. >> Base, this is deep. >> Elbow. >> Replacement complete. >> System checked. Copy. Copy deep. Signal is green. Good work. A place where rain falls beneath your feet. We can't stay. The wind picks up in the afternoon. The descent is often more dangerous than the climb. Gravity is waiting for you to make a mistake. Harness check. Circulation check. Water is low. Time to go home. One man against the sky. Okay. Okay. Focus. Fuss. Complacent. His breathing becomes audible, deliberate, and the long journey back to Earth begins. Step one, 2,000 to go. The adrenaline is fading now. The fatigue sets in. Wind is picking up. It's swirling around the spire. Metal expands in the heat. Sometimes the gear fights back. It's jammed. The gate won't open. A jammed clip at 800 m is a life-threatening problem. Don't panic. Panic kills you. Assess. Solve. Fine. Motor skills deteriorate with exhaustion. Just a little more. Got it. Mechanism was clogged with dust. Okay, let's get off this stick. Now the weather window is closing. >> No sightseeing. Just get inside. The pressure difference makes the hatch fight him. Goodbye, Skye. Hello, darkness. Heavy metal slam and locking sound. safe. But the descent is far from over. The silence in here is heavy after that wind. My knees are going to hate me. 160 floors to go. The adrenaline crash makes the body feel heavy as lead. Just gravity doing the work now. Controlled falling. Going up is a battle against gravity. Going down is a battle against your own knees. My grip is gone. Fingers are cramping. Leaving the sky behind. Returning to the earth. Focus. Most accidents happen on the way down. Outside, the sun begins to set over the Arabian Gulf. Golden hour. The best time to be alive. The architecture turns into a cathedral of shadows. Try. Just want to get down now. Controlled descent. Using friction to save energy. space. Finally, room to move. Dubai transforms from a concrete jungle to a city of light. The return journey through the belly of the beast. Civilization. The magic button. 6 hours in the vertical world. Elevator chime. Uh, I probably smell like grease and fear. Descent velocity 10 m/s. >> Whoosh of descending elevator. >> Ears popping. We are dropping fast. Back to Earth. The air is thick and humid. It feels strange to walk on flat ground again. My legs are still compensating. From absolute silence to the roar of the metropolis. Oxygen. Thick, heavy oxygen. It tastes good. He just came from the top of that needle. It looks even higher from down here. There it is. The heartbeat of the tower. That's my light. I put that there. The city celebrates unaware of the work that keeps it shining. People ask why ask why I do this. Why take the risk? >> Is it for the adrenaline? the money, the view. It's about maintaining the impossible. Someone has to do it. The tallest structure in history doesn't stand by magic. It stands by maintenance. >> Job done. The skyline is safe for another night. Captain Deep signing off from 828 m. See you in 5 years, old friend. Mission status complete. Burge Khalifa bulb replacement complete. >> The time is now. Prepare for ignition. The show begin. >> Produced by AI documentary director. >> Don't look down.",ok
yYxgQf4fIbY,,failed
YPHPcDv409c,when I went to and he was crying because [Music] [Music] [Music] [Applause],ok
8r4t14J6Zhc,"Today, me and Tails are exploring the abandoned Sonic amusement park. >> Wait a second. Someone made amusement park about us. >> Oh, yeah. And apparently, it's been abandoned for years. So, we're going to explore it and find all the super crazy secrets. And don't forget to subscribe and like the video if you think Sonic is super awesome. Okay, we're exploring the abandoned facility. And yo, look, it's me, Tails. >> Wait, why are you abandoned? Look at your fur. It's got cobwebs in it. >> Yeah, it's so weird. It looks like I was been there for years. And oh, look at Shadow. What is he doing here? I wonder who abandoned him. >> Oh, bro. This is terrible. >> Yeah, whoever made this factory has to be super evil because this place is so creepy. And what? Hey, is that Silver? >> What's he doing on his own? I saw these little robot bits. We gave him an energy bar. Yeah, this is so weird. But hopefully that energy bar will help him. And hey, look, that's a bunch of parts from Mr. Eggman's robots. >> Yeah, speaking of which, if we're all abandoned, do you think Ramonic's dead? Wait, he's right there. >> Oh, yeah, he is. And wait, no. I think that that's Dr. Eggman's father. He looks way too old to be Dr. Eggman. Hey, look, they even got Big the cat. And we gave him a little band-aid so he can feel all better. >> Yeah, that's good. Okay. And wait, we're going deeper in the jungle. This place looks like Green Hill but super abandoned. Whoever made this amusement park was being really mean. And hey, look, it's the Werehog. >> A, who would leave him around? He's like a fun fairy companion. >> Yeah, he's super nice. And I wonder where he went. [clears throat] And hey, it's literally Robo Sonic. It's Metal Sonic. We should not go near him. >> Yeah, I honestly would rather keep him hanging from the trees. He's not a foe to be messed with. >> Yeah, he might try to attack us and that could be really bad. But hey, what is that thing? >> Yeah, it's like a lizard, Sonic. >> Yeah, this amusement park is really weird and strange. I'm not going to lie, it's got a lot of weird attractions. Okay, let's keep going and see how much scarier this gets cuz this place is already giving me the creeps. AND WHOA, >> IT'S OMEGA. >> WAIT, WHAT IS OMEGA doing here? And oh my gosh, I was scared for a second, but it looks like he's being powered down. He's so abandoned. >> I mean, he probably doesn't have enough oil to keep all those parts in check. >> Yeah, guys, like the video and subscribe in order to help Omega. And hey, look, it's Charmmy. Aw, look at him. Why isn't he with like Vector and Aspiel? He's just on his own. >> Yeah. Wait, I wonder if the rest of the gang is here. Hey, look. It's Cream. >> Oh, and thankfully she's next to Cheese. At least they can sit together. >> Yeah. And we'll leave her a ring so she can go back home. This place is so scary. And Whoa, it's Vector. Oh man, all of his outfit is just completely torn up. >> Yeah, this is so creepy and scary. But I think it's going to get even worse cuz we're going deeper in the amusement park. And hey, look, it's Amy. >> Oh, [screaming] hey Amy. What are you doing? Where's your pico bele hammer? >> Yeah, what is she doing here? She looks so abandoned. Whoever did this is really mean. And wait, look, it's you, Tails. Oh, there I am. I do not look in good shape. >> Yeah, you look super abandoned. Dude, this is way too scary. I'm not going to lie. But wow, is that Blaze? >> It sure is. Dude, we got to collect all of these abandoned versions of oursel and save them. >> Yeah, we need to be able to take these back home to clean them up and make a cool amusement park out of them. And hey, what is Knuckles doing here, too? Oh wow. So much for 100% muscle. >> Yeah, but I'm not going to lie, he still kind of looks tough. Just a little dusty. >> Well, now we're in a really cool cave. Look at all these gems. >> Oh, yeah. And look, we found a wooden ladder. Okay, we just got to keep going up. And hey, it's Espio. >> A How's it going, buddy? You are definitely all messed up. Yeah, but he looks super realistic. Okay, I'm not going to lie. This is pretty cool because everyone looks super realistic here and not creepy at all. And >> exactly, but look, it's Eggman. >> Yeah, what is he doing here? They even abandon him and his glasses are broken. But I'm not going to lie, he just looks like normal old. >> I'm surprised he's still alive. He's probably been sitting there for ages. >> Yeah. And hey, look. It's another one of our friends. We need to help her. What is she doing here? >> Marine, you got to wake up. Come on. >> Okay, I guess we're just going to keep GOING THEN. AND OH, IT'S MIGHTY. >> OH, he's hanging around. Looks like he's still lively as ever. >> Yeah, I wonder what he's doing here. Just chilling. But he is super. Dusty has a bunch of cobwebs on him. THAT IS SO CRAZY. WHOA. IS THAT ME BUT IN MY super form? I didn't know there were so many versions of you just hanging around here. Maybe we could actually use them to help us out. >> Yeah, that's a little creepy. WHOA, LOOK. It's the water monster. Isn't he supposed to be guarding the Chaos Emeralds? >> Yeah, come on, Chaos. You got to move around. It doesn't really look like you. >> Yeah, he's all like dusty and stuff. And hey, look, it's an Aketna. Aw, Tico, I didn't think you'd still be around here, man. You got to go back to hiding. >> Yeah, dude. They literally invited everyone to this amusement park. AND OH, THEY EVEN got Jet. >> A He thinks he's just as cool as ever. I'M SURPRISED HE'S not protecting his uh little board he has. >> Yeah, I mean, to be fair, he does kind of have a little bit of a He is a little dusty, though. And wait, is that wave? Well, luckily she has her board. Of course, she's besided. >> Yeah, which is kind of crazy. But whoa, did you see how dusty they were? Someone really needs to clean these up. And wa, who is this? Why is there a green duck here? >> That's Bean. Oh, Bean. I didn't think you'd be around here. You're just a kid. >> What is going on? Who could have like abandoned all of the Sonic Pals at this amusement park? Even storms here. This is seriously messed up, dude. >> Yeah, this cannot be good. This place is way too corrupted. And hey, what is Fang doing here? >> He's all scuffed up. I mean, it's >> Yeah, dirty and everything. It's like all of us got pushed into the mud. >> Yeah, this place is a super creepy. Well, if you guys enjoyed today's video, don't forget to subscribe and comment down below what you thought would happen because this place is kind of like super abandoned and a little scary. And don't forget to leave a like and we'll see you all in the next video. Bye-bye. >> Bye-bye.",ok
nbhAmIKrY6U,,failed
g6pPQZCss14,"The steel piles were driven deep into the ground, each reaching over 160 ft. On top of them, 12 million gallons of concrete was poured, creating a 12 ft thick base. And this connects the tower's main support columns. From there, the Burj Khalifa is built floor by floor, stretching nearly 3,000 ft into the sky. The steel piles keep it locked into the ground, while the concrete base spreads the building's weight. And this keeps the soft desert sand from collapsing underneath it.",ok
NHm9AFIxtQQ,"Every towering structure begins with the simplest elements. Strength is forged where raw earth meets engineered force. The foundation of height is carved from the ground itself. Steel begins its journey long before beams rise above. Precision here dictates the strength of every floor above. Even water must be engineered for structures of this scale. Only approved Nvicard's approved materials earn the right to move forward. >> Now the journey toward the skyline begins. Moving millions of tons demands perfect coordination. Distance is conquered before height can be challenged. Every beam carries the promise of elevation. >> Concrete never sleeps when time is critical. The city prepares to receive its future icon. [music] Nothing enters without precision and control. Here raw materials meet human ambition. Everything now moves toward the heart of the tower. This is where vision meets reality. Every step inside is measured and protected. The depth below determines the height above. Steel bones are assembled before concrete breathes life. Millimeters here decide meters in the sky. Power is prepared to flow underground. The tower's future is poured one layer at a time. Patience at the base ensures permanence above. The core is the spine that will carry the sky. This concrete is engineered to withstand impossible pressure. Gravity is challenged one pump stroke at a time. The building grows continuously, day and night. Steel reaches higher before concrete follows. >> Every future system is planned at this moment. Accuracy here protects everything above. With each climb, the tower claims more sky. From the core, the tower begins to spread its wings. Each wing is measured for balance and strength. Steel weaves a platform for [music] life above. Every opening is planned long before it's needed. >> Is poured with the same discipline. Precision reveals itself as the forms fall away. Every floor prepares the way for the next. The climb continues level by level. The tower's skin arrives in precisionbuilt pieces. Every lift must be flawless at this height. >> Millimeter accuracy defines the exterior. The skin must resist heat, wind, and time. Once secure, the structure stands on its own. The city begins to see itself in [music] the tower. The exterior ascends in perfect rhythm. Now the inside must match the promise outside. This is the tower's hidden circulatory system. Water must travel higher than ever before. Power is routed with zero margin for error. Airflow is engineered for vertical living. Tire floors exist just to keep the tower alive. Safety is built into every ceiling. Thousands of systems must act as one. Now function gives way to form. Now function gives way to form. Spaces take shape long before they are seen. Silence and structure are engineered together. Light is planned before it ever shines. Luxury rests on absolute precision. Openness [music] is built with strength. Movement inside the tower is an engineering feat. Details define [music] the experience of height. >> Now everything must be proven. Every floor must prove it can bear the future. Aerodynamics dictate stability at unimaginable heights. >> Look at the displacement curve here. >> Only certified materials rise to the challenge. Life support systems are activated and verified. The exterior must resist desert storms and ocean winds. Preparedness ensures safety at every level. Every system cleared, every standard met. Every detail now reflects the vision of perfection. From ground to sky, perspective is breathtaking. >> Even the lobby celebrates the tower's ambition. Every vertical path is now fully operational. Behind the scenes, order and precision persist. And this is how modern factories produce the Burj Khalifa from start to finish. >> A vision realized in steel, glass, and human determination. >> Join us to explore the world's engineering marvels.",ok
wk3FzntVAgU,[groaning] [music] >> I will be born. I will be born.,ok
gVkc7RKL2JY,,failed
QN7BFBqZ6qo,,failed
