video_id,transcript,status
Let's see what he's doing. Excuse me. Can I ask what you're doing? I'm working on some admin tasks. Oh, how long have you been working here? It's been 6 years since I became the director here. What did you do before this? I worked at City Hall in a different department. I see. How long is that in total? Total 30 years for me. That's a minute. So what's
the best part of this job? It's truly a rewarding job, where we all come together
with one shared goal: to serve the community. I can see that. And what's
been the most challenging part? When planning, we always need to consider
what the residents want. He says that their plans don't always
match the needs of the residents, so they keep improving it based
on the feedback that they receive. It's challenging, yet also
rewarding when they get it right. Thank you. There's a guy that just pulled up right there. His truck looks a little bit different. Let's see what he's doing. Oh, hey, it's you again. What you doing? I'm inspecting trash that was illegally thrown out. Oh, where were they thrown out? We found these in the mountains. Crazy. So what do you do when you find it? We first put a warning on it, and if the person doesn't
claim it, we take care of it. They patrol areas with a known history
of illegal dumping as well as forest zones and respond to reports made by residents. While incidents are rare, even a small piece of trash
can create a sense of unease among the community. So they work hard to keep their city clean
and to prevent suspicious garbage from lingering. Wow, look, there's a fire truck over there. I guess they're filling the tank too. At 5:00 PM, he's finally off the clock. One of the advantages of working
for the city as a garbageman is that they typically have less overtime
compared to if they worked in the private sector. They're able to enjoy a fair amount of personal
and family time after they've completed their shift. Ah, the girls seem to have already taken their bath. Typical for Japanese to have it in the evening. Hi. So did you hang out with the kids all day? That's right. We played at the park from the morning,
and then I just put the kids in the bath. Nice. By the way, what do you do for work? I'm a nursery teacher. Oh, wow. How old are the kids? I teach a 1-year old class. Cool. And your kids go to your nursery? They go to a different nursery. Ah, I see. Today his wife is off, so she took care
of the kids, but when she has a late work shift, he's responsible for picking them up from nursery. Interestingly, in Japan, about 72%
of couple households are dual income. Nice. She's eating 'onigiri'. Okay, so it looks like Ginjiro will be having
dinner with the family for here just a little bit longer and then hang out here in the living
room until 9 o'clock when they go to sleep. But that's pretty much 
a day in the life of a Japanese garbageman. If you guys liked this video, like always,
help me out and hit that like button. If you guys want to help support the channel,
then definitely check out my hot sauce. And if you guys want to see more
videos like this or anything related to Japan, hit that subscribe button and the bell button. I'll catch you guys in the next one.",ok
dbAAd7Ks9yQ,,failed
MtgyCorvy_s,,failed
QN7BFBqZ6qo,,failed
7neuKCCHlyU,,failed
TfvhzthE9vU,,failed
fze5s1SlqB8,"I'm the principal of Umejima Elementary School
in Adachi-ku, Tokyo. My name is Atsushi Ebara. Not at all. Students from grade 1 to 6 have the exact same duties. They all dish out food, but with grade 1 and 2's the teachers sometimes support and assist. But by the time they're in grade six, they are able to do everything. - Put your hands together.
- Okay. Itadakimasu (I humbly receive). The purpose and the role of kyushoku (school lunch program) are for the students to learn that to have a healthy body, eating is very important. Secondly, to experience our own food culture through kyushoku. Lastly to appreciate the hard work of many people
who are involved in making kyushoku from farmers, to kitchen staff, to anyone who helps. All the homeroom teachers eat with their students in the classroom. Teacher, what do we have next period? Teacher, teacher! A test. Teacher, the camera is facing towards you, so do like this. I wouldn't do such a bad manered thing. As a principal, I have to eat and check the food
before it's served to the children. So I barely have the chance to eat with children. I'm Rie Kuwabara, the school nutritionist. In our school, we have a staff of 12. But with me, there are 13 people working on the school's lunch. There are 634 children in the school, but we have lots of staff, so we make 690 meals in total. We have food from all over, but basically the vegetables are domestic and come from the Kanto and even Shikoku areas. Today I'm introducing food from Kochi prefecture. Ginger chicken. In Kochi they grow ginger. Ginger's essence prevents us from being sick. Guruni (stew). In Tosa dialect, guru means friends getting together. This stew is called guruni because various vegetables are gathered and cooked together. Basically, ingredients are domestic, but on some occasions, some ingredients are processed in foreign countries. But basically, fish, meat, vegetables —
fresh ingredients — are domestic. We buy local ingredients, it's delivered, and we cook it. They pick it like this, all four of them. How is it? Hard? Difficult? Difficult. Yeah, difficult. I teach kids that by eating, we take life from vegetables so that
we can live (and we must appreciate this). Students don't help cook the food, but the 1st and 2nd graders help peel vegetables like broad beans, corn, and green peas. Today, 8th graders came to my farm to do their work experience. Tomorrow for their kyshoku's edamame rice dish, the edamame they're working on will be used. Ah, thank you! It will be used in the school lunch's salad. Ah. Is it okay if I eat it? Yes, go ahead. Yes, very sweet. These are called fruit tomatoes. Every month I plan the menu one month in advance. First of all, I write down what vegetables are in season so that I can cook food that's in season. Secondly, there is event food every month. For example, next month is Tanabata (seasonal festival). So I'm planning food for the event. Lastly, we don't want to use meat many days in a row. For example, I don't want to offer chicken today,
and then pork the next day, so I try to put on the menu fish,
then meat, then egg, then tofu. I try to take turns using those ingredients. And the basic thing is that I have to
offer a certain amount of nutrition. This is regulated by the city. So I try to hit 100% of the required nutritional targets. Are there any ingredients or menus that the kids don't like? And do you repeat those items
or do you try to change them? Because they're young chidren,
there are things they don't like, and there are so many things they've never
eaten before, so they don't want to touch it. So on the day they see ingredients for the first time, they can be very honest and there's a lot left behind. Then that day I get so down, but when they get used to the food,
they'll eat it, and I want them to expand their expsoure to different types of food. However I try not to be down, and I'll
once again offer the food they don't like, trying to change the flavour a little bit, change how it's cooked, trying different approaches. Do you offer dessert? Dessert, yes I offer it, but it's not everyday. It's on special occasions. And so, one thing we do is use fruits
to mark the change in seasons. For example, this month it's
watermelons and cantaloupes. And at our school we have birthday lunches. So each month the birthday kids
get jelly for their special dessert. So I think dessert can be something
they look forward to. At Umejima Elementary School,
what's your favourite school lunch menu? What would you say? Today's hard worker, Kasuya-san. Fried rice with sweet sauce. Really? And so.... Ou-san. It's curry. Ah, me too! Ahhh, curry! We don't cook the same menu item more than once a month. For example, curry and rice is very popular, but I can't make it every week. I can offer it once a month, or once every two months, but I wouldn't offer it twice in the same month. But compared to other menu items,
I schedule it more often. I can totally understand how people would think that. In reality, it's nothing like that, it's like any other public school in Japan. It's not like there are a lot of wealthy people living here. When the school was rebuilt, Adachi city and the local people wished for a nice school (for the children). The rebuild happened during the bubble,
so they had a good budget, but it's nothing special,
it's a regular public school. But isn't this school's lunch special? Is this school's lunch special?
No it's not special. As for the families that can't afford
the school lunch fee, basically for low-income households, in Japan we have a social welfare system that will provide the fees. Adachi city has an Oishi Kyushoku
(tasty school lunch program) because the percentage of adults living in
Adachi with obesity and diaebetes is high. So with kyushoku we want to educate kids that to have a healthy body,
eating healthy is important. So Adachi city started the program so kids could
learn the importance of healthy habits by eating and enjoying tasty food. In Adachi, once a month there's
an Oishi Kyushoku meeting that nutritionists from the
104 schools in my city attend. We gather altogether in one place to
exchange ideas and menu plans. As part of their summer homework parents and
children design their own bentos at home. We pick out the best ones and include them
in the kyushoku menu. We then invite the community to come and
eat the chosen menus together. Thanks for the food. Look left! Even if I have to work harder, struggling to come up with good menus, when the kids react well and say tasty, when they say they're able to eat
food they previously didn't like, that makes me feel like it was worth the effort.",ok
LuZV9kkzscg,"hi so tell me about yourself sir I am sitting in front of yourself uh myself Rakesh mahanti and um I am uh technology M but if you will ask me what is my passion I will say Hardware but this is for the first time I am doing on spiky Skype you mean pardon sir okay um go on sir I am from Jura uh I study 10th sarasti sisu vya Mand graduate Cambridge Institute RI not from England not it and I am putting my screwdriver everywhere and seeing what is happening I am a hidden scientist okay so what experience do you have sir I am working with BSNL telephone company whenever the line goes up I write the telephone Comba and make the line good and during my spare time I chat on girls on Facebook and also I collect pan Masala rappers I have a huge collection almost 2,000 and how do you see yourself progress in this career sir I will have a fruy career in your steamy company and I will perform and reach the clim exposition okay and uh can you shift to Oman will you have any problems shifting to Oman sir I do not have any problem to shifting uh abroad country but uh I will not change my religion otherwise I am very open-minded and I am always happy even when I am sad and I am morally very good morally very high and I have also my resignation letter ready from BSN okay so then we'll get back to you sir I am getting the job now we'll get back to you thank you thank you very much",ok
