video_id,transcript,status
whoa, okay, okay, Junior, I feel like that's enough. - [Junior] (laughing) Are you sure? I could keep shooting holes for days. - [Luigi] Yeah, yeah, we're
pretty sure that's it. We think the hole is
definitely big enough now. - [Junior] (pants) All
right, if you say so. That was so much fun though. - [Mario] I'm sure it was, and we ended up making a
really big mess in the process. But, hey, at least it looks like there's something back there, so all we have to do is just pull out all that extra wall and see what's there. - [Luigi] Yeah, there's like a whole nother world back
there, I wonder what's in it? - [Junior] Well, I guess there's
only one way to find out. (dramatic music) - [Mario] Okay, guys,
moment of truth, three. - [Luigi] Two. - [Junior] One. - [Mario] Go! (wall ripping) (pants) Okay. Whoa, wait a minute, guys,
someone get a flashlight. - [Junior] Already got it, here you go. - [Mario] Thanks, Junior,
whoa, this thing is huge. Does it even work? (screams) Oh my God,
this thing is so bright, but that's definitely what
we need, thanks, Junior. All right, let's go into this room. (dramatic music continues) Whoa, this was not what I was expecting. - [Luigi] What do you mean, Mario? What do you see in there? - [Junior] Yeah, does it look cool? - [Mario] No, no, no,
guys, you don't understand, what I see in here is a lot of room. How is there so much
space under our staircase? - [Luigi] Whoa, hey, you're right, there's so much room in here. Imagine how much we can build in here. - [Junior] So is the plan still underway? Are we gonna build a secret
gaming room per chance? - [Mario] It definitely seems way, Junior, we're gonna build the
best gaming room ever under our staircase. Oh my God, this is awesome. But I think the first thing we have to do is clean up all this mess on the floor. There's a lot of stuff, especially from us breaking into the wall. - [Luigi] Yeah, we should definitely take care of our mess first, but after that, we're gonna assemble the awesome gaming room
we've been thinking of. - [Junior] Heck yeah, that'll be awesome. Dad will never find us. - [Mario] Okay, guys,
let's go somewhere else and let's devise a plan. (timer beeping) Okay, guys, so obviously, the process of building
the secret gaming room is gonna take a lot of time and effort, so we're gonna need to split up our jobs. Luigi, you're gonna be going to the store and picking up some supplies for us, like food and games for our gaming room. Don't get anything that we already have. - [Luigi] Okay, that sounds good. - [Mario] Junior, you're gonna be the one to look around the house and
find stuff we already have so that we can put them
in our gaming room, but don't get anything too big
or too complicated to set up. - [Junior] All right, got it. - [Mario] And I'll be the one cleaning up and vacuuming the floor, along with setting up the interior so that we're not just sitting
on a bunch of wood and dust. And remember, guys, we're on limited time, so make sure you use your time wisely. - [Luigi] All right, you got it, Mario, I'll go to the store right now. - [Junior] Yeah, and I'll
go start looking for stuff to put in the room. - [Mario] All right then, awesome. I'll get to cleaning then. We're gonna get this room done in no time. Make sure you don't forget the snacks. (timer ticking) Phew, okay, so I've
somehow gotta figure out what to do with all of this drywall. Come on, fit in there, I
know you can fit in there! Phew, all right, that was a workout. Now all I have to do is figure out how to get rid of all these
smaller pieces of wall. Oh wait, I forgot one of the first things we fetched out of the
closet was a vacuum cleaner. Okay, that's convenient,
I could just use this. I mean, I don't remember
how to use a vacuum cleaner, but I'll figure it out, I'm sure there's a learning curve to it. Ah, it's so loud, it's scaring me! (timer ticking) - [Junior] Ah, all right, so
my job is to look for stuff to put in the game room. And where better to go than our game room? Let's see what's in here that
I can put in the secret room. Maybe I could find something on these gaming shelves
to bring into the room. Like, oh, my PSP, yeah, I
could bring my PSP in there and I could play it, but it's a little dated though, I'm sure we could find
something newer than that. Like, (gasps) the Steam
Deck, I should bring that, the Steam Deck is awesome, I can play like my PC games on here. Ooh, my ""Fortnite"" figures,
my prized possession. I'm gonna bring the little
burger guy. (laughs) And you know I've gotta bring
Jonesy as well, come with me. Hmm, let's see, should I bring
any of these Game Cube games? Wait, I'm not even bringing
a Game Cube to begin with, what am I talking about? Okay, what else do we got here? Oh, a mini fridge, oh,
I wonder what's in here. Ah, let me see. Ooh, we got some sodas,
we got some Gatorades, we got some waters. Okay, we got a lot of stuff
in here that we can use. But, (gasps) wait,
gaming room, mini fridge. I think I have the exact thing for this. Yes, I forgot we even had this
thing, the Xbox mini fridge. We can store all of our
awesome drinks in there and keep them cool. All right, let me take this with me. And I guess I could take
this PlayStation pillow, you know, just to add to
the theme of the room. (grunts) Okay, I've got everything that I wanna bring to
the secret gaming room, now let's take this stuff downstairs. This stuff is gonna be so useful
for our secret gaming room. Hopefully, Mario's
finished cleaning by now. - [Mario] (grunts) All right, I think I've got all the dust
out from inside of the room and outside of the room. Now all I have to do is
just set up the interior so it looks nice, and then we can start
putting stuff in there. - [Junior] Mario, special delivery. - [Mario] Huh? - [Junior] Check out
all this awesome stuff I brought from our game room. - [Mario] Oh, cool, Junior,
that stuff is awesome. What's with the ""Fortnite"" guys? - [Junior] Well, you know, I just thought they could keep me company. - [Mario] What? But it's not like you're alone in there, we're keeping you company. - [Junior] Oh, please, Mario, please let the ""Fortnite"" guys stay. - [Mario] Well, I mean, they could stay, I just thought it was kind
of random, but whatever, I mean, we need anything we can get. - [Junior] Yay, awesome. All right, now let's start
moving this stuff in. - [Mario] Whoa, whoa,
whoa, not yet, Junior, I'm not actually finished yet, I only finished clearing out the dust, but now I still have
to set up the interior. - [Junior] Oh, well, okay then, what else am I supposed to do? - [Mario] Well, you said you only looked in our game room, right? Start searching in the other rooms and see if there's
anything else to put in. - [Junior] Oh yeah, I probably should have looked
more than just that one room. Okay, Mario, I'll go start
looking for more stuff. - [Mario] Awesome, keep
the stuff coming, Junior. All right, time to set this up. Let me try to find a blanket. We need to get as much stuff
for the room as we can, and we've gotta have a blanket, I don't wanna get
splinters from the floor. - [Luigi] Woohoo, making good progress, this room's gonna be awesome. - [Bowser] Maybe Walmart will
make a pretty good pit stop. All right, I gotta pick up
some groceries from Walmart and hopefully this will help
me clear my head a little. - [Luigi] Oh, this shopping
trip is going awesome. The guys are gonna love
this stuff I got for them. Now all I gotta do is find wherever the heck the checkout is. Oh my God, (shivers) what
the heck is he doing here? - [Bowser] Hopefully, I can
find some good food here. (gasps) Green beans, oh, I should definitely
get some green beans here. Huh? - [Jeffy] Don't wanna get the green beans! - [Marvin] No, Jeffy, stop it, no, Jeffy, you're making a
mess of the store, stop. - [Bowser] What are you doing that to the green beans for? - [Jeffy] I hate them. - [Bowser] Ah, you're gonna get it! (fists pounding) - [Marvin] Stop, stop, stop, stop, stop. - [Luigi] Oh my God, I have to get outta here
as soon as possible! Oh, man, how fast can
you get outta Walmart? Oh, I'm gonna have to
check out really quick. There we go, I'm on my way, guys. - [Mario] All right, we
moved all the stuff in. (grunts) Okay, Junior,
so what food do you think that we should bring into the secret room? - [Junior] (grunts) Hmm, well, we should definitely bring some Doritos. - [Mario] (gasps) Oh
yeah, that sounds perfect. And maybe for some drinks we could bring some Gatorades
for the mini fridge. - [Junior] Oh yeah, we're definitely gonna
get thirsty in there, that room is burning hot. - [Luigi] (panting) Hi guys, I'm back. - [Mario] Oh, Luigi, what happened to you? - [Junior] Yeah, why are
you so out of breath? - [Luigi] (pants) Because, guys, you won't believe who I saw at the store. I saw Bowser, he was at
the same store as me. - [Mario] What? There's no way, I thought he
was trying to rush back home. - [Luigi] Yeah, but I guess he made a stop at the same store I was at, I actually saw him kind
of in a decent mood, so I almost calmed down a little. But then I saw him get angry again 'cause somebody kept trying to annoy him. So I guess he's rushing back home still. - [Junior] Aw, man. Wait a minute, so if you
were at the same store as him and you guys were both rushing home, then doesn't that mean
that he's really close? - [Luigi] Well, I don't really know exactly when he left the store and I kind of just immediately checked out as soon as I saw him. But I think he should be coming here soon. - [Mario] Wait, so how
much time do we have? (timer ticking) That's not a lot of time. We have to hurry and set that stuff up. - [Luigi] Oh yeah, yeah, right. Okay, guys, let's get to setting this stuff up really quickly. Okay, okay. - [Mario] Okay, we gotta put the Gatorades in the mini fridge. Luigi, go set the
popcorn in the microwave. We're gonna set everything
else up in the meantime. - [Luigi] Okay, Mario, will do! Where even is the popcorn? - [Mario] Okay, perfect, thank you. All right, time to get these in. - [Luigi] I've got the popcorn. Okay, let me just throw it in there, and then let me just do like, I don't know, like two minutes or so. Okay, go fast, go faster,
go faster, go faster. I need more than two minutes! - [Mario] Okay, time to
start putting these in. Okay, so I put this one and then this one, and it's like the perfect amount of room. Okay, perfect, all right,
this one and then this one. Okay, and that should be it for now. I don't think we need
anything else in the fridge. (dramatic music) - [Luigi] Oh, come on,
popcorn, you have to hurry up, I have to get back to that room. - [Junior] This controller
is so cool, oh my God, I can't wait to play the
Switch on this thing. - [Mario] Yeah, yeah, yeah,
that's awesome, Junior. But we gotta stay focused, okay? We gotta keep moving things in here. Here's your Switch case, I
gotta go get everything else. - [Junior] Ooh, this is the best day ever. (dramatic music continues) - [Luigi] Oh, come on, you
can go faster than that. - [Mario] Okay, this should
be one of the last things, this game of Jenga. Now I have to go get the Mario LED lights and the arcade machines. - [Junior] Arcade machines? We're gonna have so many
video games in here. Let me help you, Mario. (dramatic music continues) - [Luigi] Almost done, almost done! Hurry up, popcorn, hurry up! - [Mario] Okay, we gotta put these arcade machines somewhere. I think there's enough space here, but we gotta move the Doritos. Ah, fits perfectly. Now where do we put the LED Mario lights? - [Junior] Maybe they should just go here instead of sitting against the wall? Oh my God, they look so cool. - [Mario] Okay, awesome, Junior, it looks like most of the secret room is completely finished. Now all we have to do is wait
for Luigi with that popcorn. (dramatic music continues) (microwave beeps)
- Oh my God, it's done! Okay, let's get this out. All right, I got the popcorn bag, let me just like grab
it from the other end and then I gotta like
put it all in the bucket. (pants) There we go, okay, okay, let's go. Okay, guys, I've got the popcorn. Now, I think we're almost ready. - [Mario] What? Luigi, this doesn't even
fill up half the bucket. - [Luigi] Well, I don't know, I just heated up a bag of
popcorn and I poured it in there, that's what they gave me. - [Junior] Ugh, why does it
feel so much more humid in here? - [Luigi] Oh wait, if we're staying here
in a cramped hot space, I probably shouldn't have made popcorn, it's just gonna steam up the whole room. - [Mario] Ugh, it's fine, there's a lot of things that we should have planned out better, like the fact that this basketball goal has like the weakest
suction cups in the world, look, like it's literally being propped up by the open fridge door. So like our drinks aren't
even gonna be cold anymore. Look, if you try to prop it
up somewhere, it just falls, it doesn't work. - [Junior] Well, okay, yeah, yeah, yeah, we didn't set up the room perfectly, but I don't think we have
enough time to complain, guys, what do we need left? - [Luigi] Hmm, I mean, it
looks like we have everything. (gasps) My skateboard! - [Mario] Luigi, we only
have like a few minutes left and you're worried about some skateboard? - [Luigi] Well, yeah, I left my little Hot Wheels
Tech Deck thing out there, I have to go get it. - [Mario] Luigi. I don't
think that's important. - [Luigi] Well, it's important to me, I bought it so I wanna
play with it in the room. Okay, now where did I put it? (gasps) Skateboard, oh,
thank God you're okay. Okay, now let's go to the room together. Wait a minute, Mario, we
still have a big problem. Well, we still have a
huge hole in the wall, so the room is still really easily visible to someone outside, we have
to cover it with something. - [Junior] Well, I mean, it's not like he has any reason to
open this closet door, we never use this closet. - [Mario] No, no, no, I think he actually has a point, Junior, we do need to cover that
hole with something, we could cover it with like a poster. - [Junior] Oh yeah, we have a bunch of movie posters upstairs. Okay, one of you guys go get it. - [Luigi] Yeah, Mario,
you go get the poster, I'm gonna play with my skateboard. Ugh, ah! - [Mario] Well, come on, guys,
really? You're choosing me? We don't have time for this, but we don't have time to
debate over this either. Okay, I gotta go get the poster. Okay, we have less than a minute left. So I have to go up to
our game and movie room to grab the poster. - [Luigi] Hurry up, Mario. - [Mario] I'm going as fast as I can. I have to get to the TV room,
that's where the posters are. I think this Spider-Man
poster will work perfectly. Let me just grab it off the wall. Okay, time to close this door behind me, and now time to put the
poster in the way of the hole. There we go, okay, Bowser shouldn't be able
to see in through there. So now we can just go to
our game room and relax. - [Luigi] Wait, so we're all done then? - [Mario] Yep, we're all done
with our secret gaming room. Now all we have to do is
wait for Bowser to come in. - [Junior] But how are we
gonna know when he comes in? - [Mario] Oh, easy, I'm
glad you asked because... So while you were
upstairs looking for stuff to put in the secret room, I set up cameras all across the house, so now we have a camera
system to watch Bowser. - [Luigi] Wait, but what's
the point of a camera system if we're not leaving? - [Mario] Huh? What are
you talking about, Luigi? - [Junior] I think he means the fact that it's not like we're playing
hide and seek from him, I mean, once he finds this room, he finds this room and it's
over, we're not moving anywhere. - [Luigi] Yeah, so there
wouldn't be any need for cameras. - [Mario] Well, I don't know, I guess we could just like
laugh at him or something. - [Junior] Mm, yeah, that's
a good enough reason for me. - [Luigi] Yeah, same
here, he's ridiculous. I'm gonna be way too
curious about his antics while I'm in here. - [Mario] Yeah, exactly, guys. Okay, now let's check the outside camera. (gasps) He's right there. - [Bowser] (grunts) They're
so dead when I get in there. (timer beeping)
- Hmm, I feel like he could easily find us in an hour, Mario. - [Luigi] Yeah, I mean,
our house is kind of big, but I don't know if it's that big. - [Mario] No, guys,
trust me, Bowser's dumb, he's not gonna find us, he's probably gonna take like way more than an hour to find us, so we could just chill
here in this gaming room and we could watch him
through my camera system. (dramatic music) (Junior shivering) (Bowser grunting) (timer beeping) - [Luigi] (panting) What was that? - [Mario] Luigi, keep the noise
down, he's gonna hear you. - [Junior] I mean, I
can't really blame him for that reaction, why did
he come in so dramatically? - [Mario] That's just
the way he is, Junior. Remember how this conflict
started in the first place, okay? He overreacts. - [Bowser] Guys, where are you? (grunts) I'm gonna get you guys. - [Luigi] Oh my goodness,
guys, he's coming for us. I can hear him outside the wall. - [Mario] Luigi, be quiet, he's gonna hear us way easier
if we keep making noise. - [Junior] Wait a minute,
so what was the point in setting up all this gaming stuff if we can't even play it
'cause we have to be quiet? - [Mario] Well, once he's not
literally a wall away from us, or once he's upstairs, then I think we can start playing stuff. - [Junior] Hmm, okay, cool. So we just have to figure
out how to get him upstairs. - [Bowser] There's no
way they're not in here. The longer you wait, the more intense the beating's gonna be. Are you hiding behind the toaster? No, I don't see you there. Where could you? What is this? Popcorn bag? Oh, so you guys wanna have a
popcorn party without me, huh? I'm totally gonna kill you guys. I just know that you guys are in here. Ah, no, you're not in the air fryer, but are you in the dishwasher? No, I don't see you in there either. Hmm, I wonder why this
fireplace is all walled up. One of you has to be in
here, are you in here? No, you guys aren't Santa Claus. Huh, where are you guys? This is starting to make me really mad. Where could they be? - [Luigi] (singing) Guys, check it out, my skateboard's like a little spider. - [Junior] (groans) I'm bored, I wanna start playing video games. Mario, how do we get him upstairs? - [Mario] Well, he's still down here. He's just kind of being an idiot. (gasps) I should call him,
yeah, I should do that. Okay, let me give him a false hint. (phone ringing)
- Okay, come on, Bowser, you have to answer, you
have to answer, man, I know you have your phone. - [Bowser] You guys have
gotta be behind the couch. No, you're not there, but are you behind this couch? No, I don't see you guys there either. Where are you? (phone ringing) Why's my phone ringing? Hello, what do you want, Mario? I'm trying to end you guys,
you're distracting me. - [Mario] Hey, Bowser, well, you see, I actually have a little hint for you. - [Bowser] Huh? A hint? How do I know it's not a trick? - [Mario] Well, because I'm
not scared of you, Bowser, I can give you one little hint. - [Bowser] If you're not scared of me, then why are you guys hiding? - [Mario] Oh yeah, I guess
that's a valid question, but I decided to give you
a hint anyway, you know? Since, like, I feel bad for you because our hiding spot
is just so good, you know? So, like, I wanna make it
a little easier for you. - [Bowser] Hm, okay, fine, what is it? - [Mario] We are upstairs right now. - [Bowser] What? How do
I know you're not lying? You're probably just downstairs. - [Mario] (sighs) Come
on, Bowser, just go. Oh, oh, oh, wait a minute, Bowser, I just realized that was
actually the wrong hint, I gave you way too much info,
we're actually downstairs. - [Bowser] (laughs) There's no way. You really didn't mean
to reveal that to me? You must actually be upstairs,
you're such an idiot, Mario. - [Mario] Yep, I'm such an
idiot, Bowser, huh? Poor me. I'm just so clumsy with
my words, you know? So, but we're totally not
upstairs, you shouldn't check. - [Bowser] Well, thanks for being your usual stupid self, Mario. It'll really help me out a lot here. I'll see you when I can kick your butt. - [Mario] Okay, I'm looking forward to it 'cause I'm not scared of you, Bowser. Okay, guys, I think we
just bought ourselves a lot of free time. - [Junior] Ugh, what do you
mean? Did that actually work? - [Bowser] (laughs) I can't believe they actually revealed that to me. It's time to head right over there. Man, this is gonna be a breeze now, they're gonna regret giving me that hint. (footsteps banging) - [Mario] Oh my God. Dude, these footsteps are so loud. - [Luigi] Geez, are we
in a damn earthquake? What is happening? - [Junior] No, that's just
the way he always sounds. You're gonna just have to deal
with it for the time being. - [Bowser] Time to find those boys! - [Mario] G-guys, guys, he's upstairs! I actually did it, the coast is clear. - [Junior] (gasps) No way, that means gaming time!
- Gaming time! I call the arcade machines. - [Junior] Oh, good choice, Luigi. I call the Nintendo Switch
'cause of my new controller. - [Mario] Well, I call the... Actually, I'm very loyal to Nintendo, so I'm not even gonna bother
playing the Steam Deck, so I'm just gonna continue
watching Bowser on the cameras. - [Bowser] I wonder if
they would hide in here. Okay, so I know the
bathroom might seem like kind of an unlikely
place for them to be in, but I have to look everywhere I can. I mean, they could be in literally any of these
cabinets, come out of there! Come out! (sighs) They're not in there. What about these ones? No, these ones? No, I don't see them in there. This one? Ugh, no. What about these? No, I don't see them in there either. - [Mario] (laughs) Oh
my God, he is so dumb. - [Junior] Oh, come on, come on. I'm right about to beat this
level, I'm almost done... Oh, come on. - [Luigi] Oh yeah, and I'm
about to beat this too, Junior, I think, I don't really remember how to play ""Pac-Man"" though, so I don't know if you're supposed to like be friends with
the ghosts or if you're... (arcade game chiming) Well, I guess you're not supposed to be friends with the ghosts. Hey, Mario, is Bowser still upstairs? - [Mario] Yeah, from the
looks of it. Why do you ask? - [Luigi] Well, because
I had a little idea for something that we could do in here. - [Junior] And what's that, Luigi? You wanna versus me in
new ""Super Mario Bros""? - [Luigi] Hm, no, not that. I say that we have a little
basketball tournament. - [Junior] (gasps) Deal. - [Mario] I'm not very good at basketball, you guys can have fun though. - [Luigi] Oh Mario, you're so lame. Anyways, I'ma shoot another shot. Ah, there you go, oh. - [Junior] Oh yeah? Well,
now I'm gonna shoot a shot. (grunts) There we go. - [Luigi] Not until I shoot the next shot. - [Junior] Whoa, where
are you gonna go, Luigi? Where you gonna go? - [Luigi] Get out of the way, Junior, I gotta shoot the ball. - [Junior] And I'm not gonna let you. What are you gonna do, Luigi? What are you gonna do? - [Mario] Guys? You're being kinda loud. - [Luigi] What am I gonna
do, huh? I'm gonna do this. - [Junior] Ah! - [Luigi] And touchdown, woohoo! Oh my God, that was so much fun. - [Mario] Guys, guys,
you are being so loud. And it looks like Bowser
took notice of it too, he's like looking around all suspiciously. What are you guys doing? - [Luigi] Huh? Oh yeah, I guess
we're being a little crazy. Okay, let's just go back
to our normal video games. - [Junior] Yeah, that's
probably a good idea before we get Dad's attention. - [Mario] That sounds
like a way safer idea. Okay, let's see what he is doing. - [Junior] Okay, I know
I can make it this time, I know I can make it. How did I die in the same exact spot? - [Mario] Junior, you're
being a little loud. - [Junior] Well, this game
deserves it, I suck at this game, therefore, it's the game's fault. - [Luigi] Bro, Junior, you've got to try being a little quieter. (arcade game chiming) What is happening? Did I die? Oh, how did I die in this game? - [Mario] Okay, you guys
really do not understand the concept of being quiet. - [Junior] Well, I mean, you did tell us that we could be as loud as we want as
long as he's upstairs. - [Mario] Yeah, but he's
probably not gonna be upstairs that long if he can hear us
being this loud in the room. - [Luigi] Yeah, Mario is right, maybe I should just stick to playing with my skateboard instead. (gasps) I just had a great idea, Junior. - [Junior] Luigi, you don't
usually have great ideas, but what's your idea? - [Luigi] Okay, so I have
this skateboard, right? And you have these little ""Fortnite"" guys. What if we make the ""Fortnite""
guys go skateboarding? - [Junior] No. - [Luigi] What? Why? What's wrong with my idea? - [Junior] Nobody's touching
my ""Fortnite"" skins. Nobody, they're mine,
they're my prized possession. - [Mario] Junior, you
have to learn to share. I mean, you brought them
in this room for a reason, we can play with them. - [Junior] No, no, Mario, they're mine, they're my ""Fortnite"" figures. - [Luigi] Too late. Whee, I'm the little ""Fortnite"" burger guy going skateboarding or whatever the, whoa! - [Junior] No, burger guy! (dramatic music) - [Mario] Dude, stop being so loud. - [Junior] Burger guy,
burger guy, are you okay? Speak to me. (blows) Please talk to me. (pants) I hope he's alive. Luigi, why would you kill him? And why'd you make me start a level? - [Luigi] Well, I don't know, I thought he just looked kind
of awesome on a skateboard. - [Mario] You guys are both insufferable, he's gonna definitely find us soon and it's you guys' fault. - [Luigi] Well, I mean. (timer ticking) It's not even like he has
that much time left anyway, I doubt he'll find us. - [Junior] Yeah, we've been
